Model ranking;ranking;ind;relevance;review
5;83;103;0.7134149088769886;think m going write review game m sure many people read heard sides coin game m simply giving opinion based playing game long time sims player like many stated sims player since binging way back 2000 fond memories playing game thrilled announcement made sims 2 game took best parts sims 1 enhanced building top making sims 2 unique entertaining experience still amazing game sims 3 positive step open world giving sims freedom exploration freeing load screens create wheel tool amazing level customization limitless sandbox life simulation three forms family took single sim stages life getting first place job finding one married watching waddle around pregnant playing bathing baby teaching toddler walk talk times spend reading kids helping homework watching teen learn drive accepting high school diploma insures joys pains life little moments got sims 4 pale comparison predecessors longer feels like sims game sandbox gone family play gone liner goal driven made sims great took made series awesome flushed toilet replaced beefed facebook game could play sims 4 four days forcing play repetitive boring game characters despite emotions boring shallow nothing keep wanting play watch evolve thrill gone much wrong game take time google search problem finding problems lets say m sticking sims 2 sims 3 true sims game hope ea give us true sequel next generation sims game future
6;231;110;0.7080050762527702;like sims 3 hate sims 4 many cool things introduced sims 3 sims 4 briefly longer played sims 4 felt like playing sims 2 one step forward 10 steps back dont buy
7;232;53;0.7030021581645067;worst sims game ever played even called sims little game like 3 steps sims 3 underdeveloped played every sims game loved guess m done sims
8;395;58;0.6996235708873382;game gotten lot hate longtime simmers honestly see played loved sims 2 3 many expansions think sims 4 fun many say watered really think less offer original sims 3 tell expansion packs create sim hairstyles clothing limited comparison sims 4 create sim much better hardly tell makes incredibly happy since always one favorite parts n negative things come play things taken away loading screens whenever travel open world however find annoying especially sim 3 solid 15 minute loading screen toddlers could care less never liked life stage disappointing thing lack create style things want color available get used bad may good thing since spent much time nitpicking everything matched perfectly things missing released patches family trees pools ghosts basements etc people also argue sims look cartoony love new style though mean think would little creepy looked super realistic even fit game n good news game runs great even laptop crashed say sims 3 sims 4 runs like butter sims 3 like gravel new emotions great sims seem alive even fewer traits seem personality always found annoying could huge space sims could go long took someone move way sims 4 wo problem nice also multitask nice everything feels better plus important thing think game fun mean lacking think care fact expansion packs fun sim games opinion end really matters new expansion packs coming even better hardly wait pets n game worth think completely depends person definitely longtime simmers ca get toddlers cars create style open world re simmer look things game definitely enjoy anyone new series pick wo regret
9;282;86;0.6984720153947241;avid simmer playing obsessed since original sims came 10 years ago sims 4 huge disappointment notice capital huge pretty much original sims sims 2 put together gameplay changed significantly good list things missed http ts4news com post 94541924952 82 features missing from the sims 4 ni impression sims 4 would upgrade sims 3 absolutely downgrade would much rather play sims 3 would say good things create sim getting modify every part body build mode interesting new features emotions get seems like huge waste harder get promotions work complicated tasks enough like sims 3 ca even watch sims get car go work school simply disappear longer drive cars places go suck bar lounge gym library toddler stage anymore ca see infants needs dishwashers babysitters seems ruled making lots friends really social extremely hard hardly places go bad easily could made expansion sims 3 things sims 4 offers would much better re building creating sims might enjoy difference play actual sims giving life live terrible waste money
10;195;390;0.6808784711091511;could give game 4 5 stars would let start saying year half ago never would purchased game early screenshots terrible graphics emotions sounded utterly stupid fact month half release even want game however somehow got chosen one first round beta testers cas demo let tell stunned able create friends family perfect detail several hours work mind n nthere definitely bugs got left game likely due ea rushing game however want give point by point review good reviewer do n nthe good n streamlined gameplay build buy mode combined hairstyles makeup clothes recustomizing sim outside cas n n cas friggin amazing n n loading screens never 35 seconds long even travelling worlds n n worlds beautiful albeit different way sims 2 3 n n ton hidden gems spoiler alert pregnancy tests digging time capsules n n bars come base game n n cas extremely expanded children elders likely waste time animations toddlers n n babies sound look act realistically n nthe changed n create a style cast implemented differently ways customize things definitely nearly extent sims 3 styles available nice definitely keep game lagging crashing like ts3 wo do n n terrain tools due set height foundations etc reason currently pools terrain tools limited rocks trees flowers terrain paint honestly one things never really used always far preferred flat lots anyway n n cars re back zoning lots y all n n worlds favorite loved change two current worlds made several mini worlds rich neighborhood two homes middle class area 3 homes poor area 5 6 homes park strip mall within mini worlds free travel fine want change mini worlds visit world still keep relationships sit loading screen lasts 3 seconds truly combines best ts2 ts3 n n story progression story progression limited ageing neighborhood age due computer constraints wanting please less wealthy customers mainly every casual gamer wants buy completely new rig sims new babies relationships unless enable them n nthe bad n swimming pools toddlers everyone mentioned personally never used either often aside aesthetically makes real difference me n n memory system ts3 base game either m sure free update memory system n n family tree family trees well done ts3 least n n items normal base sims game lawd sometimes feels empty n nall in all give game solid 4 5 buy re expecting sims 3 better graphics truly completely different game maxis finally something right sims 2 revolution sims 1 whereas sims 3 prettier sims 2 open world n ni long said say sims game franchise one thing focused sims life simulator sims 2 generational life simulator intended story telling sims 3 open ended customize able generational life simulator n nand sims 4 life simulator tells realistic stories based upon real human emotions truly find empathizing poor creatures n ni definitely recommend fans series willing step outside comfort zone n nalso note demon babies tried going hospital click sim go hospital like would ts3
11;322;85;0.6734838701471629;sims lover beginning faithful customer games advanced years said reading reviews sims 4 skeptical everyone expressed negative opinions discovered long time debating grieving new sims discovered origin 48 hour game time trial went download trial waited till three day weekend give try absolutely magnificent n npro n create sim build buy mode much efficient longer half enter create sim gazillion times twins birthday one click edit whole household also flipping build buy one quick convenience n life time wishes changeable cost sim move back forth lifetime wishes without loosing progress paying it n auto solve needs honestly love though sometimes work well sims tired say sim hungry simply click hunger need needs panel sim go feed themselves n multitasking probably best advancement sims homework chat listen music feet pool warm afternoon sun actually saw sim eating dinner toilet found hysterical n no need pay babysitter baby sims work baby simply go daycare extra charge n wider variety skills violin made return along piano also rocket ship build explore with n no toddler years never really enjoyed toddler portion sim life appreciated part n pregnancy test yes young adult adult female sims take pregnancy tests longer jingle try baby order find sim pregnant need click toilet pay 15 find results sim immediately showing also 48 hour experience sims get pregnant first try 6 generations sims trouble getting one pregnant n tenn sims mess around teen boyfriend girlfriend mess around bed chance pregnancy this n teens also exchange promise rings n mothers mow breast feed babies n throwing parties much simple n motherlode still works n updated family tree originally major downside recent update include family tree n grades longer effect aging traits still choose traits even c n i also unsure whole emotions thing really like it n there lot variety food activities n in lot ways reminds sims 2 personally mind really like sims 2 n ncons n no create style everything comes options colors like sims 2 things however wide variety choose from n smaller city two small towns however switch back forth time also time bigger home simple demolish empty one previous residents died anyways n not many career paths think solve problem new expansion pack n for life span short normal long customize amount days age n still little glitchy new game sims 3 still glitches time time 5 years old technology nothing major sometimes stop re minute need tell all n i felt like needs declined faster may me n noverall 48 hour experience great game mean think back sims 3 spent money expansion packs pretty basic game base game sims 3 touch ups make bit different better become great game expansion packs sure put major difference price nso putting game easter basket re unsure like great game fret completely recommend sims players world n ni hope review made positive difference opinion great game happy simming
12;84;44;0.6512928288000729;first got introduced sims 3 game years ago absolutely fell love could much game ranging exploring large worlds learning new skills fishing gardening tryout new jobs engaging crazy social behaviors us would dare try real life without ending psych ward etc touch real life great sense humor could come home job enjoy relaxing sims trying something new wacky oh crazy social relationship experiences one could explore sims n nhowever ea released sims 4 quickly discovered greatly changed experience made nice improvements lot fun simply mia missing action first good game n n1 stability improvements game seems crash less huge improvement compared previous edition n2 graphic engine improvement giving sims world improved appearance n3 multitasking sim surf web using bathroom etc table conversations eating actually look like real life conversations multitasking probably one biggest improvements series n4 free enhancements improved game restoring back swimming pools etc n nwhat wrong game n n1 missing open world n nthe open world gave feel lived actual community saw neighbors driving work morning saw family take group trips beach library parents would drop kids school kids would ride home bicycles people walked jogged around community neighborhood dropping say hi times passed neighbors moved away town burglaries could happen strikes would occur police would patrol neighborhood local park developed friendships invited parties baked homemade goods became like family worst enemies felt like part world vice versa n nif loved outdoors huge world explore could hike hills picnic girlfriend fantastic evening view moon lite bay top forested hill might find pink diamond carve wedding gift one loved canyons explore ancient writings walls lakes fish gardening etc ton fun sims 3 n nthe lack open world means everything happens ridiculously small shoe box example go library part world re allowed experience small crowded room tables bookshelves little room navigate reminds shopping hectic store holiday season feel like screaming people get way run shopping cart n ntake girlfriend library find almost impossible experience anything socially ton sims seem automatically programmed nothing randomly bug constantly feels like went swamp every sim room pesky mosquito needs swatted submission n nthe large open world made sims 3 much fun without small shoe box limited opportunities unless swatting pesky mosquito like sims type enjoyment n n2 world flat n none thing loved sims 3 could rise lower land creating dynamic landscapes beautiful could create sunken gardens build ponds exotic fish etc world pure flat re limited design wise create hills could climb top picnics girlfriend etc oh romantic view nope gone planet pure flat boring n n3 buy buy buy n nthe game feels like redesigned primarily perpetual shopping experience entertaining game actual substance get greeted buy buy messages start game focus seems buy buy buy let fun rewarding experience n njust fair purchased variety sims 4 expansion packs see game would improve nope come conclusion m done buying expansion packs stuff sims 4 maybe sims 5 eventually worth considering again n n4 game feels cheapened many levels n nthe sims seem intelligent behavior feels like game picks crazy random event happen sims granny suddenly push ups middle crowded library lobby huh n n5 worlds small cheap feeling police station fire department city hall hospital etc striking town hall bumming beach park feels like rushed market thought n nif could give 0 5 stars would
13;352;29;0.6205677974069034;honestly super excited get game christmas opened began play highly disappointed understand base game sims 3 base game far impressive one lots small towns small another thing map like playstation version sims one thing enjoyed sims 3 hoping change could watch sim walk around town loading screen free roam town sims 4 chose wan na go bam load screen honestly m switching back sims 3 oh another thing really like made game single use serial code becausw foster home played game using origin account turned 18 moved place tried install game computer would let contacted ea support said buy new copy expected purchase another 80 dollar game already made single serial code game fond sims 4
14;243;35;0.6132397584872703;pre ordered game ea announced available order 2014 anxiously awaited game thrilled arrived said tell last time played game played sims since first sims game first sims reinvented new version highly disappointing reeled back functionality available sims 3 wish could return game refund went avid fan someone cringes mention sims major game changers n nyou operate one sim time different lots example sim library another home unable go back forth controlling able previous versions n nno open world sims walk around neighborhood meet new people like able previous version n nthe dynamics background lacking n nit quite possible ea fixed things expansion packs paid full price game half features last one n nwith said love building grand homes version allows easily
15;259;126;0.5930437515022497;updating 12 22 2014 factor changes came patch introduced 2 new careers amazon allowed d 3 5 star rating however still toddlers still wo give 4 stars yes toddlers would also back base game say 30 40 decent price range n nupdates spotted game nice touches add small bit spark back game n ui adjusted especially job school panel makes information job level clearly visible much easier know best mood performance enhancement phone interface also changed instead list 4 icons sub menus n sim needs bathe grunge longer green cloud sims acquire layer visible dirt grime first franchise kudo design team n knowing age group sims re chatting possible town age group m listing spotted far d guess applies playable age groups listed directly sims name n added business sports career tracks complete outfits rewards n nthere probably little touches added spotted yet n nreview mmdrgntobldrgn aka mama dragon http mmdrgntobldrgn wordpress com n ni purchased copy origin digital download since day one made mistake installing right away even though knew would able play weekend uni schedule n nfor game play content expect game features previous series since new base game new incarnation series also aware missing toddlers pools along cas limitations reason caved new woodworking skill n nthe first hours played around premier night left feeling unhappy game chalked cas already played free cas demo weeks august told rush decision chance get properly game day 1 would said 1 star n nweekend finally arrived spent serious time game getting used look tween fluffy feel good graphics basic mechanics programing along new ui end first day play felt game 2 star game ready ask money back ouch reread great game guarantee installed day 1 eligible yes could called argued case fought refund simming since sims 1 decided give second chance hopes finding redeeming qualities game playing trying find ways get game n nbecause patch ghosts promised patch pools game moved 3 stars ever patch toddlers bring 3 5 4 stars likely never give incarnation sims 5 star rating 5 star would go back completely rework graphics grow visuals instead aging tween disney crowd n n like besides toddlers n game wish sim level career achieve lifetime goal spend lot time many mini tasks dating meter back sims 2 dates anymore also party social gatherings n loading screens fake open world feel n lack cast create style base game content lighter past base games inability recolor without mod stands heavily n starting base game content lighter previous incarnations game made worse fact third locked complete certain tasks career levels n turn tutorial enter cheat command code origin interface start game n legacy player ca start 50x50 lot largest available 1st start small lot pick large one bulldoze move sim large lot n fan object baby tied bassinet n sims spend almost every free minute mourning deceased watched even weeks later n sims ca paint portraits n family tree s n story progression townies like s2 n babies go infant child like s1 transition stage n teens close appearance adults n burglars handymen gardeners n collections tracker 100 accurate include base game plants patched plant n ca add space lots limited selection places want something different bulldoze something n big fan nothing new foundations like new height varieties slider allows higher foundations n plastic hair even little less plastic first promo images n n like m willing give 3 stars n woodworking skill n despite loading screens lot neighborhood area semi decent unincorporated surrounding explore roam around hitting need loading screen hence comment fake open world n decent assortment musical instruments including violins children start started s3 base might recall uproar piano left base game n later added expansion online store digital content items carried base game items cow plant even s1 base game fan favorite caution dies easily without constant attention time round violins voodoo doll n ghosts back pools promised n new building tools nice work ruthless kk studio shows possible finally get cleaner build versions building styles n n stuff m meh n plants really die evolve get higher quality n back always nice weather speak of n wonderful new build features troublesome spaces enclosed rooms build features work properly n classic cheats still around re needed n nend point m happy thrilled generation sims may buy future expansions still play copy wo completely wasted really advocate getting copy especially loved sims 3 and or toddlers still play s3 s4 n nps weird alien morph baby shown one pic fixed ea patch early october
16;417;136;0.5771296786297376;happy bought thought gon na rock sucks much n n like sims 2 went years back really town really jobs n n sims look like cartoons sims 3 great detail looks like clay n n confusing inventory know anyone else problem kept getting confuse what n n doors walls unrealistically tall n nin opinion horribly thing liked walking children outfits thats shouldve stuck expansion packs sims 3 hope review helped
17;246;26;0.3604785033552146;like took world map away sims 3 could see sims walk jog and or drive place place like took step backwards like go somewhere get loading screen appear location need bring feature back
18;137;12;0.31241050341769033;sims going sims 3 way better love
19;277;21;0.2908785181522517;read reviews wanted know ran windows 10 difficult find answer running never sims 3 compare sims 2 think would run win 10 age might besides visual difference think games similar yes differences feel game much same nmy biggest problem game see big one thought giving two stars origin ordered disks expected load disks tried load brings origin download game extensions bonus packs etc plus games origins wants sell starts downloading pace close 18 hours downloading number tries find path download origins went online looking answers find get load disks lot help sites lot ideas electronic arts site much help trying number approaches finding online manage get download origins 3 hours none tricks trying worked exactly laid possibly difference win 10 ever win version used buying disks load spent 12 hours trying find 3 hours downloading origins nwhen go play game double clicking sims icon origins password screen comes first sign brief pause game starts far wyfy playing suspect without wyfy access game exit game origin still running close independently see purpose origin amazon known going difficulties getting game run going run thru origin would skipped m overly impressed game beyond similarity sims2 look expansion packs see going see adding much game maybe m disappointed electronic arts lack support win 10 origin issues
