;ranking;overall;vote;elapsedDays;reviewText;summary
88;79.0;5.0;14.0;3948;I purchased this item as a glorified lunch box to take to work with me - to save both money, and have a wider variety of different foods.  This container has definitely been worth its money so far.  Food can be prepared the evening before, and each compartment refrigerated separately.  In the morning, just toss all the compartments into the thermos and the food remains cold easily until lunch time.\n\nThe picture itself doesn't do the product justice.  As mentioned already, there are lids for each of the compartments, and the compartments are microwave safe.  The whole package is much larger than one may anticipate though, measuring around 6 inches tall, 4 inches in diameter not counting the carrying case. It's large enough to fit in pretty much any backpack, just expect it to take some space.  The actual carrying case has some handles to carry it not only in your hand but over your shoulder as well.\n\nI definitely recommend this product.  In the long run one will eat most likely somewhat healthier (especially if eating things like rice), and will save money.;Large volume of food on the go.
89;137.0;4.0;7.0;3969;The Zojirushi Mr. Bento Lunch Jar is a convenient and earth friendly way to carry a daily lunch to school or work.  I enjoy the four insert jars, they are easy to clean and fill with fresh food of most sizes.  The outer case can be chilled or heated (with hot water) to keep foods cold or warm until lunch time.  A drawback here:  all the jars would need to be either hot or cold, so I usually keep them cold to reheat whatever needs it later.  The canvas carry case is trendy and discreet.;Compact and Convenient Lunch Jar
90;156.0;4.0;5.0;3977;this is a great product. It keeps my meals warm and i can enjoy home cook meal at college;Great
91;157.0;5.0;5.0;3984;Simple...microwavable.  You don't need directions.  Foolproof product.  This lunchbox forces you to portion control and also to pack a variety of food items by the simple nature of it's design etc.\n\nIf you're on the fence.....go for it!;love it!
92;38.0;5.0;27.0;3995;"We're about a month into school lunches in the Mr. Bento, and we couldn't be happier.  The ""soup"" container and the ""locking lid"" container above it keep hot food hot for at least four hours (we haven't tested them longer than that yet).  I've sent soup, pasta, cut pieces of meat and vegetables--things that would never fly in a cold lunch--and my son gives me the thumbs up every time.\n\nNot having to use baggies, plastic wrap, foil or pre-portioned packages is great--both economically and ecologically.\n\nI do usually send a juice bag or juice box and have found that I can fit one easily by putting it right on top of the lunch jar, but within the fabric carrier . . . the drawstring closure holds the drink in place well.  If you had a plastic bottle or a 12 oz can of something, you'd probably have to pack it separately.\n\nThere is something about the Mr. Bento that lends itself to lunch-making enthusiasm, I must say.  Not only is it great to be able to use good leftovers and send ""real food"" for lunch, but my son and I have fun thinking of foods and combinations of foods to prep and pack.  My husband and I are considering buying Mr. Bentos for our lunches too (I guess we'll start saving up).\n\nYou can do cold items and hot items in the same lunch, but I put room temp items in one of the containers in between as a buffer.  One time I tried to send hot food in the soup container and cold slices of cheese in the container right above it.  The cheese got a bit melty, I hear.\n\nOne piece of input from my son (age 10) was for me not to crank the watertight lid closed so hard that he can't get it open.  It was only a problem once, but worth passing on a heads-up.\n\nI would definitely recommend the Mr. Bento.  And if you do buy it, check out the photos dedicated to Mr. Bento lunches on Flickr--very entertaining as well as a source for creative lunch ideas!";Does exactly what we hoped it would.
93;6.0;5.0;127.0;4000;I've had my Mr. Bento for a little over one year, and it's been a wonderful and handy lunchbox. It keeps food warm or cold as needed, doesn't leak, doesn't stain, doesn't absorb odors, and is relatively easy to clean. It helps immensely with portion sizes, makes packing a lunch actually fun (who knew?), and is just a pleasure to have. This is one purchase I definitely don't regret, and it was worth the price!\n\nEdit: I've now had this Mr. Bento for 10 years, and my above review holds true in every aspect. I still use this, and it still doesn't leak, stain, or stink, and cleans quite easily.;Wonderful
94;27.0;5.0;37.0;4016;Ever since the reports about the risks of chemicals leeching from plastics that have been microwaved, I've been wary of carrying microwaveable lunches to work. I was very happy to find this lunch jar. I chose to buy the Classic Lunch Jar instead of the four-container Mr. Bento because I wanted the larger volume, but I have found that the Classic Lunch Jar can hold more food than I can eat (I'm a woman who can put away a large prime rib for dinner, but not in need of huge quantities for lunch). The middle container for the Classic Lunch Jar, which stands about 3.5 inches deep and 4 inches wide, is cavernous, and can alone hold more than a modest dinnerplate's worth of food.\n\nI've found that putting soup into the bottom container is essential to keeping the middle container hot. It acts as the heat pack for the middle container. I usually heat canned soup in the morning in a pan, and pour it near-boiling into the container, and drop it into the bottom of the jar to start off. After 4 hours, the soup will still be too hot to eat!\n\nThen, for the middle container, I heat up some leftover starches (rice, potatoes, etc.) and some sort of entree. I put the starches on the bottom, and pile the entree on top. The lid of the middle container has a hollow space built in to insulate it from the top container. The food in the middle container is still quite hot after 4 hours.\n\nThe top container should be reserved for something that would be eaten at room temperature. I think it was designed that way, judging by the pictures on the packaging. I can't read Japanese, so I was only able to guess. The picture shaded the jar from red to orange to yellow to white, starting from the bottom, which accurately corresponds to the temperature of my food after 4 hours (red being hottest, white being room temp).\n\nI've tried putting an entree in the top container, to separate it from the starches, but it had cooled to near room temperature by the time I opened it 4 hours later. On the other hand, I've also put salad in there, and the salad was unmarred by the heat of the bottom containers after 4 hours.\n\nIf you're going to put cold food into the top container, I would recommend that you leave the top inch of the middle container empty as a heat buffer.\n\nThe only awkward thing about the container is that the soup container has a rubber ring gasket and a tiny dime-sized rubber vent cover, both of which need to be popped off and cleaned after each use. Otherwise, gunk will get into the gaps and get really gross. I've found that sticking the pointy end of the chopstick into the gasket groove will pry the thing out easily, and the valve cover is easy enough to take off. My only concern is that I swear that I'm going to lose or break either of them one day soon. But if that's the secret to being able to keep soup boiling hot for hours in a container that screws shut without leaking, then I'm willing to put in the extra effort.\n\nNeedless to say, I love this lunch jar, and would recommend it to anyone.\n\nCheck out the Zojirushi Lunch Jar fan club in Flickr. People have posted pictures of their lunches each day for all to admire. It's entitled Mr. Bento Porn.;Keeping food hot and cold at once
95;110.0;5.0;9.0;4019;I bought this for myself and I love it. Only the bottom two containers keep the temperature, the top two go to room temperature. Anyone who complains hasn't read the directions. This kept my salad today nice and fresh.;Absolutely Awesome
96;111.0;5.0;9.0;4022;I love this product!  Its compact and handy, the portion control is great, I haven't had issues with leaks as long as I use the correct container, tt keeps hot things hot and cold things cold and it comes with chopsticks!  Its perfect!;Best Lunch Container I've Ever Used
97;121.0;5.0;8.0;4023;This was purchased for my husband at christmas. He's a big guy and has twice mentioned that there was too much food for him in it!\n\nWashes easily, and would definitely recommend.;What more can I say
98;90.0;5.0;12.0;4023;I bought the initial box a few months back and it is awesome. Some people have complained on this site regards leaks. Let me tell you something. I sometimes take soup in the soup container. I keep the whole box on the passenger side while I drive. Breaking hard a few times or taking corners the things fell on the on the floor of the car. But nothing leaked. Not even a drop. So not sure what these people are talking about. They must be absolute morons and not closed the lid properly!\n\nMy wife bought one more for herself and buying another for our daughter. Absolutely the best. However I see Amazon has increased the price quite a bit since I first brought it.;Awesome product - buying more of these
99;122.0;5.0;8.0;4024;I have been using for about a month.  No spills yet.  Food always piping hot (after about 4 hours).  It encourages me to eat heathful food every day!  Having soup for lunch really is quite nice.\n\nOn the downside (I knew this before I bought...but even so):  the dishes should dishwasher friendly (they are microwaveable).  They are easy to clean though and I sue it every day.\n\nOverall, good quality, easy to use and a little fun too!;Very good overall
100;91.0;5.0;12.0;4025;I live in Japan as I am currently stationed here in the military. I  bought 3 of these.  I love them, especially the portion control factor.\n\nHate to tell you guys this, but the Zojirushi Mr. Bento is only 2450 Yen, or $22.00 US dollars.  I can't believe they are being sold in the States for double and triple the price!  Still, it's worth every penny and a good conversation starter.;Lunch Jars Are Cheap in Japan
101;112.0;5.0;9.0;4025;I have only been using this for a little over a week, and I am already in love with this Mr. Bento. I would just hit Wendy's or the lame cafeteria for my lunch, but with this I can bypass that and bring all my goodies from home. I would like to bring lunches from home, but would get aggrivated with containers, finding a bag to put it all in, and leakage. With Mr. Bento I am free from all of that hassle. I normall pack a main dish, a side, like soup or some noodles, some veggies, and a little snack. It keeps me satisified throughout my 8-10 hour workday.\n\nI been looking at this for the longest time and finally purchased it when I saw it was on Sale through Amazon. It has already paid for itself with just a week of use. I would normally spend 5-6 dollars on lunch...eating yucky food. Now I have my delicious meals with things I like to eat at my hand.\n\nIf you're contemplating it, just spurge and get it, I assure you that it's worth it!;Best investment for myself!!!
102;113.0;4.0;9.0;4026;Mr Bento is pricey, but it pays for itself after a week. I have saved so much money since I started taking my lunch to work and Mr Bento just makes it easier and fun. No more crushed food sitting in the backpack. And after weeks of eating good homecooked food, I wonder how I could have possibly enjoyed the drab food I was eating at the food court(trough) in our high rise. I have packed hot soup in Mr Bento and have not had problems with spilling. I am careful to hold it upright - easy to do with the handles. And I do preheat the containers when packing hot foods. For cold foods, I pack the night before and leave it in the fridge until I go to work. I keep it at my desk and things stay hot or cold. I have not been sucessful with mixed hot things and cold things. Although I have run across some tips on how to do that it hasn't worked well for me. It seems very well constructed - I have dropped it a few times and it doesn't seem to have affected it at all. It is somewhat large but it is compact and holds a lot of food. I get enough food packed for lunch and a mid morning snack. It could fit into a decent sized backpack but I carry it separately to make sure it stays upright. I did get the Japanese version with the chopsticks and holder and instructions in japanese, but you can download the manual from their website - here's the link:\n\n[...]\n\nAlso, there's a group devoted to Mr Bento if you ever need some ideas on what to pack and how - just do a search for mrbento on flickr to see great photos of packed Mr Bentos.;Great money saver.
103;92.0;4.0;12.0;4031;Udon still steaming,\n\nTasty treats, cutely packaged.\n\nThanks, Mister Bento!;A haiku review (Zojirushi Mr. Bento Stainless-Steel lined Lunch Jar, Silver)
104;84.0;5.0;13.0;4034;"Most of the negative reviews I read of this item before I bought it turned out to be from people who didn't read the instructions.  (Or didn't get the English version of the insructions with their Mr. Bento.)  Most of the bowls are not intended to hold liquids and will leak if used improperly.\n\nMe, I love it! Convenient, easy to cary, good for portion control.\n\nMy use: Little soup bowl - milk for my breakfast.  Large thermal bowl - lunch perishables (turkey, cheese, whatever).  Large plain bowl - Kashi cereal, ready to pour the milk! Small plain bowl, raw veggies to go with lunch.  Bag chopstick pocket also holds fork and spoon.  Tortillas or pitas can go in the bag, around the lunch jar (in plastic or wax paper, of course).  Outside pocket holds protien bar and a bottle of water.  Orange fits in the bag on top of the jar, then pull drawstring to hold it.  Pack the whole thing the night before and leave in the fridge - grab n go at 5:30 in the morning; by 11:00, lunch items are still cold because the entire jar was chilled.";Read the instructions!
105;72.0;5.0;16.0;4042;The little compartments are great for packing an amazing variety of dishes in a compact space. My co-workers are in awe at what I unpack each day: salads, fruit, yogurt, soups, rice, pasta, hummus, nuts, curry, steamed veggies. The food doesn't really stay hot though, since the container is not airtight - it is not quite a thermos, though it does provide a bit of insulation - enough for maybe a couple of hours. At least the containers are microwavable (without the lids). Do wish a handle was included on the container - it's a bit slippery to grasp when out of its carrying bag. Overall, makes lunchtime great fun.;eating healthy on the go
106;138.0;5.0;7.0;4043;Foods stay warm/cold and the serving size is just right and appropriate if you are watching your food intake.  I love it and had recommended it to my daughter as well...It's worth the price.;Excellent purchase
107;158.0;5.0;5.0;4047;I have really enjoyed this fun way to take lunch to work. My friend and I look for creative, colorful lunch and snack ideas for the bento. It's a great way to keep portions in check and stay away from the snack machine at work. Check out the web for fun food ideas for your bento!;Domo arigato Mr. Bento
108;46.0;5.0;24.0;4050;"I am so excited to find this product for my two children's school lunches.  They are 13 and 12 and we are really trying to eat healthy.  The final straw for me was eating a school lunch with my kids one day last semester and they had FRIED BROCCOLI!!!  I couldn't believe the school system was calling this improved healthy eating!  My kids wanted to take their lunches, but didn't want to always have a cold sandwich, they wanted a HOT lunch.  THIS ITEM REALLY WORKS!  I have been packing them HOT and COLD items in the 4 containers and their friends have been amazed when they open up their lunch and IT IS STEAMING after being packed for 6 1/2 hours! I can finally send my kids off with healthy, home-made food (to which their friends are saying ""I wish my Mom would send my lunch. That looks so good"").  I find myself looking at the clock during their lunch times and smiling because I know what they are eating and I'm thrilled when I pick them up and ask how was lunch and they are say ""MMMM good, MOM Thanks!""  Then I don't mind getting up at 5:30 and fixing both their lunch and breakfasts because the gratification of knowing they are eating healhty and feeling loved is PRICELESS!\n\nThe tricks I had read about really work, I put boiling water into the containers I want to stay hot and the outer container, and ice in the containers I want to stay cold and let them sit while I prepare the food.  Then I make sure that the hot food is steaming hot before I pack it up in the preheated containers.  Same for cold items being chilled before packing.  As soon as the kids get home, they empty out their lunch containers and put into a sink of soapy water, I wash and put into the disk rack and everything's ready for the next morning!";FINALLY! Healthy School Lunches for my kids!
109;85.0;2.0;13.0;4063;I followed all instructions including filling container\n\nwith hot water to warm it before packing lunch. Everything\n\nwas cold to room temperature 3 hours later. Nothing here to\n\njustify the high price or the amount of work to clean this thing. A big waste. Stick to heating your lunch in the microwave folks.;Extremely disappointing
110;43.0;5.0;25.0;4090;I've been using my Mr. Bento four times a week since I purchased it about five months ago and it's been a great investment. Not only have I saved money because of the meals I've able to prepare frugally and deliciously at home, but have found it great for portion control. Also - and one of the main reasons I purchased it - the thermal capacity of the outside shell enables me to *not* need to refrigerate it when I go into the office in the morning.  Mr. Bento sits on my desk for five hours and keeps the food I carry in it fresh and ready for consumption.\n\nStaining has been an issue for some users, but I've found lining the bowls I use for soup/hot foods with a touch of either vegetable or olive oil prevents this well enough.\n\nLeakage has been another issue, but I've never filled any of the containers to capacity and carry Mr. Bento upright when transporting it to work. It has not been an issue for me because I've carried it in this fashion. All in all, I highly recommend this lunch jar.;Practical, useful and a great investment!
111;31.0;2.0;31.0;4106;I was given Mr. Bento as a gift last summer. I was so excited! I bring a lunch to work every day, and I thought Mr. Bento would be the perfect solution to packing a well-organized, balanced, and easy-to-carry lunch. You can imagine my dismay when the Mr. Bento containers leaked day after day. Anything remotely soft came out from the containers, which do not seal in a tupperware sort of way. Cute? Yes. Impress your co-workers? Yes. But practical? No.;Seems practical, but...
112;18.0;5.0;52.0;4110;"I love mine - of course it is going to take some prep work, but the idea for me wasn't ""quick and easy"" otherwise I would continue going through fast food!\n\nTips for keeping things hot - I am not a huge fan of soup for lunch, so I don't use the small soup bowl for that.  Instead, in the morning when I am putting together my lunch (I don't store my food in the lunchbox overnight) I place boiling water in both insulated bowls.  This preheats the larger bowl for my heated food (which is being heated in the microwave) and I seal up the hot water in the smaller bowl.  It goes on the bottom - and since heat rises, it helps keep the larger bowl warm too!  I then have warm water to rinse off my silverware or fingers after lunch ;)  If I don't have to worry about wilting a salad or something else, then I even will preheat the main container that all the bowls go into.  If I am concerned about wilting, I might place a paper napkin between the ""hot"" bowls and the cold bowls.  I bet that if you were doing an ""all cold"" lunch, you could put ice in the top bowl (since cold air sinks), and prep the bowls ahead of time by using ice or ice cold water.\n\nBy using this method, my lunch is still at temperatures I find acceptable by noon, when I prep the food around 6:30 AM or 7:00 AM.";Works great if you do some prep work
113;159.0;5.0;5.0;4117;I carry it to work everyday.  I enjoy to have soup, main dish, and side separately contained in one jar.  It's easy to clean.  It's a quality product.  No problem up to this point.;Nice Product
114;115.0;1.0;9.0;4120;I don't usually complain, but my monitor is color calibrated and it did not show the depressing grey color of the plastic containers.  It is depressing to even think of eating food from these.\n\nI'm going to send it to my friends in IRAQ and hope they can use it!;UGLY GREY FOOD CONTAINERS
115;17.0;5.0;55.0;4127;Good -\n\n+ Large lunch, small package.\n\n+ Easy to clean.\n\n+ Portion control.\n\n+ Exceptional quality you expect from Zojirushi.\n\n+ Looks cool.\n\n+ Envy of lunchmates for having real food.\n\nBad -\n\n- Designed to work with specific formula lunch.\n\n- Requires work to make it hot/cold\n\n- No dishwasher (I don't use, but I know others do)\n\n- Expensive for a lunchbox\n\nComments -\n\nI take my lunch daily to work. Because of the working conditions, I really hate to use the microwave and refuse to even consider the fridge. Of course I was happy to get a new lunchbox that would address these issues.\n\nI have found mixed results keeping food hot (6 hours). The best I have found is to pour boiling water in the outside sleeve, cap, and let sit for 10 minutes. I microwave the food in the bowls (no lids) until hot, then quickly assemble everything.  This keeps my food warm...and again I am talking about 6 hours. I have yet to try it for a cold lunch.\n\nThe Amazon description says you can use just the sleeve - but that is specifically against the directions - which did come in English. I have not tried it - the inside is not stainless and I do not want to mess it up. I have tried to use the containers for a variety of foods - with mixed results. It is best to use as it was designed with rice, veggie and meat - each in their own little dish. I know the containers are small - but I have yet to be hungry after lunch, and I have a large appetite.  One thing I like is this forces me to do a healthier portion control than is normal for me. I use the lid for a bowl and mix in ingredients from the bowls. If you are trying to take a single item (like soup or casserole) this is not going to work for you. I find that I use it several days a week and then take a different lunch bag the other days when I take a different style lunch.\n\nAfter living with it for several months now, I would buy it again.\n\nI did buy a Boker Snacpac flatware set - it fits perfectly in the chopstick holder loop, and comes in a protected container. First time in years I have had REAL flatware!;Great at what it does - but with limits
