;ranking;overall;vote;elapsedDays;reviewText;summary
18;27.0;1.0;12.0;1533;"I've given myself this lens a long time ago (2001). At the time, I shot with an ""analogic"" (read film) Canon camera. I was not satisfied with the picture quality I could get from this lens, specially above 200mm. But most of the times I could blame myself (""Hum... I probably didn't hold it steady enough"").\n\n  On 2005 I got my first digital SLR (the&nbsp;<a data-hook=""product-link-linked"" class=""a-link-normal"" href=""/Canon-Digital-Rebel-XT-8MP-Digital-SLR-Camera-with-EF-S-18-55mm-f3-5-5-6-Lens-Silver/dp/B0007QKMQY/ref=cm_cr_arp_d_rvw_txt?ie=UTF8"">Canon Digital Rebel XT 8MP Digital SLR Camera with EF-S 18-55mm f3.5-5.6 Lens (Silver)</a>) and, man, how bad the pictures taken with this lens really where! Now, being able to look at the specs (""So... the shutter speed was right on this shot, after all! 1/1000 should be steady enough! But, still, the picture looks soft (unsharp)!"") and reviewing pictures right after taking then *proved* that the problem were the lens, not me! :-) Moreover, this lens would take forever to focus.\n\n  I used to think on the people that ""just use L quality lens"" as snobs, people with more money than reason. That is not the case here. It is a complete waste of money to get this particular lens. I now have the&nbsp;<a data-hook=""product-link-linked"" class=""a-link-normal"" href=""/Canon-EF-70-300mm-f-4-5-6-IS-USM-Lens-for-Canon-EOS-SLR-Cameras/dp/B0007Y794O/ref=cm_cr_arp_d_rvw_txt?ie=UTF8"">Canon EF 70-300mm f/4-5.6 IS USM Lens for Canon EOS SLR Cameras</a>&nbsp;(~3 times more expansive) and I do regret all pictures I've taken (missed, in the end...) with the 75-300mm. There is no DxO software able to save them... :-(\n\n  Sure, I would love to be able to afford something like the&nbsp;<a data-hook=""product-link-linked"" class=""a-link-normal"" href=""/Canon-EF-70-200mm-f-2-8L-II-IS-USM-Telephoto-Zoom-Lens-for-Canon-SLR-Cameras/dp/B0033PRWSW/ref=cm_cr_arp_d_rvw_txt?ie=UTF8"">Canon EF 70-200mm f/2.8L II IS USM Telephoto Zoom Lens for Canon SLR Cameras</a>&nbsp;and the few experiences I've got with it have shown that it is way, way better than my&nbsp;<a data-hook=""product-link-linked"" class=""a-link-normal"" href=""/Canon-EF-70-300mm-f-4-5-6-IS-USM-Lens-for-Canon-EOS-SLR-Cameras/dp/B0007Y794O/ref=cm_cr_arp_d_rvw_txt?ie=UTF8"">Canon EF 70-300mm f/4-5.6 IS USM Lens for Canon EOS SLR Cameras</a>. But there is a (lower) picture quality threshold Canon should never cross. And the 75-300mm is bellow it. Period.";You get what you pay for...
19;51.0;1.0;5.0;1538;I feel very strongly that this product shouldn't even be sold except maybe as a toy.\nI don't think you should have to use a tripod to get a clear picture but with this lens it seems like you almost have to.\nI wasted my time and money on this and lost a few bucks for shipping along the way.;Kids Toy
20;46.0;5.0;6.0;1564;I initially bought this lens in a package six months ago from the date of this review with my Canon Xsi along with the EF-s 18-55mm Kit lens.  I must say that this is a great lens and I have used it VERY often (possibly more than my kit lens).  Being one of the cheapest telephoto lenses in Canons lineup, not too much can be expected from the lens, but it does deliver many things.\n\nAs far as image quality, while it can be improved, it still takes great pictures.  I use it for taking pictures of outdoor sports and it has come out with some great pictures.  Using the lens indoors can be a challenge.  Because it is a slow lens, I always carry a tripod around as you will have to slow down your shutter speed to get your pictures correctly exposed.  Before purchasing the Canon EF 50mm f/1.8 II, I also tried using this lens for some portraits, and was impressed with the results. While it may not have the sharp detail as some other lenses, it can still take some great pictures.\n\nAs for build quality, it is light and plastic.  The front lens element does rotate while it focuses.  Its autofocus motor is not USM, so it is neither fast nor quiet, but it does work well and seems quite accurate.\n\nSometimes, our budget restricts what we can buy and what we can use.  In my case, I bought this lens because it fit my budget and have not regretted that purchase at all.  While this lens may not have the amazing image quality and build of other lenses, it is important to remember that it is your photographic vision and drive that creates pictures.  Even a great photographer with a toy camera can take a great picture.  Don't be discouraged by others who say this lens is not worth the money.  Buy the equipment that fits your budget work with it.  Good luck and have fun with your camera!;Great lens for a limited budget.
21;47.0;5.0;6.0;1646;"I purchased this lens at the same time of buying my Canon T1s....  I by no means am anything but an amateur photographer at this point, and with that said, this lens has been great for me....  I don't care that it's noisier than the included 18-55 lens, and I've taken some fantastic fully zoomed in pictures with this lens, I have seen no indication of unfocused results...  If you're a ""pro"" and you are buying a $150 lens and expecting $800 results, you might want to revisit your expectations  :-)";This lens has been perfect for me
22;44.0;5.0;7.0;1672;I'm a serious amateur photographer who recently recieved the lens as a christmas present this year. I use it on my Digital Rebel XT and it seems to do a pretty good job as a entry-level zoom lens. I've been testing the lens out for about a month and I have essentially the same conclusions as everyone else: the autofocus is rather slow and clunky but I am still able to nail birds flying past me. The lens is rather slow at f/4 but I've taken some great shots at ISO 100 and ISO 200 by hand with it at 300 mm. I will say, I shoot in RAW and inspect all of my photographs at 100% zoom during processing, I can tell you that the optics of the produce a non-sharp image and tends to have chromatic abberation especially in high contrast regions. Even under the most ideal conditions at 250 mm, f/32 using a tripod, mirror lockup and the self timer with no filter, the picture is not sharp and I believe this is dispersion of the lens glass. I noticed the worst sharpening at 300mm wide open. However, the lens produces excellent contrast and the overall image quality is great. I love having the freedom to zoom in on distant objects. So it doesn't perform as well as a professional lense but as a amateur, I'm happy to have this zoom lens to complement my Rebel XT system.;High Quality Entry Level Lens
23;6.0;5.0;109.0;1754;I see a lot of bad reviews on this lens. I honestly can't see why. If I can capture a squirrel in tall grass 50 feet away, hand held, overcast and in the resulting image I can count the hairs on the squirrels face. The hairs are sub-pixel sized. In other words the lens out performed the sensor. There isn't any thing wrong with the lens. The auto focus selected the subject of the image, not the grass and quickly focused it. Even at full zoom the aperture was sufficient to shoot hand held at ISO400, under cloudy skies. So it's not image stabilized ... Boo Hoo! It also doesn't cost as much as a stabilized lens. You can buy a pretty nice tripod for the price difference between this lens and a stabilized one. Can you get better glass for less, maybe. You can also spend a lot more money and not do better. So unless you are a pro shooting in fast paced environments this lens will do fine. If you are a pro why are you looking at an entry level lens?\n\nSomething else to consider is that the USM, IS version of this lens is really the same glass in a fancier can and three times the price. If you want the bells and whistles go for it. The best value is here in the cheap seats.;Very happy with this lens
24;33.0;3.0;9.0;1816;"I should start off stating that I am a newbie at SLR photography, but with the basic rules underneath my belt of focal length and shutter speeds figured out, I decided I could graduate to this lens.  This is my first external lens purchase for my Rebel 1Ti SLR outside of the 55-85mm stock USM IS lens.  I had read all the reviews for this lens on here first and decided to take a chance with this lens.  I did not see anyone mentioning using this for aircraft or aviation photography, but since this was the least expensive lens, I took the gamble.\n\nThe lens fit my SLR fine and was simple to figure out.  My first test subjects proved to be impressive, and I think make a good case for this lenses strong point!  The pictures were of common household goods such as ceiling fans, my dog, etc.  It is good to know that this lens will function ""well enough"" for those purposes, but I noticed that it would hesitate, and not accurately focus.  It would ""hunt"" for the focus for a few moments, and only rectified by changing the zoom on the lens.  I wasn't too concerned here, as I specifically bought this lens for aviation photography.  I was not concerned with the lack of IS, as I keep the shutter speed fast for the majority of the shots. (1/500).\n\nAfter shooting a few hundred pictures today at the local regional airport, I came home to discover only 4 somewhat usable photos.  Almost all photos were either too soft, too blurry, or too out of focus.  Granted, I did use the auto focus feature on the lens exclusively, but the lens was taking soft photos throughout the various shutter speeds, focal lengths, etc.  I did intentionally vary shutter speeds and f/stops, but all ""action"" shots were blurry, including ones in the action shot setting on my Rebel.  Again, Even with the college class I took on photography, I'm not a pro and I very well may have changed a setting, however, with so few usable shots from today, I'm certain I did everything textbook.  I don't know if stopping it down would have yield any better results, but after doing all the tricks i could think of in the field, I was confident that I would have had at least a set of good pictures.\n\nI must state this, I was aware that the quality might not have been all there due to previous reviews, but as with I'm sure most of us, I cannot justify to my wife buying an L series 70-200mm lens (or better) now, and unfortunately after today's follies, I do not think she will let me ever take that step.\n\nBottom line, this lens would be great for close-up still life (flowers, portraits, macro-attachments, etc) but NOT good with anything of movement or at distances, regardless of settings.  Also, AF is garbage.";Not good for Aviation photos, but might be ok for portraits
25;54.0;5.0;5.0;1856;I purchased this lens a few days ago and have taken many action shots of birds and airplanes already and am very please.  I was concerned by some of the reviews complaining about the lens being slow to focus.  I did not find this to be a problem, however, it does on occasion decide to run the focus all the way one direction and then come back to the proper point.\n\nSome people complained that it randomly decided what to focus on.  To those people I say, READ YOUR CAMERA's MANUAL!  There is an option to select what point in your view your camera's auto focus will focus on and this is NOT a flaw of the Lens!\n\n  When I left my Canon Rebel XS in Full Automatic mode, it decides on the point.  Put it in a more manual mode, pick the point you want it to focus on, and it works fine.  See page 102 of the Canon EOS manual.\n\nBottom line, if you are stepping up from a point and shoot or don't want to spend $500-$2000 on a lens, this is a great buy.;Great lens for the price!!
26;30.0;1.0;10.0;1999;Don't touch/go near this lens. Any photographer with even a modicum of shooting experience will hate this lens. F 4 - F 5.6 is a terrible aperture range and will drive 80% of users completely nuts. Considering that the majority of people who use this lens will be first time DSLR users, it's almost cruel of Canon to push this product when they know you have to be Sven Nykvist to make it work properly.\n\nYes, this lens produces amazingly blurry pictures in any other circumstances than complete, unobstructed sunlight or using a 40,000k HMI or a flash (blech!!!).\n\nI cannot describe how much this lens sucks. I seriously thought I was going blind looking at the pics this lens produced. I even readjusted my diopter, re-calibrated my computer monitor, everything, to try to figure out why my Rebel XT (not a bad SLR at all) was producing such crappy pics. Then I examined the lens and voila. Sadly, some first time DSLR owners who use this lens will blame the camera!!! Then they will get discouraged and drop the hobby.\n\nPS: The 16-55 kit lens is not much better.\n\nMaybe if you're trying to re-create Penthouse photos from 1974 you could save on the vaseline and simply depend on the optics of this lens to create an utterly unsharp, soft image. At least the blemishes on your wife's face will be automatically feathered out.\n\nDid I mention I hate this lens? Save your money for the 1.8 prime (or the 1.4 if you can afford it) because the 1.8 is the best economy lens in the EF series. To get a great lens for the XT/XTI/whatever will be out next week, expect to drop 1000 - 1500 at least.\n\nI don't know how anyone with working eyes in their head who could love this lens.\n\nAlso, it's made of plastic and doesn't have a focus ring. W T F?!?!?!\n\nI'm sure the distance marks on the lens are waaaaayyyy out of wack too but I'm too depressed to even bother with a test.\n\nThere are ways to make this lens produce a decent image, if you accept the limitations of this lens (and there are many) and work within them.\n\nYou can create interesting shots with amazingly shallow focal depths but for traditional landscape/portrait photography, don't even dream about using this piece of junk.\n\nSorry to hate on this lens so severely... but seriously. SERIOUSLY!!!\nI can't even use it, it makes me want to cry. I stick with the 1.4 prime every time, all the time for my Rebel XT.\n\nCanon, work harder or create a EF mount for Zeiss lenses!!! PLEASE?!?!;Terrible Lens
27;8.0;5.0;108.0;2026;"For the price range of $150-200, this lens is the cheapest in the Telephoto zoom lens range Canon offers. The cheaper price is because this lens does not have a quiet-n-fast focusing Ultrasonic motor (USM) and neither does it have an in-built Image stabilizer (IS). Instead it has a comparatively noisier DC motor which is not quickest to focus. Also the lens exterior surface is mostly made up of plastic and appears little cheap compared to the USM version or the IS USM.\nBut in terms of picture quality this lens is not bad at all. In bright light with high shutter speed the lens performs at its best. The pictures come out sharp and clean (please check out the pictures I uploaded). In day light condition and at high shutter speed (1/100 sec and above), you can shoot really good pictures (even without a tripod). But I concede that in low light areas/overcast conditions/cloudy and evening light the lens shows its weakness. You will desperately miss the Image stabilizer function. But if you have a tripod then the lens works even in low light conditions and at shutter speed 1/30 sec or lower and an exposure of 1 sec to 15 sec.\nNow for the whiner's who have been complaining: When you see a Canon Telephoto zoom lens displaying a price tag of $150-200, what outstanding features do you expect in it? As I said before, this lens does not have an IS or USM, then how can you expect it to focus quickly like the expensive ones. Apart from the picture quality and the zoom capacity, it's basically wrong to compare the features in this lens with other advanced & expensive Telephoto zoom lens. Given its DC motor and as a Non-IS lens of course this lens is not meant for Sports photography. If you're a sports photographer then why be stingy and then whine? Go for the&nbsp;<a data-hook=""product-link-linked"" class=""a-link-normal"" href=""/Canon-EF-70-300mm-f-4-5-5-6-DO-IS-USM-Lens-for-Canon-EOS-Cameras/dp/B0001G6U3Y/ref=cm_cr_arp_d_rvw_txt?ie=UTF8"">Canon EF 70-300mm f/4.5-5.6 DO IS USM Lens for Canon EOS Cameras</a>&nbsp;or&nbsp;<a data-hook=""product-link-linked"" class=""a-link-normal"" href=""/Canon-EF-70-300mm-f-4-5-6-IS-USM-Lens-for-Canon-EOS-SLR-Cameras/dp/B0007Y794O/ref=cm_cr_arp_d_rvw_txt?ie=UTF8"">Canon EF 70-300mm f/4-5.6 IS USM Lens for Canon EOS SLR Cameras</a>&nbsp;both lens are great for Sports photography. But keep in mind, those two lenses are comparatively heavy to carry around as they weigh 25.4 ounces and 25 ounces respectively.  Compared to those the Canon EF 75-300mm f/4-5.6 III weighs only 16.8 ounces.\nSo the bottom line is, if you're a photo enthusiast beginning DSLR photography, looking for low budget zoom lens, then this one will work best for you. For the given price and as a Telephoto zoom lens the Canon EF 75-300 f/4-5.6 III does what it's supposed to do.";A Telephoto zoom lens to begin your journey in DSLR photography
28;56.0;5.0;5.0;2101;This is a great field lens! Very light, yet good construction, and incredible range. I can shoot at 300mm and not have to use a tripod and my photos come out awesome. I have a Rebel XT, XTi, and XSi and works great on all of them. This has to be the best Canon lens for the money. Get one...you won't be disappointed.;Amazing Lens at an Amazing Price!
29;43.0;5.0;8.0;2105;I have had this lens for over 7 years.  I have used it with the Canon Rebel G, and will be shortly switching to the Xsi.  This lens has a great zoom, and in good, outdoor lighting takes amazing, crystal clear, colorful shots.  I shoot mainly wildlife.  The detail impresses me everytime I get a shot back. This lens has made me love photography, and constantly strive to be better.  I do not use this lens in indoor or low light situations.  While I have never used a much higher end lens, I am very happy with this one.;Great wildlife lens!
30;28.0;5.0;13.0;2149;Let me say that I haven't used this lens in a few years. I am now using much more expensive L series lenses. I still have the photos that I took with this lens on my hard drive, however, and technically they are great. For the price of this lens they are remarkably great. Very low distortion, no CA and razor-sharp images. I am saying this after looking at pictures just this week, after a few years of honing my photo skills and my photoshop eye. I am very sensitive (some have said too sensitive) to defects that can only bee seen at 100%-200% and I do not see any in the pictures taken with this lens. I have seen many when looking at the pictures from the 85mm f1.8 lens, for instance.\n\nThe lens was mated with a Rebel XT when I took those pictures, incidentally, which frankly it is meant to be. This is not a lens to be mated with a semi-pro or pro body. I'm not sure what the results would be there. They would probably be pretty good with a 40D but with a 5D I don't know. Again with the Rebel they were great, and I think given the cost of this lens it is meant for a camera like the Rebel. For the price this really can't be beat if you are shooting with a Rebel, Rebel XT or Rebel XTi. 5 stars because it does exactly what it is supposed to do and more. It is supposed to be a competent lens for a low price and it ends up being a great lens at a low price.;Undeserved negativity.
31;57.0;5.0;5.0;2248;My husband and I were recently on a trip along the Oregon coast and to view the Giant Redwoods of California. We bought this lens to go along with our Canon Rebel TSi 12 megapixel camera. Some have said they could not take action shots with it but I have great photos of sea gulls in flight and the waves as they crest, curl, and crash on the beach. You can see the feathers on the birds. I also took photos of the ocean crashing against rocks and they are so clear you can see the outer water droplets.  We also bought a High-speed SD memory disk which could have helped with the photos. I would recommend this lens.;Great! -This lens took action shots.
32;48.0;4.0;7.0;2302;If you can master the quirks of this lens, when you move to a better one you will be MUCH better.  It keeps you on your toes, if you don't have much light you will need a tripod and adjust your ISO. Its the first telephoto lens I (as well as many others) get with their camera.  Is it terrible? No.  Just know the limitations.\n\nI try to keep it under 200mm, above that well it works alright but you can just crop what you need in an editing program and it will be much sharper.\n\nI would probably say those of you who would know the limits of this lens would probably not buy it anyway.  Its fine for the money, but really for outdoor use ONLY and sunny days as well.  I've had it for almost a year and I am ready to upgrade, but I do feel by having a lens like this to start does get you to think about what you are doing with it.;OK for beginners
33;23.0;2.0;19.0;2414;"I've used a lot of different telephotos lenses, from this one, to the better Canon&nbsp;<a data-hook=""product-link-linked"" class=""a-link-normal"" href=""/70-300mm-model/dp/B0007Y794O/ref=cm_cr_arp_d_rvw_txt?ie=UTF8"">70-300mm model</a>, the&nbsp;<a data-hook=""product-link-linked"" class=""a-link-normal"" href=""/70-300mm-DO/dp/B0001G6U3Y/ref=cm_cr_arp_d_rvw_txt?ie=UTF8"">70-300mm DO</a>, and the wonderful&nbsp;<a data-hook=""product-link-linked"" class=""a-link-normal"" href=""/70-200mm-f-2-8-L-lens/dp/B00006I53W/ref=cm_cr_arp_d_rvw_txt?ie=UTF8"">70-200mm f/2.8 L lens</a>. This one is not terribly great. It tends to softness, particularly at the upper range, can show flare and CA, and the build quality is poor. In fact, after a couple years of use, the autofocus on mine stopped working, the only lens I've ever owned to have such a problem. I've seen similar reports on other photography forums so mine is certainly not an isolated problem. To repair it would cost almost as much as the lens itself, so it basically was trash at that point and I certainly was not getting another one and upgraded instead to the 70-300mm which is a far better lens all around. I'd suggest that anyone that needs a lens in the $200 or less range look at the latest&nbsp;<a data-hook=""product-link-linked"" class=""a-link-normal"" href=""/Sigma-offering/dp/B000ALLMI8/ref=cm_cr_arp_d_rvw_txt?ie=UTF8"">Sigma offering</a>, which is a much better performer than this lens and gives you some decent macro capability as well, or the new&nbsp;<a data-hook=""product-link-linked"" class=""a-link-normal"" href=""/Canon-EF-S-55-250mm-lens/dp/B0011NVMO8/ref=cm_cr_arp_d_rvw_txt?ie=UTF8"">Canon EF-S 55-250mm lens</a>. While I've not tested this new lens myself, it's gotten very nice comments for the most part and IS in this price range is a real bonus.";Not recommended, there are better lenses even in this price range.
34;49.0;4.0;7.0;2478;"I bought this lens (used) from adorama/via amazon (E+) for only $104.00. That's an\n outstanding price! And when adorama.com says ""excellent condition"",\n they mean it! This lens was in new/mint condition. I'll buy my next lens\n from adorama without a doubt. I bought this lens to replace my 80-200\n zoom for I wanted greater range. Many reviews state that at the high-end\n this lens isn't quality. I beg to differ. I've taken many photos at\n the 300mm setting (hand held) and seen crisp, clear and amazing results.\n For the price, it's an outstanding lens. The build quality is greater\n than my former 80-200mm because it seems more solid and has a metal\n mount.\nI give it a 4 out of 5 for sure. It's not the USM so it's slower to\n focus. But I own other USM lenses and I can't tell a major difference.\n That's why I opted to try this lens out. She's a keeper....";Great Lens for the Price!!!
35;24.0;3.0;18.0;2604;"EF 75-300mm f/4-5.6 -not to be confused with the EF 75-300mm f/4-5.6 USM\nAt either new or used prices, this lens is a good consideration for the person who has the EF-S 18-55 mm kit lens for their APS sensor digital camera and wants a similarly inexpensive telephoto. Reviews have typically commented on ""softness"" of the lens at its maximum focal length, but in practice the lens is more than adequate, especially if stopped down, according to many reviewers (search ""Canon +EF +(70,75)"" for examples). It is not an L lens, but it costs a tiny fraction of the price. Note that this lens does not have any image stabilization. An almost identical lens with the simpler USM autofocus, was the first commercial IS lens, it is great, but costs at much as 4X the price. This lens can be used on both full-size 35mm image cameras as well as on smaller sensor cameras like the Rebel or 20/30D (equivalent there to a 120(+/-) -480mm lens). The Micro USM lens has a Ultrasonic logo on the upper portion of the lens while this lens does not.";Naysayers are overly picky
36;25.0;3.0;18.0;2656;not as sharp and definitely not fast for action auto-focus shots.\nfor hobby only use on weekend, this would be okay, I've shot a lot of birds on this lens and they come out just okay, JUST okay. :)\n\nThe construction is just average, barrel play on manual focus might be an issue for some.\n\nIf you'll try to shot stunning vivid and fast shots, you might be better off spending a little more and pick the more PRO lenses.\n\nThis lens is good for sunny days and for the newbie who just want to have a decent focal lenght lens. 300mm is really not bad.\n\nI've bought a Canon 70-200mm L IS USM 2.8f lens, big difference, both in sharpness, color and speed and also, really big difference in price too.\n\nBut, eventually, that's what hobbies are all about, start small and grow, if you have the money, just skip this one and buy the real deal, memories are priceless, capture it the best way you can.;Entry level telephoto lens
