Model ranking;ranking;ind;relevance;review
0;34;42;0.5777613501191364;given machine gift months begging espresso machine first time plugged thrilled quality espresso coming machine practically instant enjoying great coffee time nothing complex simple easy learn complaint small space cup know espresso machine cups small like lot espresso sometimes unfortunately anything much bigger espresso cup wo fit minor issue worked around want good espresso say buy
1;10;11;0.48427719913478573;bought machine used searching high low machine closest thing high end espresso machine without high end price really machines 12 bars pressure 200 get solid reviews paid 75 used m writing review reading hundred trying chamonix m convinced negative reviews result impatience unwillingness experiment first day tried ready return espresso barely flowed weak machine little messy sure days great noteworthy things n n1 others pointed grind somewhat courser espresso machines fine get much espresso flow manual states n n2 tamper coffee much hard tamper restrict flow make think machine working n n3 machine little messy design based many reviews read grinds end hard puck rather somewhat watery ready dispose inevitably get little spillage brew head also frother brew spouts short ca brew real cup frothing means tip frothing pitcher get hey want everything 150 produces good espresso shot decent crema attractive bonus willing play around days best results
2;41;29;0.45447360688657545;fourth espresso machine third pump last machine gaggia expresso machine better heats fast great crema every time love ability set amount espresso dispensed steamer powerful careful machine relatively easy clean first thought little flimsy compared gaggia chunk however like small size fits cabinet
3;38;19;0.40472945513700975;first espresso machine price range 4 star product fair compare 300 machines thus paid worked admirably problems mentioned previous reviews would recommend machine however need realize unless use unpressurized basket grind espresso beans burr grinder wo get even close cafe quality espresso imho unit comes pressurized filter buy unpressurized filter espressopeople com 14 one used solis crema sl70 works great also recommend solis maestro burr grinder best grinder market 200 combo good espresso machine good lattes
4;1;8;0.31465495336499777;machine 3 5 years got ta say m still happy normally write reviews things buy today enjoyed billionth espresso thought little machine deserves positive reinforcement n na things note worked coffee shop undergrad college town prior knowledge espresso good bad volume time needed make good espresso etc kind picky messes hate them n nthe good things nfirst machine easy use buttons front self explanitory easy use functions definitely plus n nsecond like tamper feature right side many people mention one less gadget worry m using espresso opposed e s e pods n nthird setable volume control great love turn manually start walk around kitchen getting breakfast items in line come back perfect espresso n nfourth great crema know due coffee buy machine think great n nfifth two sizes cages coffee sure cages right word m referring fact make single double shot espresso 1 mess assuming m using e s e n nsixth e s e compatibility sure machines offer compatibility tell potential buyers little mess free pods life saver hint ocd us all n nseventh easy to clean parts water reservoir comes tray beneath espresso spout comes easy clean everything throw dishwasher n neighth price unbeatable product fantastic value price thinking 2 years d get since drink minimum 2 shots espresso day still going strong guy dies get another one n nnow mention bad things n1 due compact design water reservoir goes empty within week seen pro con one hand old water get nasty like messing filling even though hole top pour water n n2 model steam wand flexible looks like updated it n n3 m worried potential leaking around o ring happens m overbearingly strong attaching espresso basket use coffee opposed awesome e s e pods n n4 like post espresso leak figured put espresso cup drops draw stops dripping n n5 noise know bring though espresso machines noisy present side things n n6 delay steaming espresso steam milk latte probably know may slight delay steam milk pump espresso probably steam somehow designated steaming try pump espresso re route something know m espresso machine engineer however little annoying solution pump espresso prior steaming plan slight delay n nespresso pods talking ni m talking e s e pods buy online probably amazon around 40 50 150 single shot servings re packaged individually re clean compost compostable n noverall lot said machine real reason listen besides tightwad buy things good value also like things efficient easy clean machine covers well furthermore like things re supposed machine perfect espresso perfect froth great value n nonly one word advice control espresso machine might bouncing walls due fact espresso machine pace n ngood luck decision n n update july 2007 n ni mentioned earlier worried ring machine couple years using know need replace espresso comes another area portafilter instead intended spouts like around edges etc happen machine eventually n nfinally replace cost 15 called group gasket price includes shipping n nlook back machine call phone number answer tell need new group gasket machine large rubber piece covers d think necessary machine mentioned m engineer accept is n nthe service dept terrible far bedside manner say know re talking guy probably talk barely speaks english kind yells phone probably say need take apart machine sure group gasket etc knows stuff n nthen get flip machine unscrew basket upside down bell shaped thing covered group gasket remove needle nosed pliers worry ruining piece garbage n nthen comes hard part squeeze new group gasket onto upside bell thing surrounding surfaces pretty hard inch matter remember repair guy sent right size seems like big worry n nonce get put empty portafilter run shots practice runs settle place unscrew screw portafilter group gasket creates seal portafilter comes flush need get acquainted n nso pretty annoyed hard find part done hard work 4 5 years hard use plan spending 15 replace it n nthe key need buy new machine almost got new one figured d give shot set m hoping another 4 5 years awesome espresso n ngood luck
5;26;24;0.26505767054865326;found worked okay first six months although even thought designed well terms able clean disappointed coffee came lukewarm started going downhill six eight months regular use coffee flows one hole filter holder idea filter holder plugged re making two demitasse cups time one ends almost nothing overflowing leaks basket bad steamer tool keep towels coffee lukewarm quick froth attachment flow milk anymore steam maybe one five six tries milk come also seems susceptible air locks although mention instructions surprise still pain follow directions letter others try descale regularly keep clean know operator error m really desperate cup need plan good half hour get milk espresso re usually cold worth service means out of pocket shipping new jersey reports heard good m inclined buy different brand hassle hope works worked well first six eight months d happy think designed well long term use
