Model ranking;ranking;ind;relevance;review
0;30;78;0.6534309320187975;m big fan lot cooking toaster oven since single generally cook old large toaster oven able find good replacement although ve looking years fullsize oven convection knew great job meat particular hate cooking small meals wasting energy saw oven knew get s bit pricey n t regret purchase hard pass free shipping well n nfirst s nice roomy inside think s big old one n t look outside looks great counter modern built well controls look little intimidating first read manual figure using couple times s pretty straightforward toasting features incredible real picky toast bagels ca n t stand over toasted black oven perfect job first try n nas convection features ve done pork chicken far turned great takes little getting used terms cooking temperatures times done correctly food wonderfully moast yummy particularly like able set timer turn oven automatically ve seen toaster oven feature definitely help keep overcooking food n nthe oven comes nice large broiler pan may want look around toaster oven pans find using lot probably use mine least 1 2 times day n nupdate well m still using toaster oven almost 5 years later still loving s easy clean slide out crumb tray works beautifully love convection quick browning end cooking frozen foods toasting bagels muffins whatever ca n t beat clearly stands test time give many years use
1;48;61;0.5354322995062821;updated end review november 28 2009 november 8 2012 n nding ding ding cuisinart winner toaster oven month used every feature least including baking pie n nthis cuisinart bakes toasts evenly due settings work accurately went long old unreliable welbilt toaster oven s hard believe anything easy use results perfect door actually makes good seal easy to figure touch panel oven all n nsome people complain small size need bigger oven use stand up one kitchen baby baked 9 pie room spare toasts 2 large bagels easily also roasted chicken pieces broiled small steaks many sought after features including convection baking m 4 10 tall ve teased small size understand toaster oven coming n nno oven light another complaint get flashlight ray o vac sells 4 99 please n t let stop buying wonderful kitchen appliance found lightlessness word problem n nca n t say much long term reliability n t long enough length time love love love use daily n nis expensive many others yes s worth every penny looks sharp even white color chose s cuisinart m kitchenaid cuisinart appliance snob works wonderfully n nif husband ever throws toaster oven comes me n nupdate november 28 2009 4 1 2 years toaster oven still working absolutely flawlessly used daily basis still n t single complaint often use place full sized oven remain completely happy performance reliability n n2nd update november 8 2012 ca n t believe toaster oven still going strong 7 1 2 years want one stainless give one s still working perfectly
2;9;79;0.5331251030413856;ve owned least 10 different toaster ovens years ve cuisinart 2 years far best one ve ever owned n t discolored still works fine get clue people toaster ovens n t meant baking nthis oven works quickly evenly roasting chicken making baked potatoes broils well s so so like toaster ovens toast pretty good bagel nif toaster oven turns timer get something else one beeps s enough me nthe convection feature really speed cooking love toast cycles bagel defrost 4 slices etc rewarm button handy well nfor money toaster oven features consistent s problem clean either nbut geez make wedding cake real oven nature toaster oven small cavity s going overbrown anything attempt bake ve never owned toaster oven matter big baked well
3;72;25;0.4824698253745454;bit hesitant buying hundred dollar plus toaster oven reviews great sick tired junk past n nthe cuisinart tob 165 convection toaster oven broiler fantastic unit everything used come perfect n ni highly recommend product anyone looking toaster well worth extra money
4;51;57;0.4485427439057814;well say personally love toaster oven listen negative reviews even find positive points reviews n t let discourage considering toaster oven things whine absolutely silly researched days pathetically trying find right toaster oven basic ones ones rotisseries i wanted best one money wanted one convection one would use convection toasting bread dries bread even toasting process anyway came accross one sure glad got making first piece toast n t know piece bread could toasting golden perfection top crust bottom old hamilton beach could n t n t even use direction booklet easy operate clock set well problems n t know kind toast negative reviewers want machine toasts light golden brown bottom liking top medium size oven big small positive reviews n t lie really final decision particular oven first reviews warrenty 3 years value right amazon offers 25 00 kitchen items total price 104 99 plus free shipping says ends last april better act fast interested know made right decision oh way old hamilton beach got burning hot outside constructed metal common sense tell heated metal gets hot duh n t turn toast get great results either toasters malfunctioned get toast toasted one side depending adjust rack believe many options get personally liking
5;98;51;0.40504711686428313;finally found toaster toast sides toaster love convection oven n t start stove oven bake potatoes etc many things worth price lot toaster ovens best
6;6;24;0.3855145826672185;previously delonghi toaster oven really liked ever since purchasing 13 years ago liked much parents bought similar delonghi model years later unfortunately model quickly developed defective knobs positionally indefinite would stick good folks recently developed sticky knob syndrome second piece toast catching fire kitchen threw toaster oven regrettably shame pretty good job gladly used several times every day toast chicken fish roasting vegetables loved hardly ever needed regular oven n nwe started researching convection toaster ovens newer delonghi reviews complained initial smell wanted inspect smell concern indeed mentioned manual made us seriously wonder imparting food time n nthe cuisinart issue also glowing reviews tried finding stores get first hand sense product unfortunately could find anywhere n nafter reading many reviews considering consumer reports say decided get white cuisinart tob 165 convection toaster oven right box works great ever since toast kidding ve never seen toast smoothly toasted almost looks like someone used spray paint browned look consistent dependable precise settings know expect even takes advantage previously heated calculate measure temp remaining amount time required toast another piece precisely way d expect smart efficient way also lets know target temp reached useful prior baking things nice indeed n nwe ve noticed seems bring flavor food fish chicken example ve experienced previous toaster oven wow unanticipated plus smell taste subtle aspects food n nthe controls breeze easy adapt oven produces d call professional grade result really appreciate thought science must gone engineering product enhance cooking experience got glowing vote n ntip saved previous toaster oven s rack crumb tray potential future use turns excellent idea second rack affords opportunity baking twice items long re baking comfortable fit old bread crumb tray stainless steel excellent cooking anything wo n t produce much liquid benefit open space cookies roasting vegetables burgers example buying items would probably cost 20 assuming d inclined reuse recycle love
7;96;42;0.3761437710054698;looking toaster oven could toast second set toast good first without burning under toasting bread one perfect toast every time also performs s tasks baking broiling exceptional manner may little expensive toaster ovens well worth difference price
8;32;13;0.3641734958340423;purchased item based rating consumer reports top rated toaster oven much better previous convection toaster oven euro pro year old even close comparison convenience digital settings timer wonderful speed eveness control cooking truly excellent fast toasting regular toaster unusual convection toaster oven compact outside good capacity inside get much cooking space without taking extra counter space cost last three toaster ovens combined ten times better case really get pay highly recommend item
9;77;5;0.34516200605638964;oven used baking toasting warming much quicker conventional oven nice job appreciate uses less energy cools quickly large oven rarely gets turned anymore
10;81;15;0.3370841682178306;love toast make lot sandwiches premium breads thick nesses sizes densities wife likes heavy multigrain breads full moisture take forever toast like light fluffy bread toasts much quicker toaster oven consistently performs well variety toasts like seeds bread exterior toast enough release flavor machine well read 200 reviews leading toasters many sources toaster received best reviews including often mentioned comments toasting trouble making mind spend much toaster oven would take lot counter space primarily used toasting n ni 20 year old black decker performed excellent left old house needed nice looking toaster new upgraded house since toast addict stooped pick new black decker toaster oven wal mart store hate shop everything junk black decker dried hardened toast inside sign toasting occurred bread hard brick dry powdered cement n ni purchased cuisinart tob 165 amazon arrived bigggg box days installed flawlessly toasting extradinore mode without reading instructions cuisinart tob 165 gives lot intuitive control toasting results impressive get rave reviews famous sandwiches ability toast outside bread leaving inside warm chewy gives right touch sandwich cuisinart tob 165 heavy well build controls easy read easy big fingers adjust thoughtfully placed n nadditionally used cuisinart tob 165 heat pizza cook fish sticks assorted things toaster broiler oven find heating pizza first convection finishing broiling restores pizza much better delivery condition n noh mention purchased cuisinart 2 slice fat toaster times bread small cooking bagel heats quickly toasts outside nothing watch one like hawk burn much prefer results cuisinart tob 165 use want best results
11;31;67;0.3307705153142725;reading yes reviews cuisinart tob 165 convection toaster oven ordered white waited anticipation arrival pleasantly surprised oven smaller expected large enough hold round pie plate 7 11 baking pan baking pans have nto date baked cornbread baked breakfast casserole convection baked chicken pork ribs made toast re heated leftovers cooked frozen pizza baked quesadilla possible hardly ever turn full size range oven little oven nsomeone mentioned fan noise noise fan quiet wondered m trying get habit cleaning inside everytime roast broil something splatters unplug oven finished open door speed cooling eat meal clean oven hot damp cloth clean dishes leave door open help dry inside took advice poster put user s manual cabinet directly oven always handy nif usually cook 1 2 3 appliance ca n t wait broil first steak cook whole small chicken bake homemade bread new oven heat whole kitchen summer temps hit 94 like today
12;17;8;0.31149416263053475;cuisinart convection oven exact heat one finest kitchen products privilege owning last decade beside perhaps all clad cookware shun knives literally changed life eat foods prepare prepare perfection boot friends n ni live bachelor apartment stove oven active cook hard struggling cuisinart classic toaster oven hard burnt foods top raw bottom two years use broil function worked faith cuisinart products nil n nin researching new oven buy shocked quite dismayed find cuisinart product highly rated loved s owners could toaster oven devils darn purchase another cuisinart product sireeebob let alone one 150 endless glowing reviews amazon elsewhere net convinced put last faith another bout cuisinart reviews oven glowing hard find anyone anything bad say product owner owner owner raved oven n nwell pleased report accolades small oven true faith well invested finally bake bake bake like never done even big gas ovens chocolate chip cookies roasted green beans butternut squash biscuits frozen lasagna whole chickens home made bread scratch comes wonderfully browned perfection evenly baked convection feature exact heat technology oven nothing short amazing n nit honestly brought tear bachelor s eye able bake anything confidence n ni roasted 4lb whole chicken mom mothers day agreed look part golden brown piece poultry perfection s taste lived s looks juicy perfectly done crisp crackling dried out skin cooked 50 minutes boot n ni toasted one bagel far experience report toasting features oven however bagel come nice indeed oven boasts extensive toasting features n ni found best success convection feature reducing recipes instructions recommended temperature 25 also reducing baking time 25 30 n nif contemplating toaster convection oven despite horrible experiences cuisinart past wholeheartedly recommend wonderful god send oven great enthusiasm wo n t sorry fact may come hate regular oven come wish cuisinart would make model tad bigger accommodate 13 bakeware
13;90;39;0.30842517088457116;purchased cuisinart convectiontoaster oven broilerlast summer used constantly since rarely use stove oven anymore little gem everything large oven plus toasts evenly bakes perfectly broils beautifully leaves kitchen cool d recommend highly anyone
14;85;23;0.28682913066053545;toaster oven fantastic appliance kitchen makes great toast every time oven functions good full size oven use mine full size oven
15;87;26;0.238221105393853;handiest product ve bought long time toast great baked beef roast pork roast 4lbs problem rack put lower position stop careful pull far kitchen heated using oven would regular oven easy clean looks great counter highly recommended
16;80;10;0.20586009418626616;5 ovens period years either died perfomed badly enough dump oven easily absolutely best unit ever temperature advertised exact degree set convection mode really mode use fast everything well 600 buck full size kitchen stove course smaller amounts go wrong unit impressed probably buy another one spare event one dies longer available story life
17;40;3;0.16589708761106248;produces intense heat quickly m sure heating elements made get hotter much faster 50 oven one n nmaintains perfect temperature heating elements n t cycle full blast like cheaper ovens vary output depending proximity target temperature instead overshooting set temperature 10 15 degrees waiting overshoot gets 10 15 degrees inputs enough heat maintain correct temperature repeated blasting avoided cooking large item good thing cheap toaster oven temp drops 20 30 degrees repeatedly blasted back makes easy burn top something reviewers said happy use full sized oven temperature control system cuisinart lot regular oven large thermal mass tamp big temperature fluctuations metal walls big enough store lots heat keep temp consistent oven electronically big ovens due sheer mass gradually parceling heat necessary temp stays consistent comparable job n nthe convection feature heats fried foods incredibly well evenly heating make soggy breading crispy without burning part parts get done already described oven s brain allows keep temp consistent small oven convection fan helps another way distributes heat around food minimize local hotspots sides facing away heating elements get even heat delivered circulating air air carries heat directed top bottom redistributing around oven even heating also steam n t rise top instead gets blown around quickly evaporated great roasting nuts like almonds normally easy burn heat even convection feature use oven fry breaded chicken brushed olive oil get nicely browned flavorful crust around convection also takes 30 less time cook n nthe toaster part oven also works well oven already hot factored toasting time fewer minutes seen countdown timer particular level first thought gimmick reduce toasting time half oven fairly hot actually works pretty consistently find even toast frozen items come crispy heat nicely residual heat toasting leave 5 10 minutes afterward cuisinart s engineers must spent lot time testing thing n nthere tray bottom heating elements pulled rear perfect size wrap sheet aluminum foil around drips burns cinch clean year later tray looks perfectly clean underneath n ni d recommend oven anyone complaint oven timer n t seem shut oven runs continues beep ll look manual see something wrong n t think one negative much compared pluses oven though excels counts products category n t dare go
