Model ranking;ranking;ind;relevance;review
0;10;9;0.3267616012328021;company called coffee art s true want coffee grinder looks like space ship one pretty arty n nhowever want cup coffee d suggest trying something else n nthis grinder follows extremely popular form function philosophy made apple gazillion dollar success unlike apple however manufacturer clearly n t user testing design went production let explain n nthe lid stainless steel dome black band picture lid twisted remove replace bayonet style lock unlock mechanism putting coffee beans replace lid twist clockwise indicator points lock icon n t twist far maybe 20 degrees rotation n nthe catch part twist basically top stainless steel ball s literally nothing grab except round smooth steel thought opening jar mustard hard hah lid see mustard jar raise 6 old jars aunt betty s marmalade n nfortunately s like people grind coffee beans morning need cup coffee s grounds ca n t get lid line ing thing ing thing n ntl dr want manual dexterity small motor skill challenge first thing morning means get coffee art coffee mill n nif actually want cup coffee go buy grounds buckies else grinder oh way really like coffee n t get blade grinder crap job grinding coffee get proper burr grinder cost re worth
1;24;24;0.31670641904877683;love baking stone bakes wonderfully love non toxic however first one got broken easily replaced second one received broke within 2 weeks got hairline crack middle handle picked literally tore 2 pieces easily piece paper n t know happened really want love really want replace another leery happening n t know got lemon normal stone baking ware first piece stone baking ware maybe something wrong love stone much ll probably order another try third time s charm right
2;19;17;0.27343962911258995;first like fact looks like table mat rolls up like yoga mat convenient storage away n nits simple great quality easy use durable texture sleek polished even logo stands out n n love fact require oils non stick sprays means less time making taste baking n nmy children love colors overall greater any other baking sheets highly recommend product itll make baking experience fun activity family easily love enjoy n n god bless
3;23;26;0.25792531816647274;love heartstone pottery cookie sheet love smooth feels hands perfect everything bake turns love made america stones clean problem dishwasher continue buy baking dishes muffin pan comparison well muffins turn baked versus using old metal tins love hartstone cant recommend products enough
4;6;6;0.1640825308284734;re great coffee beans ground evenly big chunks left reviews helpful true n t tried spices want try whole nutmeg
5;28;15;0.1125087900926024;first baking mat ever owned wondering waited long fabulous makes clean easy think cookies bake evenly love color coded edge makes easy space cookies without getting close edge well made product n nthe packaging also nice delivery arrived timely manner even got email confirming order first class seller n nyou buy confidence
