Model ranking;ranking;ind;relevance;review
0;104;120;0.6655146722967743;built computer middle last year designed gaming rig course d use occasional term paper bit gaming concern spending 1900 behemoth figured crappy media speakers old system could hold wanted spend money buy new ones n nso waited couple months later decided tired terrible sound quality got speakers playing halo nfs mw everything else audigy 2zs platinum audio card laymans terms feed lot speakers started looking 7 1 speaker systems figured speakers better right realized d spending around 300 logitech 7 1 system factored shipping everthing else another epiphany 12x16 room computer desk corner recliner corner treadmill opposite side long dresser different side oak rocking chair squeezed good measure supposed put 7 speakers wall mounting brackets perhaps d spend monetary equavalent arm part leg brackets mention time involved probability screwup regarding holes walls walls belong way n nso cruel reality regarding practically coveted 7 1 system set began look smaller sets speakers one jumped first sheer power speakers initially first thought speakers cost 150 decent 2 1 systems cost around 40 difference computer speakers run across media speakers good listening bird sounds encyclopedia okay listening music softly promedia 2 1 system set media speakers much closer small home audio system might hook dvd player n nobviously bought speakers one bit disappointed performance received money sound comes speakers thickness seems fill air whether dance music revving turbocharged import sound rapid fire laser sound better coming speakers klipsch mid level 2 1 systems tried n nthe sounds always crisp power speakers sub amazing sub speakers turned 1 3 way pictures living room wall 20 feet away start rattle jump n nthe thing note speakers sub first couple weeks sound little strained normal give little time speakers get broken bit also sub get kinda hot steeping tea m playing video games hot definately warmer d expect surprisingly though caused problems me n nall re bit short space lazy string wire around room speakers good fit give enough power clarity satisfied whether want music games currently re sold 120 d spend much bought home audio speakers w sub hook computer would receive similar results n nbottom line spend bit extra money system wo regret
1;24;125;0.6634815087583475;since moved suffer exaggeration listening cds sony discman altec lansing acs44 2 1 speakers n nit torture listening horn section rickie lee jones pirates cd like nails blackboard harsh sounding never remembered sounding like audio system left back home plugged klipsch promedia 2 1 discman played rickie lee jones oh horns smooth harsh rickie voice mellow could discern individual voices instruments loud passages loud passages sounded like mush altecs n ni broad range musical taste next put classical beethoven string quartets performed quartetto italiano could really hear rosin laden bows grabbing strings good recordings hear decent audio gear one criteria besides horns use listening well speakers resolve audio detail mid upper ranges criteria cymbals sound smooth tinny sort psh psh opposed tzz tzz klipsch cymbals sound like psh psh like re supposed cymbals linger float air something never happened altecs n nthese quite revealing detailed speakers hook different cd player really hear noticeable difference quality recordings come speakers good recordings sound good mediocre records sound mediocre speakers make john fogerty voice ccr cronicle 20 greatest hits cd tolerable unfortunately neither good set speakers instruments notes notice old system totally missing altecs revealing anew say tweeters overly bright perhaps speakers bright side overly opinion bright harsh listen speakers day moderately loud levels ca say hi fi speakers heard could listen 1 2 cds altecs gave up n nthe klipsch promedias great job vocals raiatea helm voice sounded sweet lovely title latest hawaiian cd klipsch altecs love listening female vocals get raiatea cd n n since 1 10 06 learned raiatea cd nominated grammy category 70 best hawaiian music album n vocal instrumental n nbass good good detail extension though bit vague trait found common small diameter ported woofers also bit weighty keep bass adjustment subwoofer way setting higher overpowers mids highs placing subwoofer outside away corners walls slightly left listening position probably best experiment placement level settings find works best environment taste everyone room ears different walking around room moving slightly toward away subwoofer unit change sound fiddling subwoofer placement found two feet back wall two feet side wall inside left satellite ideal placing toward center satellites caused lack lower mids upper bass cellos sounded anemic sub placed center left cellos sound much much better n nthe stereo imaging soundstage head shoulders altecs put laurie anderson home brave live cd turned volume really felt like concert hall klipsch imaging good fooled cat sensitive ears listening eagles greatest hits vol 2 heartache tonight ends series drum beats cat sitting lap facing drum beats caused turn head back direction thought came directed head ears outside right speaker even thought coming altecs could always pinpoint instruments coming satellites n nnow negatives first tractrix tweeters taken high end models priced 1000s plus although good lateral dispersion real lack vertical dispersion case important set satellites ear level best treble detail sound speakers normally tilted stands thinking placed computer desk ear level would nice klipsch designed adjustable stands could tilted altec satellites tilted could remove stands bend speakers vertical may set speakers set counter kitchen living area apartment sit listen tweeters mid range drivers pointing slightly enough cause lack clarity upper ranges stand seated position notice definite change better however like people like sit listen music stand n nit would best use stands adjust height speakers get ones sell klipsch website instead get pair sanus efsatb black efsats silver bolt klipsch stock stands using one sanus brackets sanus stands better ones klipsch sells tubes bigger base cast iron sanus sturdy omnimounts klipsch sells amazon website sanus cheaper klipsch stands almost half n nwhile order monster cable speaker cable kit klipsch something highly recommend would really nice klipsch designed satellites regular speaker cable connections rather mini jacks way could upgrade stock speaker cables brand speaker cables want would really really cool klipsch incorporated binding posts connect speaker cables instead usual cheap clips n nwhile connect cd mp3 source mini jack control preamp need use adapters want use favorite interconnect cables would really cool klipsch designed control preamp pair rca jacks n nthese nit picks course designed marketed use computers still would nice klipsch designed audiophile mind tell audiophile his her main audio equipment living room setup would great den bedroom rec room garage n nwant cheap truly good great sounding little hi fi system hook nice yet inexpensive cd player nad adcom etc good interconnect cables kimber kable rega tara labs synergistic research using adapters get monster cable kit klipsch wish better one nice little sound system n nthis m planning exactly need build sound system scratch good starting point ca get components m rich m planning getting jolida jd100 vacuum tube cd player hooking klipsch good interconnects time combination work fine feel little computer speakers task worthy something like jolida cdp get jolida 1501rc tube solid state hybrid integrated amp pair magnepan mg12s really music heaven klipsch promedia 2 1 satisfy me n n since writing review found kimber kable makes cables pair rca connectors one end mini plug want hook ipod portable cd player make cable mini plugs ends synergistic research coming cables ipod m guessing mini mini mini rca cables adapters needed cables huge step top bottom musical detail extension built cable anything get radio shack similar store n n okay another addition already long review noteworthy really want hear speakers get monster cable kit patience wait monster cable 2 1 set stock klipsch website went ahead ordered set promedia 4 1s installed shorter 15ft pair promedia 2 1s n nwell expected upper end detail improved greatly stock speaker cables speakers could barely resolve cymbal beats pink floyd comfortably numb re subtle monster cables cymbals resolved well nora jones voice really opened come away cd good always seemed constrained boxed even thought recording monster cables really helped voice cd last thing thought monster cables would improve bass detail cables feed satellites sub needing cable hook ups aside power din control preamp right sat dumbfounded enjoying increased detail bass thought mid range drivers satellites responsible lower mid range upper bass increased detail also helps define lower bass also read elsewhere another way increase bass detail raise subwoofer floor would recommend something inexpensive like herbie isolation feet n n n nthis next upgrade great sounding little speakers
2;13;86;0.6142595089649132;blew ridiculous amount time listening store reading reviews never really helped decide ended buying 3 hooking could test drive returned ones keep hopefully someone situation benefit review ca decide recommend buying ones ca decide test yourself n n speakers nklipsch promedia 2 1 logitech z 2300 bose companion 3 n n background nprevious speakers creative 6 1 think original inspires nsound card creative x fi nprimary use gaming limited music nvolume maybe max around 10 live multifamily complex need lease breaker live name near quality m sound engineer references quality sound ears heard n n 6 1 v 2 1 nyou find 2 1 system rivals even cheap 5 1 6 1 set way around downgrading compromising start space cash mounting locations go 5 1 higher may may appropriate accurate statement see comments n n sound quality nthe klipsch best overall performance came sound second bose third logitech n ni impressed logitechs nice booming sound matter much fiddled eq could get clean consistent sound across board highs sounded watered mids sounded muted lows booming good way granted m sure lot fact turning loud cranked sounded much better situation needed throwing block party sound quality might great n nthe klipsch definitely best overall sound seemed little trouble definition highs extreme lows far two mids lows say trouble mean nothing noticeable multiple speakers hooked time could attributed fact m running low volume far extreme lows think either two systems even lows listen too n nthe bose handled highs crystal clarity tin effect reviewers mentioned adjustment eq able compensate mids corrected eq setup right adequate nothing write home better logitech good klipsch lows thumped nicely seemed fit well extreme lows seemed single rumble opposed individual sounds n n real estate nthe bose significantly outshine two sets comes desk real estate footprint satellite 2 5x2 5 inches headphones might take less space logitechs klipsch take amount space desk slightly larger average desktop speaker large ca fit desk n n controls nall three sets set controls inputs namely bass volume miniplug two n ni preferred bose came controls little wired remote puck thing works excellently sticks spot put volume control consists turning outside puck works excellently one added feature top puck touch activated mute button useless really since volume easy adjust nice bass control bose located back sub near top sub sits desk easy enough adjust reaching behind top turning knob n nsecond would logitech set also wired remote similar bose couple knobs large large bose puck one volume smaller one bass seemed turn smoothly work great one thing like logitech remote light really stay put double side tape rubber pad would easily fix that n nthis one spot klipsch comes last read controller could removed speaker see easy way want muck since would returning 2 3 systems klipsch controls located right speaker similar normal oem speakers volume bass knob volume knob seem smooth two systems tended jump opposed smoothly increase decrease volume might small knob harder make precision changes n nthe power button never concern mine leave everything time issue logitech power switch sub sleep button remote klipsch bose power switches back sub none power switches back subs easy get locate handle putting sleep mode d recommend logitech n n build quality ni mean build actual cones housings stands etc know enough construction speaker materials make judgment cones drivers n ni think bose probably category logitech coming second klipsch bringing rear n nboth bose logitech went together well everything fit tight everything seemed appropriately built acceptable tolerances terms stands housings logitech satellites mostly plastic cloth speaker grilles metal grilles sub sub particle board m assuming metal grille bose satellites metal including stands grilles sub particle board m assuming metal grille moving speakers around whatever course testing seemed side effect operation two sets everything system seemed use heavy enough gauged wire concerned damaging yanked rats nest behind desk n nthe klipsch fell short build quality used comparable materials previous two plastic satellites cloth grilles m assuming particle board sub metal grille stands satellites cockeyed causing speakers lean odd angles nothing average person would notice someone qc caught little ps2 looking cable connects controller sub fit securely snap sub expected style cable two systems concern connected appropriately initial setup speakers left satellite went jiggle turn miniplug plugged back nothing new miniplugs would liked system setup good year start jiggling stuff none matters real deal breakers noticed problems two systems causes question else might done right done n none thing nice klipsch connections satellites normal speaker wire miniplug end fairly easy rig connectors supplied separation distance enough needs n n conclusion nif want best sound find go klipsch hands size concern go bose items noted personal taste opinion make judgments previous information n n d keep ni kept bose look incredible save desk space well low volumes adjusted eq seem sound good enough job love puck controller well know many people dislike bose think nice product companion 3 probably priced 75 150 extra 100 spaced estimated 5 years use 20 year
3;51;67;0.6133997337511045;bought 2 1 speakers little 2 years ago replace 4 1 set klipsch speakers front speakers stopped working never opened subwoofer see burnt purchased 2 1 version 2 1 speakers hooked computer used ripping sharing music media computers around house since media computer every tv house really use computer klipsch speakers anymore leave powered started speakers week needed rip add new music shared music folder heard high pitched sound left speaker pop coming subwoofer opened subwoofer noticed one boards guessing amplifier left speaker burnt also notice power supply spacer even insert onto bolt tighting worst part left speaker midrange driver also burnt n nthis last set klipsch promedia speakers buy anything amp made klipsch ht rf 83 home theater system without klipsch subwoofer never buy klipsch subwoofer go it n ni definitive subwoofer replacing living room thats never shutoff still works like 10 years ago think buy another definitive subwoofer n ni admit promedia speakers sounded great worked quality amps junk recommend buying speakers unless think 2 years life good enough money spent
4;128;62;0.5955820996406406;promedia 2 1 klipsch since 2002 still selling strong still one best computer speakers klipsch promedia 2 1 worth every penny love lot aware compare expensive audio equipment mid priced audio equipment company like hsu want compare sub woofers also speakers satellites may best listen classical jazz said impressed computer speakers ones money purpose little competition there n nfirst reservations first one thing might want aware so called shoddy build quality trouble yet promedia 2 1 like klipsch products trouble build quality m sure ratio well working units defective units aware buy note mean people physically damaged know handle equipment complaints regarding problem n nanother thing recommend listeners acoustic jazz classical research bit affordable studio monitors compare might find much better listening needs good example got plenty good marks would m audio av 40 studio monitors ca handle lower frequencies frequency range according manufactures 85hz 20 000 khz much dedicated better highs mids least bass wo sound tinny either perfect amount lighter music m going say always sound better need listen let ears decide personally think studio monitors sounded much better jazz classical records advice listeners mainly similar genres n nthat said main type music high octane rock choice would take day pair studio monitors even think subwoofers made music tons music would sound like total crap without low frequencies limited bass studio monitor make bands like kyuss queens stone age sound laughable would awesome heavy metal like mastodon without subwoofer indeed mainly listen hard rock rap heavy metal like would even recommend pair studio monitors tried trust listening soundgarden mastodon deltron 3030 queens stone age rage machine etc without subwoofer like owning ferrari two transmissions yes system made music depends listen to n nthese speakers price simply dream computer listening powerful size enough easily fill office room music volume enough rattle windows ease plus listen music rather speaker yes studio monitors better mids highs satellites ones slouch either least ears true sort bright sound think makes much better certain sounds high notes guitars sound nice sharp clear bright people may like love mid range nice enough provide enough backbone bright highs bass ca compete stand alone perfect size never feels underpowered price feel getting satisfaction would expect n nfeature wise much worth pretty easy set addition like computer speakers simple headphone jack output use anything please headphone jack computer psp cheap tv well anything headphone jack headphone jack used plug headphones useful actually adjust volume amount bass speaker system means definitely able adjust amount bass n nif looking well priced computers speakers ca recommend enough easily one best computer speakers sets around whether need sub woofer short list computer speakers worth every penny
5;151;119;0.5677980018613836;3 pairs klipsch flooring standing speakers ksf 8 5 n nkg4 forte 2 little speakers really something sub klipsch sound n ni could recommend speakers anyone computer living room wife listen them n nevery morning coffee n ni m retired searched everywhere satisfying n nspeakers bought n nfor application better speakers market good price too n namazon said would recieved my n nspeakers days n ni would highly recommend amazon klipsch 2 1 your n nnext order
6;90;117;0.5253799196854141;bought best buy looking speakers best buy circuit city offer speakers sound tests far away klipsch speakers sounded best also easiest control sound main volume subwoofer volume located right speaker front easy turn bass well volume sound quality incredible best part speakers price also great compare prices speakers available klipsch blows away final fact sealed deal best buy employee told near movie theater great sound mind used klipsch speakers re looking great computer speakers
7;68;49;0.49664313438803287;really love speakers bought 3 sets them n nthe speakers excellent good sound throughout problem headphone jack subwoofer jack poor quality fail far otherwise great speakers move speakers around sit one spot yet somehow jacks still manage fail n ni probably wo ever buy another set m tired getting rid otherwise good speakers 5 jack failed n n5 stars sound quality 1 star equipment quality
8;107;80;0.47974710030994355;wow m amazed klipsch quality promedia system amazing n ni searching high quality 2 1 pc speaker system willing dish out 100 200 good one many cheaper systems especially grow fond last therefore willing pay good system would please ears last long time came klipsch promedia 2 1 klipsch promedia 2 1 gmx logitech z 2300 2 1 speaker system difficult time deciding read reviews internet deciding ton webpages dedicated comparing reviewing systems great balance cost supreme audio quality pay 400 bose system available n nthe promedia 2 1 albeit older less asthetically pleasing power promedia 2 1 gmx system ruled gmx care quality power speaker cool appearance logitech z 2300 system although great right could fully compare promedia 2 1 system n nfirst promedia 2 1 cheaper online logitech likely due manufacturing age difference secondly klipsch system massive subwoofer comparable logitech system primary driver separate tweeter speaker whereas logitech system primary driver drastically improves high frequency sounds thus better music movie game experience also klipsch around longer trusted quality construction materials endurance logitech deciding factors purchasing klipsch promedia 2 1 speaker system used many logitech systems past enjoyed m dissing logitech make great pc speakers re stuck decision klipsch promedia 2 1 system logitech z 2300 system like hopefully make right choice go klipsch
9;109;44;0.4061635511097064;speakers years sound absolutely great excellent highs plenty bass tons volume unfortunately months back noticed one speakers started cutting crawled desk today check connections tugged one speaker wires came right went push little spring loaded lever connector little pressure bent half fell apart please note never strain connector thing sitting desk completely untouched couple years ever unhooked since bought speakers n ni would expect little durability components put set computer speakers paid hundred and a half found online seems huge number folks issues connectors speakers
10;53;22;0.3701979896723162;bought set one workstation liked much purchased second set another computer well built good sounding computer speakers confuse actual high end music reproduction transducers klipsch well known name early days stereo concert hall speaker systems bad period ok bad decade made lot junk seem enjoying something renaissance producing things sound bad all n nthe subwoofer easily overpower much smaller mid high speakers us normal people never need turn beyond 1 2 unless re physically percussive experience may damage retinas organs construction high quality skimping cable length speaker stands heavy bendable steel making easy aim properly still remaining quite stable put flat rubber feet bottom mine would slide around seem cause interference device eg picture quality monitors device seems interfere cause problems eg noise crackling n ni m deducting points weird din plug used connect everything breaks bend pin whole system kaput also arena minor annoyances led power light very bright annoying happens right front like say anytime re listening something power on off switch provided stands 7 deep 4 wide appears removed perhaps wall mounting they matte black likely quite unobtrusive settings except obnoxious led power light n noverall happy general viewing listening purposes
11;59;21;0.3641011438934055;musician really pay attention quality detail sound computer speakers definitely best value want good sound quality reasonable price go klipsch promedia 2 1
12;72;16;0.34662592739403936;amazing speakers hearing immediately understood re recommended high standard 2 1 desktop speaker systems n nmy previous speaker setup logitech 5 1 system great re purposed media room getting little tired big 5 1 system desktop prefer minimal approach klipsch speakers immediately recommended m happy them n nthey re obviously less clunky suited desktop 5 1 system reasons prefer logitech had n nfirst quality value difference immediately apparent example satellite speakers come sturdy metal stands cheap breakable plastic like logitech trust know logitech stand break re also noticeably heavier general shift inadvertently making contact objects moved around desk top also get tweeters satellite omission logitech s n nsecond volume sub controls one satellite speakers makes adjustments easy logitech actually separate device control volume sub contributed even wire desk top clutter n nthird sound quality amazing things sound noticeably clear especially highs logitech sub still provides plenty low end satellites really shine due included tweeters klipsh sound clear articulate compared logitech s n noverall m glad paid extra money ever go immediately order another set
13;45;14;0.32897853964500645;moving harmon kardon soundsticks ii damaged decided see else could get around price n n home theater setup klipsch decided try computer hands best computer speakers price ever used sound quality blows away soundsticks thought impressive computer speakers bring new level power crispness sound sticks lose volume increased sub also provides great amount bass without issue plastic rattling found soundsticks age increased bass
14;55;10;0.2685663272412834;expected good sound got great sound sound crisp clear great punch subwoofer literally shake house expecting huge sound small package impressed
