Model ranking;ranking;ind;relevance;review
6;8;9;0.5022472023339226;jvc high definition tv better average sound however whenever watch british show use closed caption purchased samsung sound bar wireless subwoofer sound noticeably better still need cc top passionate audiophile drummer interested system projected resonant vocals well full range instrumental sounds ordered sonos playbar tv sound bar sub wireless subwoofer nobrainer install downloaded sonos app intuitive holds amazon music spotify apple music songs etc easily accessed tv remote volume control manages tv streaming audio hookup involves optical digital connection supplied cord short replaced 6 cord nno problems far audio quality playbar superb bass tones greatly enhanced subwoofer costly opinion mandatory purchase using playbar sub tandem streamed music sounds person may get couple sonos play 1 speakers arrange surround setup anyone criticizes price items might also criticize festool selling miter saw almost 1500 saw virtually dustless soundbar subwoofer virtually flawless value personal thing sonos satisfied requisites pleasurable listening experience system highly recommended
7;95;51;0.4863206780505976;great soundbar want use sonos ecosystem love connectivity ease of use sonos two play 1s different rooms playbar subwoofer living room may better soundbars one sounds better previous 5 1 surround system 12 sub decent receiver high end speakers n nthe playbar fills large living room powerful sound couple days subwoofer arrived playbar put good sound definitely needs sub compete good 5 1 surround system eventually add two play 1s rear surround speakers even playbar sub sound fantastic n na word 5 1 dolby digital samsung 65 unh6300 would pass 5 1 playbar purchased viewhd prosumer vhd pro3x1 hdmi switch hooked playbar receiving 5 1 sources
8;57;50;0.4521072796934866;spending couple hours trying make sound come playbar called sonos learn tv 2008 samsung flatscreen incompatible playbar reason believe tv fails output audio hdmi sources optical output based info list tv compatibility issues sonos https sonos custhelp com app answers detail a id 1931 model tv included list technician told tv produced 2009 would likely incompatible soundbar others n nin many ways giving one star unfair m unable judge quality product wo work device
9;13;39;0.40012585163059944;disappointing soundbar thought would great purchase already invested bunch sonos gear bought playbar two play 1s since sonos says work together 5 1 surround turns playbar support dts optical hdmi arc ca even support dolby digital plus 700 playbar 90 time playing 2 channel pcm stereo 199 soundbar downstairs plays every format throw reading sonos support forums appears dts would easy software upgrade requested tons users sonos refuses pretty disappointed around product company
10;90;41;0.3894422719334416;good sound really hard connect wifi conection really unstable several problems mine connect sonos app always sonos app keep telling ad sonos speaker time time connect speakers sonos apps ask updates updated system still ask updates configured spotify sonos time time app erases spotify make process againg reinstalled de app several times n nbeen year sonos really regret buying bose
11;64;23;0.33459732217522986;samsung un55ks9500 curved 55 inch 4k ultra hd smart led tv 2016 model buy sonos playbar modern samsung tv tv remote wo able control volume sonos playbar samsung remotes emit infared total bummer contacted sonos customer support seem care product could communicate samsung remotes even try offer solution
12;55;20;0.32927714520420753;sonos sucks n nrestriction number one reason sonos sucks use wireless speaker want quickly connect play music laptop nope want friends able stream well nope want stream spotify sure re premium subscriber otherwise nah 700 expect able use speakers however choose apparently sonos management feels differently quite frankly offensive bs get software subscription revshare models great vendor forced customer buying speaker garbage next lexus going sell car charge monthly data transfer wheels speedometer apple begin charging monthly data streamed phone watch n nsound sound ok great means neighbor used martin logan sounded full amazing 55 sony xbr 2014 playbar simply much upgrade n napp app poorly designed allow much customization clearly app made hardware company n noverall probably done research take responsibility front said sonos overpriced over constrained overwhelmingly poor value user experience
13;116;73;0.296694580881693;wanted like product sound pretty good paired 3 surround subwoofer two glaring problems n1 tv dialogue delay matter much adjust bothersome enough use soundbar watching sports something else ca see actors mouths went back store bought see found problem demo sports etc n2 connects certain tv even tv digital audio may compatible check sonos web site carefully purchasing luckily able return tv buy one compatible eventually ended samsung
14;60;81;0.2453973043030831;warned wireless signal interferes tv broadcast signal turn playbar tv signal returns sort defeats purpose providing sound tv ca get tv signal would think would option turn wireless signal use wired not n ni m told kevin customer support m one issue maybe m stuck expensive boat anchor n nif warned would purchased would recommend anyone using broadcast tv
15;24;8;0.20378946039419915;note fully compatible oled lg tv volume control mess coupled lg tv sonos choice tv settings
