;ranking;overall;vote;reviewText;summary
12;1.0;4.0;1709.0;"When ""Knight Rider"" and ""Bay Watch"" ended, I felt a distinct void in my life. Without Hasselfhoff's bouncing pecs gracing my television, life simply felt drab and unfulfilling.\n\nImagine my delight when I discovered that Hasselhoff had not disappeared at all, but rather REEMERGED, this time as a serious force in music. It reminded me of when Leonard Nimoy had recorded his stirring tribute to Tolkien, ""The Ballad of Bilbo Baggins."" It was that moving and momentous for me.\n\nHonestly, few Americans truly appreciate how Hasselhoff singularly reshaped the entire landscape of German music. Auf wiedersehen, Amadeus. Hasselhoff ist hier!\n\nI particularly recommend the track ""Do the Limbo Dance"" but am giving the album just four stars because I'm a bit disappointed that he didn't stick with the original German version, ""Tanzen Limbo, Ya!""";This David is a GOLIATH
374;2.0;5.0;527.0;"There is little doubt now that David Husselshaft is a major force in the music business these days. I've already been a fan for many years, but an amazing thing happened recently which I have to share. The doctor said my dog Cherish had only days to live. Desperate for any sign of recovery, I played this CD in the garage for him 24/7, and not only did my dog die, but so did 2 cats and all of my plants. My neighbor came down with a rare form of stomach virus, the one causes massive cramping and explosive diarrhea. Boy did I prove that doctor wrong!\nThe song ""Hot Shot City"" is particularly good.";A little something for everyone on this disc!
497;3.0;4.0;7.0;"I was hosting a Fourth of July barbecue last year and thought to myself, ""What better way to celebrate America than with the music of American treasure David Hasselhoff?"" And as it turned out, I was right - everyone at the party complimented me on my impeccable taste. The only problem was that, as the party went on, more and more Germans began drifting by to listen. I had no idea America was such a popular destination for German tourists - there were almost a hundred loitering outside my house only an hour after the barbecue started. It seemed like every German within a ten-mile radius had been attracted by the incredible range of emotions the Hoff's dulcet tones could convey.\n\nIn conclusion - you probably shouldn't play this CD outside, or at high volume. It's simply too powerful to be exposed to the masses like that.";Great at parties - but be careful
318;4.0;5.0;315.0;"Economic nationalists throughout the country shuddered when the Commerce Department announced a Q3 trade imbalance comfortably exceeding $100 billion, the highest on record.  We buy our electronics from Japan, our confections from France, and our oil from the Persian Gulf.  So why must we import the cream of our own culture from abroad?  We don't store the Constitution in Germany.  We don't launch the Space Shuttle from China.  So why must we buy our Hasselhoff from distant foreign lands?  Demand for this benchmark piece of Americana will surely send the trade economy reeling even closer to the abyss.\nIts pending stupefying popularity notwithstanding, this is not an album without flaws, as flaws are inevitable when one takes on the impossible task of distilling Hasselhoff to a single disk.  This is, after all, akin to reducing Aristotle to a lone pamphlet - nay, a matchbook cover.  Because while this CD does include every Hasselhoff song that topped the charts in ninety countries or more, it was really the deep album work that made Hasselhoff synonymous with underground edge, incendiary lyrics, and youthful angst the world over.  The poets who found their calling in the deeply nuanced lyrics of 1984's ""Night Rocker"" will be crestfallen to see that album underrepresented beyond its touchstone hits.  Jungle-based rebels from Columbia to Burma who viewed 1989's ""Looking for Freedom"" as a clarion call to arms will be outraged that the entire second side of that inflammatory album is absent (with the inevitable exception of ""Flying on the Wings of Tenderness"").  And lovers who exchanged their lifetime vows to the ballads of ""Crazy For You"" will be devastated to see that only two of them are included here (even ""I Wanna Move to the Beat of Your Heart"" is inexplicably omitted!).  However, the wounds gouged into our souls by these countless omissions are salved by the sweet succor of the eighteen songs that are included.  All told, despite the travesties that come from reducing Hasselfhoff to a single disc, this is clearly one of the finest works in the entire oeuvre of human expression.";Achtung!  Achtung!  Der GENIUS of Herr Hasselhoff!!
341;5.0;5.0;189.0;After hearing the sweet voice of David Hankipants, I felt like throwing my disgusted, lifeless body off a tall bridge and plummeting into the deep, freezing waters below. As I got to song 2, I began to vomit uncontrollably all over my floor. The torture continued until song 13, at which time I was rushed to the hospital because my ears had begun to bleed severely. My doctor's told me I had suffered a severe brain contusion, possibly from dangerous exposure to ultra-high gamma frequencies aka bad music.\nWhen I got home, Scruffy, my canine, was dead. He had been exposed to Song 4 and scrathed his own ears off. As he lay in a puddle of his own blood, I will never forgive myself for buying David Hankiman's CD...;David is a pure genius
264;6.0;5.0;129.0;"Rello! Rhis rheedee is rone of ry revorites! Raggy and I reisten ro this rall rhe rime in rhe Rystery Rachine. Rhenever a rystery rappens, I resten ro trhis refore our renvestigation. Rit relps re relax and ralm ry rerves. Relma, Red and Raphne ron't really rike it, raying it's rame and romosexual, rut I ron't rive a thit rhat rhey rink. Ravid Rasselroff ring really recely, rin ry ropinion. Eh hee hee hee hee hee hee! Rhe rong ""Rot Rhot Rity"" is rarticularly rood.";Really Really Rescellent!
483;7.0;5.0;124.0;"What more could be said about David Hasselhoff's looks. Nothing. So it's only icing on the cake that he also has musical talent. And not just your average, Dave Grohl-can-sing kind of talent; Hasselhoff towers above the average singer with his rapid-style singsong rapping. The inflections he gives betray a profound understanding of subtlety, the restraint of a genius. He purposely, almost defiantly avoids hitting the ""correct"" notes on ""Flying on the Wings of Tenderness,"" ""Crazy For You,"" ""I Believe,"" ""Wir Zwei Allein,"" ""Je T'aime Means I Love You,"" ""Freedom For the World,"" and ""Dance Dance D'amour,"" as well as on the rest of the songs on the CD. His mastery of the English language not enough to sate his hunger for lyrics, he crosses over into German, French and even Swahili in some of the songs, giving speakers of those languages something new to revile. Hasselhoff's contribution to musicdom is immeasurable, so you might as well put away whatever measuring devices you were about to use on him.\nThe song 'Hot Shot City' is particularly good.";As moist and tender as brownies
14;8.0;1.0;38.0;"This CD came in the mail today and I was very excited to finally hear the best of David Hasselhoff.  To my dismay however, this album is an exact copy of the ""Worst of David Hasselhoff"" CD which I already own.  Perhaps it's because Davd Hasselhoff really really really needs the money that he'd release a CD which is both simultaneously his best and worst music.  Or perhaps it's because this CD is imported, and somehow people from outside of this country were confused into thinking David Hasselhoff's worst is really his best.  I can't say.  All I know is I now have one too many copies of a David Hasselhoff CD, which puts me afoul of the law.  I don't want to end up on an FBI list someplace or have a court order forcing me to go door to door explaining why I'm a Hasselhoff offender to my neighbors.  So I think I'm just going to return this as quickly as possible and buy something from John Tesh instead.";I feel ripped off
226;9.0;5.0;62.0;"What can you say about David Hasselhoff that hasn't already been said one thousand times before? The man is quite simply a musical genius. Hasselhoff's entire arsenal of musical weaponry is on full display in this album, a collection of his biggest hits.\nAt first I didn't really believe that David Hasselhoff, international star of television and cinema, could actually be a talented musician. I was skeptical to say the least. Then my friend played a few Hasselhoff songs for me and wow, I was hooked.\nThe words flowed forth from Hasselhoff's tender lips like sweet nectar from the mouth of God himself. I found myself in a trance of pure joy and ecstacy as the soothing rhythms caressed my ear. Hasselhoff's hymns had brought me to the summit of human achievement and I was now free to look down at the wreckage and ruin that lie below. I stared into the distance and said, ""Oh thine Hasselhoff, how thy music hath saved my immortal soul.""\nTo say that the beautiful music of David Hasselhoff is life-changing would be an insult; a disservice. Hasselhoff's music is life-making, and I can only hope that you too will experience its profound gifts.";On the first day, God created David Hasselhoff
494;10.0;5.0;61.0;"Oh, mon dieu! Not since The White Album or An Innocent Man has one album forever changed the landscape of recorded music! Hasselhoff manages to morph between genres, blending rock, rock 'n roll, and hard rock into his own creation. A single review cannot express the sheer joy and devastation I feel at hearing this amazing collection. The song ""Hot Shot City"" is particularly good.";Buy the whole KITT and caboodle!
16;11.0;5.0;25.0;I found an old shoebox of cds at a garage sale for $3.  Probably 50 cds in there.  Obviously $3 was way too high.  So I countered with 25 cents. They seller scoffed at me which oddly rhymes with hoffed.  Odd I felt this was some sort of omen from the hassley one himself.  I then saw an elderly women making her way up the driveway and I knew she was going to try to buy these cds from me.  I quickly shoved $200 into the gentlemans hand and said you never seen me here, YOU HEAR!?  grabbed the box and sprinted to my car.  Quickly, I drove home and ran into my basement... or was it my attic.  No Im pretty sure it was the basement.  85% sure it was my basement.  I flung CD out 1 by 1, Cher, the Proclaimers, Billy Joel, garbage, more garbage, I knew it was in here, somewhere!  Finally, my last 2 cds, on top, which I kept as a keepsake because you know where I am getting... was Joey Lawrence - Nothing can fix my love (it TOUCHED this CD which makes it epic).  And under that, the best of David Hasselhoff.  Overcome with joy, I realized how awful I started to feel.  $200?  Thats all I gave that poor man for this CD?  I went to the nearest bank and quickly emptied my bank account.  $734.55.  I went to give this man the rest of my money and when I arrived at the house... the house was gone.  It was like it never existed.  I looked into the heavens for answers, and in my heart, all I could hear was track 12.  The best is yet to come.  So I wait, on this empty plot of land... waiting for one day... for the hoff to deliver more of these pearls of music.  Thank you hoff.... thank you.;Getting hoff on the hoff
445;12.0;5.0;52.0;"...along came David, and suddenly everything changed.\nFor a laugh - in those days it was always for a cheap laugh - I went out and bought Looking for - Best of David Hasselhoff. How ironic I thought I was being. How big, how clever of me to ridicule a recording artist shunned by so many of the ""in crowd"". What did I think it would achieve? I don't honestly know - but perhaps I thought my cynicism would make me popular and more attractive to women.\nLittle did I know that within hours the small-minded man I had been would be all but dead, leaving behind a boy - yes a boy - full of hope, excitement and joy.\nFrom the moment I hit play and Looking for Freedom kicked in, I felt something melt inside me. Within minutes the black hole that had been my heart was no longer and I was on the floor crying tears of unashamed happiness. I won't bore you with all the details of my epiphany, but let's just say that by the time Hot Shot City was over the caterpillar had become a butterfly.\nWords cannot express how strongly I urge you to buy this album. I'm sure you too are a cynic, reading this webpage for a ""big joke"". But what have you got to lose, ""big joker""? Buy it ironically, buy it mockingly or buy it with near religious zeal - but for heaven's sake buy it. One way or another it will change the way you think forever.\nStill not sure? Then ask yourself this: what is more important in your life - ""cool"" or ""love""? Give love a chance - give David a chance.";Dave pulls no punches on this emotional rollercoaster
495;13.0;5.0;53.0;Listening to this album is not so much a musical experience as a quasi-religious one. David is already the world's biggest TV star, an object of desire  for all women and role-model for all men. Now he reveals an unequalled musical ability. The range and sensitivity displayed here will leave your  eyebrows in your hair. He effortlessly runs the whole emotional gamut from 'happy' to 'sad'. With this 'best of' compilation he has filled a  much-needed gap.;A once in a Lifetime experience
6;14.0;3.0;17.0;I was lying in a bubble bath, relaxing to the smooth vocal stylings of 'Hoff, received as a Christmas present from my ex-husband in lieu of child support, when my cat walked across my remote control and it started to play backwards.  Imagine my shock and horror when it started to play Nickleback.;Life changing and eerie
498;15.0;5.0;5.0;"I purchased this because it was on the same page as the ""UFO Detector"". You know how you look up a product and underneath it there is always the: ""Customers who bought this also bought""? Well that's what hooked me. That and the oxymoronic title - ""Looking For The BEST of David Hasselhoff"". Now I said to myself, ""Studly, I think this calls for some investigation"" (that's the name my inner-voice calls myself while most just yell ""Hey you, stop that! I can water my own flowers. Now put that away or I'll call local constabulary.""). I figured if aliens were going to make contact they would likely use a famous figure. Who better than a man who drives a talking car. Well from the first track to the finale ""I believe"" his duet with Laura Branigan - I DID BELIEVE ! Yes not only did I believe in UFOs and that they'd make contact with The Hof but that The Hof himself was the product of a coupling between a human and an extraterrestrial. He was conceived to help us make our way into the next millennium and what sealed the deal was reading the review of George Takei - Oh  My. Thank you Amazon for bringing the UFO Detector and Looking For The Best Of David Hasselhoff into my life.";As good or better than the UFO Detector!
47;16.0;5.0;30.0;Words simply fail me in describing this album.  So do my bodily functions.  I will never forget the first time I heard its life-altering tones - it was at my parent's house eight years ago.  I only came out of the coma yesterday.  Yes - it's that good.  In fact I just turned on the stereo here as I'm writing this review.  Hot Shot City is just about to st\n\n[Note from the executor of the author's estate] I regret to inform the readers of this review that the author immediately lapsed back into an irreversible coma upon hearing the dulcid tones of Hot Shot City.  I myself was only able to prevent myself from succumbing to its insane sweetness by gnawing my own leg off.  I urge you to buy this album, but not to listen to it.  For your own saftey, and the peace of mind of those around you - David Huddelpup's music is simply beyond our current mortal capabilities to absorb.  Hey - did someone just turn on the ste;David is Love
249;17.0;5.0;36.0;"It's no surprise that Hasslelhoff has been nominated for immediate canonization in the wake of the release of this collection of hits.  The album is, simply-put, the Word of God.  Each note, each beat, each utterance reflects a long and careful dialogue with the Lord Himself, resulting in total perfection in the most analytical sense of the word.  ""Looking For--Best of David Hasselhoff [IMPORT]"" is the first real tangible evidence we have of the existence of a higher power.\n""Do the Limbo Dance"" is nothing short of miraculous; Hasselhoff single-handedly refutes the soon-to-be-rejected laws of physics in this daedal little piece illustrating a communal dance where one's weight and center of gravity are impossibly ignored through rhythm, faith, and a flaming pole.  The song is intensely moving, replete with danger, suspense, and above all, love.\n""Flying on the Wings of Tenderness"" picks right up where ""Limbo"" left off.  Hasselhoff not only successfully depicts a formless entity mere mortals perceive as ""tenderness"" as a walking, breathing, selfless beast of burden, but climbs right on top of it and goes on an astounding journey through time, space, and far away lands.  ""I got on those wings / and rode that tenderness beast / and rode it"" belts Hasselhoff in the song's chorus.  The audience is enthusiastically invited along as Hasselhoff and his beast graciously navigate through other-worldly civilizations where an entire gamut of emotions-turned-tangible dwell and interact.\nHasselhoff leaves no questions unanswered when he clearly reveals his divine stature as the second Son of Man in ""Save the World.""  Previously while starring in both of his famous television series, Knight Rider and Baywatch, he had been vaguely alluded to as somewhat of a Christ figure by critics and fans alike, but now there is no question who Hasselhoff really is as he croons ""gonna judge you baby yeah / you're gonna go to heaven it's true / baby shhhhhhhhh be quiet / gonna play that harp in heaven pour vous.""\nAfter this song the rest of the album serves as an interactive rite of passage for any listener willing to believe in Hasselhoff, culminating with the testimony of superstar Laura Branigan in the final track, ""I Believe.""  In this beautifully performed a capella duet, Branigan professes her belief that ""[Hasselhoff] is my Lord and shepherd / take me away / oh dear Lord and shepherd / what price must I pay?"" to which Hasselhoff replies, ""Baby my love is free / so free / all you gots to do / is believe.""\nThe album is not only brilliant, miraculous, and life-altering, but a true testament, or better, a Third Testament, to the word of God.  Reader: take heed and listen to this album lest you miss the rapture train.";Aural Rapture:  Hasslelhoff Finally Delivers Salvation
316;18.0;5.0;35.0;Like a jukebox rolled in body hair, David Hasselhoff is a versatile, astounding performer whose range of songs cannot be denied. Each time he picks up a microphone, people everywhere groan with dread, because they all know too well that they are witnessing the finest musical experience of their lives and are ill-prepared to soak it in before that moment's gone forever. It's not surprising that many have compared hearing David Hasselhoff singing to having a death in the family.\nAnd sure, he is showmanship. He is glitz. But even beyond that, he has substance. His songs have each been put on a stick and dipped in rich meaning. One should savor each song for a while, sucking on them until the nougat of their essence, the essence of their nougat, flow out.\nNow I'm not exactly what you'd call a religious man. I have my background rooted in the cold, hard realities of science. But after witnessing David Hasselhoff throat out these 18 songs at a concert he held for flood victims in Switzerland with a voice that can be compared to a hippo stuck in a rusty beartrap, I do believe that a Hell exists.\nThe song Hot Shot City is particularly good.;You don't have to be German to love him!
493;19.0;5.0;35.0;Gob-smacked. That was my initial response on originally hearing this CD.\nHow could one man possibly produce what will surely go down as a classic tale of fortune and glory, in musical form. Akin to Pink Floyd The Wall, though somewhat more upbeat, this album, if it can indeed be classed as such, takes us on a walk through Mr Hasselhoff's psyche, from his childsome chains, up to his current immeasurable high.\nHasselhoffs tale, remarkable would be an underestimate, is a testament to the very soul of man. He is always 'looking for the best', and not once has he wavered from this path.;Obliterating the dimensions of music
19;20.0;5.0;14.0;"This is amazing. No. More than amazing. Hoff-mazing. I love to listen to it while reading&nbsp;<a data-hook=""product-link-linked"" class=""a-link-normal"" href=""/The-2009-2014-Outlook-for-Wood-Toilet-Seats-in-Greater-China/dp/B001T44Z0W/ref=cm_cr_arp_d_rvw_txt?ie=UTF8"">The 2009-2014 Outlook for Wood Toilet Seats in Greater China</a>&nbsp;and also when cooking&nbsp;<a data-hook=""product-link-linked"" class=""a-link-normal"" href=""/Fresh-Whole-Rabbit/dp/B00012182G/ref=cm_cr_arp_d_rvw_txt?ie=UTF8"">Fresh Whole Rabbit</a>. Once I wore my&nbsp;<a data-hook=""product-link-linked"" class=""a-link-normal"" href=""/The-Mountain-Three-Wolf-Moon-Short-Sleeve-Tee/dp/B002HJ377A/ref=cm_cr_arp_d_rvw_txt?ie=UTF8"">The Mountain Three Wolf Moon Short Sleeve Tee</a>&nbsp;shirt while listening to this and gained the power of flight for 48 hours during which I reanimated the rabbit and solved the wood toilet seat crisis.";Great for background music The 2009-2014 Outlook for Wood Toilet Seats in Greater China
1;21.0;3.0;9.0;I was very sad to see the violence depicted in this album cover. Why is there a man punching David Hasselhoff in the head?;Who's punching him?
375;22.0;5.0;31.0;"There is no point in even TRYING to find the words to express the sonic nuances and subtleties that lie hidden within the bowels of this fine work.  I tried the Oxford English Dictionary and dictionary.com -- no good.  The words simply weren't there.  I spent many sleepless nights reaching back through the entire works of Shakespeare (including all the sonnets) and didn't even find a SINGLE WORD worthy enough to describe this masterpiece.  How can you employ something as lowly as language to convey the emotions aroused by this celestial work?\nI believe that God has blessed Hassselhofff with many fine things.  Lush hair, a winning smile, a talking car.  But nothing, NOTHING is as important as the gift of divine melodic construction that the Lord saw fit to bestow on this fine auteur's shoulders.\nOut of all the tracks on this meisterwork, I would highly recommend the song ""Hot Shot City"", as it is particularly good.";Where are the words?
384;23.0;5.0;28.0;"Take this as your last warning: pop music as we know it will change forever once people start learning about this amazing, triumphant album. Those who have already discovered its pleasures know the specialness and exceptionality that this music presents. With a flair for showmanship and two enormous pecs as his backup men, David Haltertosh shines withall the glory and dazzle that he can bring to the world of song. He rears his golden head back and vomits out the most eternally mindblowing baritone voice you have ever heard, a voice that sort of sounds like an ox stepping on a railroad spike. Witness the sonorous tones of his masterful voice on ""Crazy For You."" Behold Hankershank's trademark howl on the ditty ""Je T'Aime Means I Can't Sing."" Thrill to the talented talent he holds in the heartstring puller ballad ""Is Everybody Happy.""\nBut execution isn't everything. There's a very deliberate structure and pattern that emerges from the track sequence within the album and the way they flow from one into another. For example, ""Do the Limbo Dance"" seems to hit the same themes of overpopulation and teen pregnancy as the song that follows it, ""Flying On the Wings of Teenage Action While the Parents Are Away."" The same type of shared subject matter, but this time more self-reflective,  cross the songs ""The Best Is Yet To Come From This Godawful Album"" and ""Freedom for the World From Having To Listen to This Total Groaner of a CD.""\nTo top things off, the final three tracks on the album offer a glimpse of what David Huskerbank has to offer on future releases: ""Dance Dance d'Amour,"" ""Everybody Sunshine (and Get As Far Away From This Goatblowing Dreck)"" and ""I Believe I Would Rather Shoot Myself In The Face Than Listen To Any Of This So Called Music Ever Again.""\nThe song ""Hot Shot City"" is particularly good.";A collection virtually brimming with fervor!
205;24.0;5.0;26.0;"I'm not much of what you'd call a pop music critic. I prefer a good Hobbit walking song or working in Mr. Frodo's garden. But the moment I overheard these wondrous tunes playing from outside a window, I knew I had to know who sang them.\nTurns out it was a Mister Davis Halvertrogg who sang those songs. I haven't heard such beautiful melodies since the fair Galadriel, Queen of Lothlrien, bearer of Nenya, sang a goodbye tune to the Fellowship.\nFrom ""Falling In Love"" to ""Dance Dance D'amour,"" this good sir has captured the joy and wonder of singing. I am stunned in awe by his delivery and unique approach to song structure. ""Je T'aime Means I Love You"" is a wonderful translation from Elfish. His songs are like ancient spells being conjured, cracking one's heart open as he says ""MELLON.""\nBut the quality of Mister Davis' voice, it makes me recall the tortured screeching  of four orcs getting impaled by Aragorn's sword Andril, ""Flame of the West.""\nThe song ""Hot Shot City"" is particularly good.";There's some good music in this world, worth fighting for!
