;ranking;overall;vote;reviewText;summary
48;337.0;5.0;6.0;"Must one actually listen to the mammaliantechnopoppyschologico-politicoauralorgasmic bleatings contained in ""Best of Dingbert Hassellaff"" (BODH) to understand DHis impact on the cultural life of late 2nd and early 3rd millennia (though, these traditional demarcations of time certainly will be replaced by a system in which time before 1995 is identified as pBODH (pre-Best of Dedrick Haqqashaqq), and thereafter as aBODH; thereby making the current year 12 aBODH.  In fact, cosmic time (I once missed the ""$1 Million Dollar Question at the ""Who Wants to be a Millionaire: Play It!"" attraction at the Disney-MGM theme park at Walt Disney World--it asked how long is a Cosmic Year (none of the answers considered the existence of DH; and neither did I, as I now look back sadly on my ignorance in those days)) will be similarly demarked--Stage pDH (pronounced pee-du in the Germanic style) taking the universe from the Big Bang (during which the very stardust that would one-day become ""Hot Shot City"" was created; conservation of matter being what it is) to BODH; Stage DH (""du"" or ""duh"") taking us from BODH Year Zero to end of DH's natural life (hopefully no time soon, so that DH can contribute DHis amazing contribute to existence from the subparticular level to the edges of the known universe and beyond (because surely that's where the aura that surrounds DHis music is heading (given that the bounds of earthly, solar systemic, galactic, or universal comprehension have been exceeded))) ; Stage aDH (""ah duh"") taking us from the end of DH's natural life (there's that unfortunate phrase again--trust me, it's only a conceptual construct at tDHis time--in fact it may be that DH's musical genius may carry DHis earthly body, satin pants, mullet haircut and tightly woven chest hair far beyond the normal spans of a human life (to a tortoiselike 200+ years; a sequoia-like hundreds of years; a Methusaleh-like 980 years; or a Jurassic-like 65,000,000 million years that some of the late-lamented dinosaurs lived, although without the existence-snuffing comet impact that so sadly (for modern-day zoos and children, especially) ended their reign (albeit no-so-sadly, given that their downfall made way for a continuing evolution that gave rise to birds, mammals, lesser primates, greater primates, early man and eventually modern man, musically challenged in the days of the cavemen (though no audio recordings survive from those times; one need only to compare primitive cave drawings to the works of such modern masters as LeRoy Niemann and Scott Adams (creator of Dilbert) to gauge art's development, and project a similar arc to the world of music-a mastodon rib beat against a hyena bladder stretched over a hollow stump would compare quite unfavorably to the percussive perfection displayed in any track from BODH (but especially Track 6, which many listeners feel to be particularly good)), but gradually advanced via the work of medieval minstrels, Mozart, Mendelsohn and (George) Michael (""John the Baptist"" to DH's ""Jesus"" if you like those kinds of analogies--think of the similarities in hairstyles (head and chest), clothing and musicality) to the collapse of the Universe (preceded by the collapse of the Sun and the end of Life on Earth, but surely by then technology will have advanced such that the life force that is DH can be launched into the infinite corners of the universe to be experience by life and non-life forms whose suns have not collapsed yet); and ultimately, Stage anUDH (""ah noo du"") being the Dawn of a New Universe, where the power of DH's screeching vocals (so like blind swallows attempting to mate with a hot waffle iron) and manly torso ignite Big Bang II.)) (extra parenthesis for safety--I'm afraid this sentence will fall out of just one)?\n\nI think not, as reading the testimony of those who have (or perhaps haven't) listened to BODH has given me the insight to write the above question, which I can only pray that DH will choose to set to music and record, as DHis Magnum Opus, DHis ""MacArthur Park"", DHis ""Honey"", dripping its loving beauty, like sweet green icing flowing down, over the ragged children standing outside of Wal-Marts from Antigua to Azerbaijan, from Beirut to Bug Tussle, from Calcutta to Camden, from Dusseldorf to Dubai (there's that ""Du"" again), from Davis (California) to wherever the Branch Davidians are holed up these days; from the Hofbrauhaus in Munich (that's Munchen for you native Germans, although I don't know how to type those two little dots that should be over the ""u"") to Dustin Hoffman's (wow, another ""DH""--DHis karma is everywhere) backyard (but now I'm straying from the Wal-Mart image--one can see a Wal-Mart stronghold of Branch Davidians perhaps; and maybe even a Wal-Mart next to the Hofbrauhaus, but there's no way that Wal-Mart will be allowed to build in Dustin Hoffman's backyard; let's just replace Dustin Hoffman's backyard with the that ever-rockin', nonstop-party stronghold that DH describes so particularly goodly and well-- Hot Shot City!)\n\nNine stars for cosmic impact; one star for musicality.  Average--five stars.\n\nThanks for reading.  Stay strong.  Devilfish Hungsluffle forever!";Hassellaff Rocks Cosmic Questions
218;338.0;5.0;7.0;"Before I ever heard of David Huskenporch, life was a dreary humdrum doldrum. But ever since that visit to Sam Goody where I purchased this fantastic album on Compact Disc, my outlook on my situation has improved vastly! For example, my low-paying, dead-end job is now an exciting career with potential for advancement! My ex-boyfriend who left me for a younger, better looking woman is now someone I never had anything in common anyway! And those festering pus-filled sores in my thighs and back are now just lovable quirks about me! Thanks David Hamperbunks, you totally helped my view on the world!\nAnd ""Hot Shot City,"" man alive, that song is particularly good!";A real foundation shaker!
228;339.0;5.0;7.0;Like the mating cries of the people in the flat upstairs, this was something I initially felt ashamed listening to, but when I realised the pleasure to be gained from it, I just wanted it to be louder and louder until the final crescendo.\nIt's really changed my life.  I feel dirty, but by telling you all I feel cleansed.  Hopefully you will all listen to it in the same way as me [censored by amazon.com], and we can all be dirty together.\nImagine a world of dirty, shameful listening, bonded together by one thing- David Hasselchuff and his incredible chirping.  If I was physically able to make love, I'd have a beautiful woman playing in the background, while I made love to this CD.\nBrilliant.;A little bit naughty
52;340.0;5.0;6.0;"AMAZING!!!\n\nThis is such a great album.  I have to admit I was thinking it might be a bit of a joke after all the stick David Hasseltoft has received recently but this really is a superbly written, intelligent set of songs.  Pulling out all the stops, Hasselcroft takes you on an emotional rollercoaster from the tear inducing ""Flying on the wings of tenderness"", to the vibrant ""Do the limbo dance"" which quite literally had all 200 guests at my brother's wedding doing the limbo in their underwear such is the energy and raw passion of this track.\n\nWithout a doubt though, ""Hot shot city"" has to go down as my favourite and I've seen hardened criminals rip their shirts off emulating the Hoffs dance moves to this classic tune, which features fine back up vocals from Gary Wilmot and Sting.";Hofftastic
244;341.0;5.0;7.0;The worldwide admiration for the works of David Hasselhoff will only be reinforced by this majestic compilation of his finest moments.\nUntil quite recently, fans of the tikka-tinged beached warbler could only appreciate his music in his native American English or his beloved German. Now that has changed, with the release of 'Wyt ti'n gwybod ble mae Dafydd Haffelogogoch [MAG] ~ Dafydd Haffelogogoch', the Welsh-language version of his masterwork. This Welsh translation, though not always literally identical to the English, never fails to maintain the feel and spirit of the original.\nSeasoned listeners will already know that track 6, 'Hwch Lodig City', is particularly good, but all will be surprised by the intensity Haffelogogoch is able to generate not only on this justly-famous paeon to modern living, but throughout the album.\nAround the world, millions have used the romantic expressions of love and lust found on Haffelogogoch's albums to complete the mood on steamy nights in with a loved one, or alone. Now, your chances of wooing that filly from Crymech have improved tenfold, with just one purchase.\nAs a frequent backpacker, I only hope that Hasselhogg will release further versions of this essential album in more languages - I long for the day when my pack is filled with nothing but versions of this CD and I am welcomed everywhere I go.\nFive stars, and highly recommended.;Wooing fillies from Crymech? Look no further.
59;342.0;5.0;6.0;"This has been in my car's CD player for like a thousand weeks it is seriously the best album I have ever heard. Hasselhoof is so much fun to listen to and it also makes you think. I know all the words to all the songs by heart and my friends and I love to sing along even though we don't sound as good as he is haha. The song ""Hot Shot City"" is particularly good!";OHMYGOD I love this album
251;343.0;1.0;7.0;more cowboys have died in swollen rivers\ni love you;michael, i think we're being followed...
253;344.0;5.0;7.0;"THE MAN has definitely driven the point home with this one.  Musical genius shines through on this classic hits compilation from the guru of talking cars and beach bimbos (and himbos).  My personal experiences during my first listening session involving this gem is testimony to his ""musical"" vision.  From the pants-wetting thrills of ""Looking for Freedom"" to the epic bowel-emptying climax of  ""I Believe"", David Hossenfeffer lends his artistry to the most excruciatingly original delivery of rock and roll since Brittany Spears first chose music over a life of prostitution.  The music gods are literally going to war over this set.  You can imagine the powers that be ready to commit Hari-Kari over this mind altering collection.  I find myself crippled with abdominal distress, as the CD seems to carry on endlessly.  The delirious agony peaks on the seventh song: ""Save The World"".  I literally had to phone 911 after the first dozen bars of this hidden treasure in Dufus Hagelberg's catalog.  The EMS technicians threatened a mercy killing if I continued to refuse to mute the stereo system.  Once the eighth song "" Those Lovin' Eyes"" began, they ran from my dwelling seeking treatment from the technician who wisely stayed behind in their vehicle.  I was glad to see them leave, as I realized at this moment, that surviving this torrent of aural torture would surely make me a stronger and better person in the long run.  Needless to say, by the time the CD concluded, my audio system had been so severely damaged, I can only relish the experience in my memory.  Do yourself a favor and get yourself a copy of this extraordinary album!";It's going to make you stronger!
258;345.0;5.0;7.0;"No medal, no award, no ceremonial praise would befit the debt I feel modern society owes the monolithic pinnacle of maestrosity that is Dudel Handelschmidt. From the rapturous, mono-syllablistic climax of ""Du"", to the spellbinding tranquility of ""Flying on the Wings of Tenderness"", Dinky Vunderschnapp's transcendental ode to humanity truly is a wonder to behold.\nI simply can't express how gratifying it is to see one man, one lone ranger, persist in his quest to wail this great message of never-ending hope into our otherwise unbearable lives.\nDmkoff Hedliekeschtick, we salute you!\nPS: ""Hot Shot City"" manifests an artistic mastery and depth that is missing in much of today's popular music.";The key to life, wrapped in leather
72;346.0;5.0;6.0;Music from now on will be going downhill, because I cannot imagine anything surpassing the heights that this artist David Hoppernuts has reached. There, I said it.\n\nA bold statement, I know, but think about it: Nothing can ever top this, folks. Beethoven is dead. So are Paul McCartney and Ruben Studdard. So who else can produce music that could possibly defeat King David? Nobody.\n\nWe are both blessed and cursed, I've realized. Cursed by knowing that no music can ever be this good again, but blessed because.. uh.. blessed because... oh, shoot. I forgot what the upswing to all this was... Hey look, a penny!\n\nThe song Hot Shot City is particularly good.;His spot in the Rock 'n Roll Hall of Fame awaits!!!
82;347.0;5.0;6.0;"The delicate vocal stylings of Devine Hanselkopf made the hairs on my chest stand up. I couln't believe that the angelic sound emanating from my speakers was from a mere mortal man. I mean, the track ""Hot Shot City"" alone was enough for me to drop to my knees and beg the almighty for more time here on this rock we call Earth so that I may continue to bathe in the glorious sounds of Dingle HeavingHairyChest just a little longer.";Heaven on Earth, delivered right to my ears
268;348.0;5.0;7.0;Sorry, this won't be quite as turgid as some of the other prose in this arena. I'd like to touch on an overlooked aspect of Hargleheimer's music: it's the ideal accompaniment to that home-improvement project you've been putting off! I mean, talk about motivation- Davey makes Tony Robbins look positively curmudgeonlike. The first time I heard this, I reached for my reciprocal saw and in a flash had doubled the size of my rec room. Imagine what it could do for your three-car garage or attic rewiring. Can't you just taste the power of that mighty Makita in your hands, throbbing to the insistent beat? (Oops- perhaps I AM getting a bit turgid at that!)\nA last note: you'll want a louder track for working with belt sanders and the like. In that regard, Hot Shot City is particularly good!;Belt drive? Chain drive? Just let David drive!!!!
86;349.0;5.0;6.0;I own one compact disc. One, single, compact disc. The sum of the entirety of my compacted diskette collection is one to the power of one. I have the same number of CDs as I have penises and hearts.\n\nBut if you asked me to relinquish my hold on either my heart, my member, or my CD, I am certain of which I'd choose. For the music that adorns and infests the singular CD I own is that of the one and only Darvid Hastlehof.\n\nHastlehof is a genius, the likes of which this world will never again be acquainted with. How a man can create art as deep, intelligent, thought-provoking, creative, spiritual, melodious, ground-breaking and downright essential as this, whilst at the same time remain so grounded, humble, genial and hairy is a question I fear will never be answered. In writing and performing the songs on this album, Hastlehof clearly plumbed the depths of the human experience to a level never before charted. He was brave enough to wrestle with the previously untouched black-holes of his own psyche, and yet somehow he managed to return from the event horizon with his sanity and leather jacket intact.\n\nListening to this CD is like being dead: it's never gonna get any better. Because this CD is unbetterable. It's the best.\n\nThat's why it's the only CD I own. And that's why it should be the only CD you own. When you have perfection, why settle for inferiority too?\n\nOh. 'Hot Shot City' is a particularly good track.;"Get your hands; Hoff my woman, motherfunker!"
277;350.0;5.0;7.0;Somewhere between David Hasselhoff's nose and chin is a hole from which pour out such glorious symphonies. This big music hole hacks out gorgeous songs left and right, splattering any listener with fertile lyrics. It's this gift of song that David brings the world, and hopefully the world doesn't bring that gift back to the store and return it for a pair of flip flops.\nI could go track-by-track like the other reviewers do, but that would be time consuming, and my break at Denny's is almost up. So suffice to say that this album manages to catch all the rare, wondrous output of David's songhole and burn it forever on CD for people to rip and share on P2P networks with others who are too lazy to buy the danged thing. Hot Shot City is everywhere on Kazaa.;Spin that CD like a record!
280;351.0;5.0;7.0;"Ah, to be sure, folks up and down the bay have sung the praises of David Hairyhunk's acting career. What kind of sentence was that?\nLet me start over. I just want to express my utter joy at listening to every millisecond of this astounding work of art, ""Looking For, the Best of David Shrunkentrunks."" It's rare enough to find someone so talented as an actor. But to hear them actually sing with the same quality as that of a marmoset sodomizing two gerbils, it's such a pleasant surprise!\nI can't name a favorite track because they're all so mindblowing. ""Wir Zwei Allein"" blows my mind. ""Crazy For You"" blows my mind, as well. And ""Looking For Freedom"" really blows. My mind.\nBut to choose one track over another is like choosing children- there's a lot of crying involved and you end up causing a big scene at the bus terminal. The song ""Hot Shot City"" is particularly good.";A husky voice from a hunky boy
290;352.0;3.0;7.0;"When I read the reviews of this album, it created the impression that this is a truly, majestically awful record.  Therefore, as a longtime fan of really bad music, I had to buy this CD.  Boy, was I disappointed!  The music isn't really all that bad; sure, the songs are formulaic and the lyrics are unbelievably trite, but I was hoping for something with the sheer awfulness of early Shatner/Nimoy, Bobby Goldsboro, The Shaggs, The Annoying Music Show... you know, the greats.  Only three of the tunes on this album significantly pegged my bad-o-meter: ""Save the World"" (which is only bad because of the awful extra vocals by David Hasselhoff's young daughter), ""Freedom for the World"", and ""Je T'Aime Means I Love You"" (which may have seemed worse than it is given that I'd already heard the 13 previous bad songs in a row). In fact, much as I hate to say it, track 6, ""Hot Shot City"", is, as widely reported, pretty good (at least as bad songs go).  This is not really a Bad Music album; it's more like a slightly rockier version of a Michael Bolton CD.  If there was a musical category for ""Stunningly Mediocre Music"", though, this would be at the top of the charts.";Doesn't suck as much as I'd hoped.
292;353.0;5.0;7.0;"Shall I compare thee to a summer's day, Dingle Horkledork?  A day in which an abundance of spandex-clad flesh jiggles waggishly upon the sun-dappled sands of southern California is an image that the terpsichorean vocals which grace this work of genius may well evoke!\nIt saddens me that Humpenschafen neglected to include such seminal works as ""Night Rocker"" and ""Der lifeguard und das M&auml;dchen mit gro&szlig;en Br&uuml;sten"", which leaves this essential collection a tad incomplete.  But one must never forget that above groovy curls, bitchin abs, Mentadent incisors, collagen-injected lips...above all that, Harkenfark is about his FANS and about pleasing them incessantly with his cacophonous atonality.  He does not fail the legions of youthful Germans here!  One can just see the man, clad in tight orange swim trunks and a heavy leather jacket, goosestepping through Berlin with a pied-piperesque train of young Deutschers in tow, alternating between choruses of ""Deutschland Uber Alles"" and ""Flying on the Wings of Tenderness.""\nWhen I first heard about this release, it was the promised inclusion of ""Do The Limbo Dance"" that had me soil my trousers more than one time, I must confess.  However, the true gem here is Hapferschpfapf's paean to Minneapolis' 1980's underground rock scene (from which he draws a large, obvious influence) with the minimalistically titled, ""Du.""  Bob Mould is shedding a tear somewhere.\nWith a tongue dipped in golden compost, Doogie Howserhiney spreads melodic fertilizer to the soundgarden of the soul, his voice bringing to mind the sound of a kookaburra deflowering an accordion.  His music, along with that of Wyld Stallyns, will bind the galaxy together!\nThe song ""Hot Shot City"" is particularly good.";"Das Lied ""Hei&szlig;e Schu&szlig; Stadt"" ist besonders gut."
305;354.0;5.0;7.0;After reading all 510 reviews below I was finally convinced to take the plunge and immerse myself in the world of David. So I placed an order for Looking For... and patiently squatted under my letterbox.\n3 days later, at 07.13am, a small brown parcel fell into my lap, waking me with a start. This was it, the day had arrived!\nI immediatley changed into my P-J's, whipped up a hot cup of Horlicks, dimmed the lights and settled back into my favourite yellow bean-bag with my hi-fi remote close at hand.\nFor some reason I skipped straight to track 6, which I realise now was quite a dangerous thing to do. That voice, teasing me with the first few lines of the masterpeice that is 'Hot Shot City', hit me like the flatulance from a hippo with kidney failure. I writhed in delight as the sound of thirteen camels being forced through an industrial wood-chipper washed over me.\nThe lyrical content was sublime, I learnt more about life in one verse of 'Everybody Sunshine' then I have in 16 years of education. You may find that hard to believe but just sit down for a couple of days and really think about the words. I mean you soon realise that the man is right, everybody IS sunshine - in their own way.\nBeleive me, music doesn't get deeper then this, and studio performances don't get any more exciting. The power with which he chokes out a chorus will cause your pulse to pound and your bowels to loosen. And for him to put possibly the greatest photograph since the invention of the camera lense (and vaseline) was the icing on the cake.;To be touched by hangleharf
308;355.0;5.0;7.0;"In trying to pen a review for this dense body of work, i went through websters dictionary. No word could be used to describe the brilliance held within. The only downfall of this one cd is it is just that one cd. A best of David Hasselhoff in one cd is like saying a cup of water holds the power and majesty of the ocean. Hasselhoff is an artist with his voice his pallet and the world is his canvas. He paints pictures of love won and love lost, happiness and sadness. When the cd was over I sat still and starred at my wall. I knew then my life had changed I knew what life meant. ""Some people stand in the darkness afraid to step into the light...I'll be ready."" God smiles on David Hasslehoff this day.";Hasslehoff reinassance man
323;356.0;4.0;7.0;Oh wow....... this record makes me want to drink a bottle of nyquil at 5 in the morning and write letters to an old girlfriend that lives across the villiage from me.  It's pure pop sensibilities inspires me to get on an old beat up ten-speed bike and ride across town hollering at anyone that will listen to me about the genius that is David Hasselhoff and then maybe I'd cut off my pinky toes and mail them to a complete stranger.;Hasselhoff........mad genius?
367;357.0;5.0;7.0;"If you have ever felt the warmth of a mothers love, if you have ever seen the inoocence in a child's eye, if you have ever wondered on the cuteness of a little bunnies floppy ears... find all these feelings and more expressed one more time by a modern day musical genius.. a veritable paragon of this semi-classical musical form..\nOn the other hand if you have ever felt the terror of an oncomming war, or the evil of a dictators lawlessness, the horror of death and the nighmareish soul busting angst of the human condition. Here you will find each of these reprised and set in a wonderful tableau of 'living music'.\nWe are surely not worthy of such an incredible CD. I for one feel honoured and humbled that this should be released.. what is probably 1000 years before its time... now.. and can only repay his unending kindness by buying all available copies now and distributing them to orphans and homeless people.\nThank you David.. Thankyou from the world..\n(""Hot Shot City"" is particularly good btw )";A piece of paradise in plastic CD form
378;358.0;5.0;7.0;Yesterday I saw the birth of new life. Yes, that's right, new life breathed into the world of popular music. Oh how we have awaited the arrival of this breath of fresh air in a world of mediocrity. David Hooverdaft's album is the sparkling light in a chasm of darkness and despair. His vocal tones can be likened to the sound of a rutting rhinoceros who has broken into the female pen. Thank you oh thank you for this great work. I particularly enjoyed Hot Shot City with it's courageous and flawless rhythms. Shine on you crazy Diamond!;Splendiferous !
386;359.0;5.0;7.0;"How soon people forget. Back in 1995 everyone was playing this album, roller skating at the local disco with their hippie beads, protesting Vietnam and whatnot. But now, they're all grown up preppies, listening to Dexy's Midnight Express or J-Lo albums. What none of them realize is that David Hasselhoff is a perennial favorite, a timeless gem of a singer with a voice a lot like three wild boars attacking a wounded elk. So instead of being ""hip"" or ""with it"" or ""having taste,"" I choose Hasselhoff for his amazing songs. The song Hot Shot City is still particularly good, after all these years.";Still the best out there, he is!
