;ranking;overall;vote;reviewText;summary
109;112.0;5.0;12.0;"""I've been lookin' for freedom. I've been lookin' so long. I've been lookin' for freedom"". ""My master, my holy savior, what freedom do you seek?"" said I, in my state of utter humility after hearing the earth-shattering voice of our Lord. ""Still the search goes on. I've been lookin' for freedom"" is the response the almighty roared unto me. It was at this very moment... this glorious moment that will ring in my mind for as long as I live as the moment where the world was pure and perfect... that I realized that the voice that I heard was not the voice of the Almighty, but it was rather the soothing, incredible, commanding voice of none other than David Hasselhoff, a new and modern Savior sent to redeem us all. These beautiful words that were sang in a manner which made my very soul melt in a state of servitude to the one making this beautiful sound were nothing more than lines from the brilliantly-titled song ""Looking for Freedom"", the first track off of this great album. David Hasselhoff is a genius in every manner of the word, and I will follow him to the ends of the earth.\n\n  This album is a glorious achievement of beautiful, euphoric sounds and poetic, unearthly lyrics that are so harmonious and indescribably wonderful that it will make you a suicidal maniac since you will no longer be satisfied with yourself after gaining the knowledge of your complete inferiority to the demigod that is David Hasselhoff. This album will rock your world; it will unchain you and release you into a state of enlightenment by letting you see just how amazing and triumphantly glorious one man can truly be. However, that ""one man"" is just that, one man. No other human being on the face of the earth could ever even hope to be half as beautiful and genius as David Hasselhoff, and I, personally, would consider it blasphemy if someone were to suggest that it could be done. David Hasselhoff has achieved, with this album, a work of art so astoundingly ethereal that whoever listens to it will have a complete redemption and cleansing of the soul, and it is a piece of art so far above all other works of art that calling it ""art"" is almost demeaning. Therefore, I will put this heavenly album into a category all on its own, called ""joob"".\n\n  This album is not art, it is ""joob"", and no other word is fit for use in description of this incredible achievement that dwarfs all other accomplishments of mankind. I honestly encourage you to use every bit of money you have at your disposal to buy as many copies of this album as you possibly can. If at any point in your life you accumulate enough money to buy this CD again, do it immediately. The creation of this CD has completely invalidated Maslow's Hierarchy of Needs, as the ownership of this CD takes precedence before all other supposed ""needs"" of life. Forget food, forget water, forget breathing itself, as you'll find the only true purpose for your respiratory system is to allow you to sing along with David Hasselhoff for as long as your lungs will allow. Sell your house, sell your kids, sell everything you own and dedicate your life entirely to David Hasselhoff and this album. You won't regret it.";The Almighty spoke to me, and he said...
125;113.0;5.0;12.0;"One day whilst surfing the internet, I came across this quite remarkable set of reviews.\n\nAt that very moment I somehow knew that every hope, every desire and every prayer that I had ever had in my life would be met with one, simple step: acquiring this CD. Acquiring DAVID.\n\nI shot up from the computer, sending the keyboard and monitor flying to the ground, and ran straight through the window. I didn't stop, but with hair and face streaked with blood I sprinted and sprinted, just one thought in my mind: DAVID.\n\nAfter what seemed like minutes but what was in fact minutes, I arrived at my local music store and ran straight in. I didn't have to worry about locating DAVID; it was as if the store was night, and the CD (oh, the CD) was the light. I seized it and ran out of the store, a hail of bullets flying around me as I did so.\n\nAs I ran home I tore the plastic wrapping from the cover, eager to waste not a second longer in my life than was strictly necessary before hearing it.\n\nBefore hearing IT.\n\nBefore HEARING.\n\nTime then seemed to move in a dimension that was simply different from anything that I had known previously. One moment I was sprinting, tears streaming down my face and Hosselhaf held next to my heart; the very next I was wrapped around the speaker, clinging to it like the universe would explode if I ceased; Hot Shot City (on repeat) burning into my soul.\n\nAt last. I could HEAR.\n\nIt took me some time to be able to get a grip on reality. But after a time, it came to me quite what I was hearing. As astonishing, as incomprehensible, as truly extraordinary as it was... God was talking to me.\n\nListen for yourself... while mere words are wholly insufficient, a mere ghost of the all consuming rapture that is Drongvoid Hargleswitchy, they reveal some of the living beauty:\n\n""We're flying on the wings of tenderness\n\nRiding the rivers of gentleness\n\nInto the garden of love wi'll flow and watch it grow together\n\nWe'll build a castle out of honesty""\n\nI spent the next three years flying David's wings of tenderness.\n\nI still have the marks of the speaker cabinet on my skin.\n\nIf you do not purchase this CD, your life will be without point. Without purpose, without love, without joy, without destiny. You have a binary choice. Purchase DAVID and bring DAVID into you HEART and then you shall truly know the meaning of life. (Never mind five stars out of five; if I could give this CD ALL THE STARS IN THE SKY, it wouldn't describe half of the pleasure DAVID brings to me.)\n\nOr don't buy this, and live like a flea that lives on a cesspit of filth. And pointlessness. The cesspit of filth and utter pointlessness.\n\nHot Shot City was also good; did I say that already?";Mere words are so pitifully insufficient
43;114.0;5.0;10.0;"An hecatomb of hits. Being french I have a special feeling toward ""Je T'Aime Means I Love You"", which by the way is true, ""Je T'Aime"" means ""I Love You"".";Whaoo
269;115.0;5.0;13.0;"In my left hand is a fava bean; far away, beyond an ocean and half a continent, is Mount Everest, towering into the clouds. David Hasselhoff is, as this album evinces, that mighty peak, and all other musicians -- alive or dead and stacked into a pile and rolled into a sphere -- are that fava bean. A fava bean, or a favored being, one who has been to the Olympian heights of musical transcendence, and has returned, Moses-like, to Earth to share his melodius bounty -- which would you choose: the bean or the being, the fava or the favored? David is a lyrical King -- King David let us call him, and like the Biblical King David (that divinely-inspired strummer who penned the Book of Psalms), our King David has fed on manna and honeydew; but, rather than metabolizing that Godly nourishment for his own intestinal benefit, our musical monarch sends back his angelic mastications to us, like a honey-flavored reflux, and pours it into our ears, and from thence into our souls. In truth, his wondrous warblings are too inspired, too holy, to be apprehended in anything other than snatches; upon procuring this CD, one must listen to it in four-second segments, like reading Shakespeare by lightning, lest one be transported by the heavenly harmonies into the ethereal realm of seraphims and cherubs. Time has passed, and I am revived: I am ready for another snatch, an aural glimpse of the larynx of the Lord.";Hasselgod
276;116.0;5.0;13.0;"People who have listened to this album in its entirety can be seen wandering around town in the middle of the night, mumbling something about 'orange float thingy' or 'moving red headlights'  and tearing their hair out. These symptoms are probably from hearing the divine reflections found on ""Looking For,"" a collection of the greatest German pop songs since ""Teutonic Theme"" by Celine Dion.\nHurmeloaf is an entertainer extraordinaire. His songs of freedom and love are perfect for any baggage claim area or podiatrist's waiting room. Every song has been blessed with his trademark yowl, a cross between the shriekings of a wombat and the rumbling of your grandma's lower intestine. The general effect of listening to this entire album in one sitting is disorientation, followed by nausea, cramps and respect for Germany. Listen for yourself, it's a high-protein treat!\nPol Pot City is particularly good.";A spectacular shock to the senses
311;117.0;5.0;13.0;"It would be easy to hate David Hasselhoff. Oh so easy to consider those looks, that sense of style, that effortlessly gyrating groin, those legendary performances as the `Knight Slider', and the driven mind that created, in `Bayswater', the most successful swimming trunks-based television drama since `The Man From Atlanta', and think, ""Hacketoff, I hate you, I really, really, really, really, really, hate you. Really.""\nIt would be perfectly natural to grow resentful of a man who had, and had done, all that, and who still managed to be loaded. ""Why? Why him? And why in my lifetime?"", one would be entitled to ask. Well, the answer is, no one knows. No one knows why Daniel Hucklebuck is so peculiarly touched; only, that he is. But any feelings of envy you may currently have will be replaced by feelings of joy when you hear the legend that is Dennis Hottybott`s unique vocal talent on his Best Of album, `Looking For'.\nThat Voice; that electrifying, spine-tingling voice. The sound of frostbite across an icy tundra. A man undergoing open heart surgery without anesthetic. A moose with bronchitis. With every ""Ooh Yeah"", ""Baby"" and ""Whoa"", Dennis Handelshaft pushes his bowels to their very limit; what emerges is always solid. If such words cannot fully illustrate the power of That Voice, then consider this: when Hotelshift sung one of this amazing album's songs, `Looking For Freedom' atop the Berlin Wall, such was the frenzy it caused, the German people were tearing down the wall before Denzil had even reached the second verse, as hundreds of Berliners fled from the West to the safety of the East.\nMany such moving moments feature here: `Je T'aime Means I Love You; `Save the World'; `Flying on the Wings of Tenderness';  `Do the Limbo Dance'; all are sure to bring tears to your eyes. It seems almost mean to single out any others, such is the consistency of the quality here, although the song `Hot Shot City' is particularly good.\nYes, the success of this one man almost defies belief. Yes, that would make it very easy to hate Denton Hustleshunt. But make it hard on yourself - listen to `Looking For'. Then, all hatred will evaporate, as you reel in stunned amazement. You will then surely come to the conclusion that Dweezil Hotzenplotz, The Man Who Has So Much, is really Derwent Hootleshiff , The Man Who Is Full Of  It.";It Doesn't Get Any Better!
320;118.0;5.0;13.0;"I'm going through some serious David Hasselhoff withdrawal lately, because it's been over 8 years since his last studio album release. I would go up to my roof at night, gaze at the sky and scream ""When, God, when will we bask in the pure joy of David's ebullient gifts again?!"" It was only when I had almost given up total hope that I happened upon this Greatest Hits comp, ""Looking For."" Like a philatelist, he collects only the best and stickiest pop favorites in his catalog and mounts them with the skill of a master.\nLooking For Freedom is awe-inspiring.\nWir Zwei Allein is heart-rending.\nCrazy For You is rib-tickling.\nDo the Limbo Dance is foot-tapping.\nFlying On the Schwings of Tenderness is breathtaking.\nSave the World is hope-inducing.\nThese Lovein' Eyes is non-spellchecking.\nDu is nailbiting.\nFallin' in Love is lovemaking.\nIs Everybody Happy is hair-raising.\nBest Is Yet To Come is groundbreaking.\nFreedom For the World is earth-shattering.\nJe T'Aime Means I Love You is rip-roaring.\nDo You Believe in Love is horse-whispering.\nDanice Dance D'Amour is nerve-grating.\nEverybody Sunshine is deepfrying.\nI Believe (duet with Laura Branigan) is self controlling.\nHot Shot City is particularly-gooding.";Aching, dying, hurting for MORE!
78;119.0;5.0;11.0;When I was pointed to this site I thought that these reviews were surely some kind of jape propogated by internet tricksters.\n\nAfter a while however my curiosity got the better of me and I ordered the said album by Dave Hoffelstiffy. I encoded it using itunes and transferred it to my ipod, and the next morning I caught the tube into work as normal, sat down and plugged in my headphones. What followed has changed my life.\n\nSuch was the genius of this album I stayed on the tube forgetting to get off at my work stop. When I eventually got home I deleted all my other music from itunes and fixed it so that I had 500 copies of the album on my ipod. I felt that all other music was not worthy of even co-existing next to this behemoth of an album the and it was a travesty to have empty space on my ipod.\n\nHot Shot City is without doubt a particularly good track..;Incredible....
348;120.0;5.0;13.0;"A touch, a whisper. A kiss.\nThese things are fleeting, tiny moments of beauty never to be relived again.\nBut the CD ""Looking For-Best of David Hasselhoff [IMPORT]"" is a treasure to be enjoyed for all time. One can play this marvelous album over and over again, reliving a perfect moment for all time, except when one's probation officer drops by to make sure one is not hassling old women at the bus stop again.\nFor those who think the most beautiful things in life are intangible and cannot be captured, I heartily point and laugh at you. For I and hundreds of others have discovered this CD and all the joy and beauty and life-affirming triumph that cannot be captured by startling old ladies at the bus stop by lunging at them but not really attacking them, honestly officer.\nThe song ""Hot Shot City."" Wow. That one is particularly good.";"The ""La Jaconde"" of greatest hit albums"
379;121.0;5.0;13.0;"Someone should retrieve that Voyager satellite that we launched many years ago, and replace that Mozart music we put in there with this golden CD. How better to commemorate all of Man's achievements and intelligence by including this unforgettable collection of Eurotrash music sung by a celebrity from a canceled series. It is truly a great thing to witness the rebirth of music, the rebirth of the human spirit, and the afterbirth of my second son all in the span of 2 years! Jawdroppingly great, David Hudwalker takes your expectations and gives them a painful wedgy, until both buttocks cheeks bleed. His clarion voice rings and trembles like a camel with its foot caught in a crevasse. It's no surprise that Germany has picked up on this beautiful voice of his and made ""Wir Zwei Allein"" their new national anthem. So it's no surprise either that in response, France immediately surrenders and claims ""Je T'aime Means I Love You"" as their own anthem. The undaunted Belgians adopted ""Hot Shot City"" as their national anthem, an anthem I feel is particularly good.";A CD for the ages.
389;122.0;5.0;13.0;"The deaths of Kurt Cobain and Tiny Tim left a musical void bigger than anything I had ever known. To no longer hear either of these musical geniuses was almost too much to bear. Until I heard ""The Best of David Hasselfish."" His music not only filled the void, but it emptied it out and filled it, over and over all night. Once again my spirit was alive with a new feeling of wonder and love. ""Save the World"" left me breathless, and ""Do You Believe In Love"" kept me longing for more. ""Do the Limbo Dance"" teased me with its coltish ways, and ""Fallin' In Love"" triumphantly slapped me around. Harkenville has an undeniable talent, moving his vocal cords in a way that sort of approximate the musical notes he's supposed to sing. That combined with his ability to stay quiet during the parts he's not supposed to sing present a fantastically skilled musician, a solo artist in his own right. I will challenge anyone to find another actor who has been on both Baywatch and Knight Rider who can sing with this much talent, grace, and ease. The song ""Hot Shot City"" is particularly good.";An underrated fleur de lys
0;123.0;4.0;14.0;"A masterpiece of original song writing and powerful soulful ballads. Hasselhoff has one serious ommission which is the explosive rock anthem ""Knightrocker"". The exemption does not take away from the musicianship. My friends love the cd.";Move over Phil Collins-This album is Super Pursuit Mode
140;124.0;5.0;12.0;"So here I am, a 27 year-old millionaire investment banker, on a date with a Czech Supermodel.  After picking her up in my sportscar (yellow of course), I promptly put in Looking For-Best of Doctor Hoffteiser hoping to set the mood.  Well you know what happened, she said she didn't LIKE the music!  Well I promptly informed her that she was an idiot and I dropped her off at the nearest stop sign.\n\nEven though I'll be alone tonight, I have Doctor Hudslemeir to keep my heart warm.\n\nAlso, ""Hot Shot City"" is know by everybody in Prague to be quite good and to have aphrodisiac qualities.";Davey and my date
408;125.0;5.0;13.0;"I can't say I've been a David Hasselhoff fan all my life. Only since 1995, when the German company Auskenblaupgenfitt released this amazing, amazing album. Every song included in this collection is a like a whiff of an angel's armpit. The ballads are poignant, the rock operas are epic. And throughout each melody, Hasselhoff's voice rings like a bell, a voice that somewhat resembles a rhino getting a piercing on its privates. And in an interesting side note about this landmark album is that in the last 2 Winter Olympics, the song ""Looking For Freedom"" has been used as the official team song of the German Luge team. But what most people don't realize is that it actually raises hemoglobin levels in mental patients, allowing the bloodflow in their brain to slow down, and allowing them to enjoy such tunes as ""Danice Danice D'amour."" And the song ""Hot Shot City"" is particularly good.";This album is gooooood.
22;126.0;5.0;6.0;"I can see now why J.K. Rowling named one of her houses ""Hufflepuff"" -- David Hufflepuff is clearly a master artist of our time.\n\nThe track ""Hot Shot City"" is particularly good.";Keep this CD on repeat!
142;127.0;5.0;12.0;What is this disintegrating edifice we call life?\nWhere will that bewildering highway of creation lead?\nWhen will those shackles of existence be lifted, and our weary souls transcend to some higher plain?\nRarely do 80's homo-erotic, perma-tanned, medallion-donning, leather-clad, mullet-sporting, cheese-mongering Miami-Vice rejects produce music so expansive, so stirring and so intellectually acute that it urges one to muse on their own fragile mortality, their own existential disillusion. Yet here, oh wondrous demi-god of Saturday afternoon tee-vee, you have created an adonis of poise and sound.\nProbing behind the murky facade of the flashy materialism and souless decadence of his era, and with a wisdom and humanity far beyond his 79 years is, of course, the wonderful Doctor Menglerhoff. His greatest hits package [IMPORT] is a unique and sublime masterwork - the product of a fascinatingly fertile synth-skull.\nI could wax lyrical for screeds in a vain attempt to fully convey my affection for these eighteen tracks of caustic wit, daring invention and aching beauty, but my time here is limited. I hear the call of 'Looking for Beauty' - I must retreat from my screen and submerge myself once more into Hepatitisprof's sea of wonder.\n[Sleeve notes for this CD are supplied by Devindra's friend, 'Hollywood' Hulk Hogan, a particulary good friend...];Music as art... music as philosophy... music as truth
143;128.0;5.0;12.0;"This latest ""pate de verre"" offering from David Hasselgrovinnohunkendoveristbittezein is not only an acoustical epiphany for the mere mortal, but also a key to the magical wonders of the universe itself.  After all 18 ( 1 = Unity 8= Spiritual Re-birth) were run through M.I.T.'s secret computer code named ""x-box"" (not to be confused with gaming platform), the students found, much to their astonishment, phropesy and predictions not unlike The famous ""Bible Code.""\nIt seems that Hasellubergruberstormerstrooper has unlocked the very keys to the universe in his compilations...proving that Sloths and Dolphins will (in fact) become the dominant species as humanity is ""re-born"" into a higher plane.\nThis is especially evident in the cryptic coding inside ""Hot Shot City""...which is not only the best song ever created, but perhaps the single most important work since the ""Dead Sea Scrolls.""";"More enlightining than ""The Bible Code"""
147;129.0;5.0;12.0;Although I have never actually listened to the album in question, I can nonetheless say that, in all honesty, Von Hooberspunk's latest masterpiece is nothing short of an auditory epiphany guaranteed to cause premature earjacualtions all over the world - and probably in other worlds too.\nRight from the moment you excitedly rip off the offering's clear plastic covering, the Man Musk of Herr Hasslebonk squirts from the CD case and promptly assaults your senses with a seductive smack on the nose.\nNext in the firing line of Hasselbladderfunktrumpet's animal magnetism are you eyes. Straining on their stalks as they are pulled irresistibly into Daveyboy's deep, deep, blue, smouldering squint, once you've passed the Event Horizon of your lips touching his majestic image, there's no escape from his bottomless Black Hole of soul - not that any sane person would want to escape, of course.\nAt this point, some may feel an overwhelming compulsion to light up a cigarette and bask in the afterglow, but if you manage to stave off this temptation, then endless eargasms await.\nPopping the CD into even the most basic of stereos and hitting PLAY results in something words cannot convey. Imagine, if you will, inflating a donkey's stomach with compressed marsh gas until no more will go in, telling the beast a really funny joke and then whacking its stomach with a stuffed ferret as it begins to bray with laughter... well, let me tell you that the smooth earcandy cascade that erupts from the larynx of Hoffellhassenduffelcoat is even better.\n\nNo, really!\nIt could have just been me, but when those speakerboxxes started vibrating to Hummervonsnitzengruben's vocal Viagra, I could have sworn that I saw the man himself projected onto my table (like Princess Leia in Star Wars), thrusting his leather-clad snake hips in my direction and anointing me with a shower of salty (yet sweet) sweat from his glistening chest rug.\nAnd the story just kept on getting even better*...\nOne track from The Master is more than I deserve, so imagine the rapture I experienced upon discovering another 17!\nRather than give and in-depth review of each, I've simply put in brackets all that need be said.\n1. Looking for Freedom (no siree, not me Mr Hobgoblindumkopfft, not now I'm a prisoner of your love)\n2. Wir Zwei Allein (I don't know 'where the alien is', but I certainly feel like I've been abducted to a higher plane of existence)\n3. Crazy for You (I feel the same. Only I'm even crazier)\n4. Do the Limbo Dance (I'll get lower than a snake's belly for you, baby)\n5. Flying on the Wings of Tenderness (KFC by candlelight... how romantic)\n6. Hot Shot City (I'm surprised no one has mentioned it before, but this track is particularly good!)\n7. Save the World (I'll buy, then eat my newly bought hat if it doesn't)\n8. These Lovein' Eyes ( ... make me want to have a 'love-in' with you)\n9. Du (.. you love me? Course I 'du!')\n10. Fallin' in Love (... only to be caught in your muscly arms)\n11. Is Everybody Happy (... when they think of you, not to mention when they discover there are another 7 tracks to go!)\n12. Best Is Yet to Come (this refers to track 6, which was actually meant to be track 18)\n13. Freedom for the World ( He really does set you free)\n14. Je T'Aime Means I Love You (proof, if any were needed, that He no just speak Americanos, but other sexy languages, such as Russian, too)\n15. Do You Believe in Love (I do now!)\n16. Danice Dance d'Amour (another Love Mantra specially written in Hasselbonkeeze)\n17. Everybody Sunshine (he'll brighten up you day like a supernova going off in your undercrackers)\n18. I Believe (... I'll have to hit REPEAT again).\n*Particularly track 6.;Looking For-Best of David Hasselhoff [IMPORT]
148;130.0;5.0;12.0;"Like a glittering, solid-gold lighthouse in a fog of puke, David Graffenberg lights up the night with his dazzling display of heterosexual pop hits. He seizes the microphone and punishes it (and us) for fifty straight minutes. From ""Crazy For You"" to ""Everybody Sunshine,"" he emanates from your speakers, stinking up your trailer home with pure vocal heaven. Synth beats startle and confuse your house dogs, and the shrill guitar solos arouse the raccoons going through your garbage out back. You meanwhile drown in the utter bliss of David's vocal charms, a voice that your cousin Deke compared to ""three goats kicking a bucket of wolverines."" Your ex-girlfriend once said you would never amount to much. She's right, but at least you're enjoying great music at home. The song ""Hot Shot City"" is particularly good.";If loving this is wrong, I do'wanna be right
