;ranking;overall;vote;reviewText;summary
53;223.0;5.0;8.0;"David Hobbstweedle was the definitive German pop musician. It wasn't just his crushingly loud interpretation of the blues -- it was how he incorporated mythology, mysticism, and a variety of other genres (most notably world music and British folk) -- into his sound. David Hassledhop had mystique. He rarely gave interviews, since the music press detested his superior Teutonic sound. Consequently, the only connection the audience had with him was through the records and the concerts and the television shows. More than any other musician, Davyyd Hossluhuff established the concept of album-oriented rock, refusing to release popular songs from his albums as singles. In doing so, he established the dominant format for German pop, as well as the genre's actual sound.\n\n""Looking for ... the Best"" was his most musically diverse effort to date, featuring everything from the crunching rock of ""These Lovein' Eyes"" to the folk of ""Flying on the Wings of Tenderness,"" as well as ""Do the Limbo Dance,"" which found the bridge between the two genres. ""Do the Limbo Dance"" was an immediate radio hit, eventually becoming the most played song in the history of album-oriented radio; the song was never released as a single. Despite the fact that the album never reached number one in America (yet), ""Looking for ... the Best"" was his biggest album ever, selling well over 163 million copies over the next decade. If you don't own this album, cover your head in shame and rush to the nearest record store. Don't worry, everything is going to be alright.\n\n""Hot Shot City"" is particularly good.";Je T'Aime Means I Love David
158;224.0;5.0;9.0;"It's been a long time since I've felt this way about a round piece of plastic, but this CD ROCKS! No wait, don't stop reading, I'll explain!\nTwo weeks ago my little brother and I were going to the local cinema to watch the latest Kate Hudson movie. I was reaching down into the floorboards to pick up a piece of popcorn that I spotted, when we were nearly sideswiped by an 18 wheeler truck! We pulled over to the side of the rode to compose ourselves and to pray to God for sparing us.\nIt was then that I noticed a CD sitting in the ravine below. It was scratched and and pieces were missing, but I decided to put it in my car stereo anyway. What I heard then was almost indescribable: a mindblowing sonic thrust of vocal beauty the likes of which I had never heard! No, wait, don't stop reading yet!\nMy brother and I immediately drove to the local record store to buy an unscratched copy of the CD. (...) Incredibly, whe we played it in our car, the music sounded even better! What majestic melodies! What symmetric beats! What a voice that man has, a voice that my brother said sounded like four timberwolves humping a bean bag chair.\nMy brother and I never made it to that Kate Hudson movie that day. We were too busy driving home, rocking out to ""Hot Shot City,"" which we both agree is particularly good.\nYou can stop reading now.";Jesus Loves Me, This I Know,  But I Love This Album!
162;225.0;5.0;9.0;"Diese Platte wird vielleicht nur der verstehen, der die Gedanken, die darin ausgedrckt sind - oder doch hnliche Gedanken - schon selbst einmal gedacht hat. - Es ist also kein Lehrbuch. - Sein Zweck wre erreicht, wenn es einem, der es mit Verstndnis hrt, Vergngen bereitete.\nDie Platte behandelt die philosophischen Probleme und zeigt - wie ich glaube - da die Fragestellung dieser Probleme auf dem Miverstndnis der Logik unserer Sprache beruht. Man knnte den ganzen Sinn der Platte etwa in die Worte fassen: 11 o'clock yeah we ready to rock; und wovon man nicht singen kann, darber mu man schreien.\nWieweit seine Bestrebungen mit denen anderer Philosophen zusammenfallen, will ich nicht beurteilen. Ja, was Herr Haselnu hier geheult hat, macht im Einzelnen berhaupt nicht den Anspruch auf Neuheit; und darum gibt er auch keine Quellen an, weil es ihm gleichgltig ist, ob das was er gequietschet hat, vor ihm schon ein anderer geschrien hat.\nDagegen scheint mir die Wahrheit der hier mitgeteilten Gedanken unantastbar und definitiv. Ich bin auch der Meinung, da der Sang ""Heie Scheie City"" besonders gut ist.";Ach Gott vom Himmel
166;226.0;5.0;9.0;"Think what you want of David Hasselcock. You can think he is a narcissistic tool who can't act his way out of a paper bag. You can think he's an arrogant meathead who thinks in his middle age that he's still a teen heartthrob. You can think he's a horrible actor whose 80's mullet hairdo only emphasizes his embarrassing Broadway performances.\nBut once you hear this CD, you'll think of David Hammerballs WAY differently. You'll realize that he is a narcissistic tool who can't act his way out of a paper bag AND can't sing. You'll realize he's an arrogant meathead who thinks in his middle age that he's still a teen heartthrob AND can't sing. You'll realize he's a horrible actor whose 80's mullet hairdo only emphasizes his embarrassing Broadway performances AND has a singing voice like two badgers rutting a rusty bedpan.\nYou'll also realize that the song ""Hot Shot City"" will have been particularly good.";Once again, the world's greatest singer does it again.
189;227.0;5.0;9.0;"I love this CD with all my heart. The thing that makes this so enjoyable is that David Huskypatch just gives and gives and gives in his performances. For example, on ""Everybody Sunshine,"" you can hear him slice open his bicep with his pocketknife, causing him to scream in such pain that he almost hits the right note. On ""Dance Dance D'amour,"" his high notes are the result of slamming a car door onto his weewee. And the way he manages to get two angry oxen to wrestle for the song ""Du"" is remarkable. Truly someone so committed to excellence in music cannot go unnoticed. Especially when he manages to close a car door on those oxen's weewees for the song ""Hot Shot City."" That song is particularly good.";"Even better than ""Thriller"""
207;228.0;5.0;9.0;"It's actually really surprising to find out that only .00002% of the world's population has purchased this CD. Only one listen to this entire album is enough to spread the disco fever and win another convert. If only more people heard this amazing CD!\nI have taken upon myself to make T-Shirts of the album cover (don't worry BMG International, I don't sell them!) and wear them to promote interest in his album. I also play the CD nonstop in my apartment, car and handheld CD boombox at all times. People often stop me and ask me who that is singing, and I proudly inform them that it is David Hurblekraft. Yes, THAT David Hollencrack!\nI'm no vocal teacher, but I'm willing to bet that David's unique tenor, one that evokes images of an angry mule furiously kicking a bellows, is so different that no one can learn how to sing like that.\nTracks 1-18 are excellent. But track 6, which is ""Hot Shot City,"" is particularly good.";A talented and dreamy singer makes good
210;229.0;5.0;9.0;"The social stigma of being a Hastelhoff fan is exhausting- you have to defend your idol at every turn. First there are those who say he cannot act, which I'll admit, he is not good at all. Then there are others who say his mullet haircut and arrogant manner during interviews, even going so far as to take credit for the dismantling of the Berlin Wall, are totally cheesy and obnoxious. That I'll concede as well.\nBut when it comes to criticizing Hasslehuff's singing ability, they have to answer to me. How dare they say his vocal stylings on ""Freedom For the World"" and ""Fallin' In Love"" sound like a caribou stuck in a turnstile? How dare they compare Hasilhoff's voice on ""The Best Is Yet To Come"" to a panicked howler monkey on crank? How dare they suggest that the vocals on ""Everybody Sunshine"" can be used both as sound effects for a disaster movie AND to scare hyenas off a carcass?  Okay, you got me there, too. But the song ""Hot Shot City"" is particularly good.";Flying On the Wings of Hasselhoff!
26;230.0;5.0;5.0;"If you listen to this using the&nbsp;<a data-hook=""product-link-linked"" class=""a-link-normal"" href=""/Diamond-HDMI-Digital-Audio-Video-Cable-W-Ethernet-Connection-5M/dp/B003CT2A6I/ref=cm_cr_arp_d_rvw_txt?ie=UTF8"">Diamond HDMI Digital Audio/Video Cable W/ Ethernet Connection (5M)</a>cable, the sound will create an ethereal vibration that will shift us into 5D, thereby avoiding the apocalyptic destruction of the world as foretold by the Mayan calendar.\n\nEvery day, at 11:11 am, I will play this, as should you. It's the only way to salvation. Come December 21, 2012, at approximately 7:35 am, the great destroyer will be vaporized by the final sweet notes of track 7: Save the World and we will ascend to a higher level where we are no longer dependent on foreign oil and the Nazi's cannot reach us with their stargate. Sure, we will have 3 moons and be lactose intolerant, but it's a small price to pay for true ascension.";I Will Save The World Using the Power of The Hoff!
61;231.0;5.0;8.0;"When I popped this CD into my boombox, my pants fell down and I weeped like I did when ""Charles In Charge"" was cancelled. The pure beauty of the wafting music was almost too much for me to bear. It did indeed prove too much to bear for my next door neighbor, who moved out immediately and jumped in the ocean.\n\nNow that I'm alone in this trailer, I can walk around with this erection and enjoy David Hulkerflink to my heart's content. I prance about to ""Crazy For You."" I do jetes to ""D."" I even do the limbo dance to ""Do the Limbo Dance!"" Meanwhile, they have turned off my gas and water, since I have let those payments lapse, big time.\n\nBut what the hey, life is too short to pay bills. I can just sit here in the dark, listening and masturbaiting to David's masterwork. Excelsior!\n\nThe song ""Hot Shot City"" is particularly good.";This album whupped me good
66;232.0;5.0;8.0;"...I haven't.\n\nBut it certainly feels like it. After purchasing 6 copies of 'Looking For-Best of David Hasseltrumpet ' I now wear white and keep doves.\n\nSimply wonderful, absolutely wonderful, wonderful. I urge anyone who doesn't own this cultural gem, to lay down their weapons and float to a PC to log on and buy it. Surely if enough followers across the globe play Hasseltrout's masterpiece at once, the melodic wailings will fill the holes in the ozone layer. That can only be a good thing.\n\nMy favourite track... what am I saying, of course, they're all favourites, but the track that perhaps could one day keep the Sun burning is number 6. I'm surprised that out of over 1000 reviews nobody has mentioned 'Hot Shot City'... it is particularly good.\n\nAre you cheeky guys trying to keep it to yourselves? ;)";I've won the lottery...
70;233.0;5.0;8.0;"The reason that there is no peace in the world today is that there's not enough copies of this CD to go around.  Forget the standard 6-party talks with North Korea -- send Kim Jong Il a copy of this album and he'll turn his remaining missles into statues of The Hoff, guaranteed.\n\nOf course, this would lead to an unstable internal situation as Kim Jong Il would be eventually overthrown by the people for the chance to get their hands on the album.  Since the missles will have been made into statues, we could then safely airlift enough CD's for every man, woman and child into the area -- thus ensuring stability in the region.\n\nDemocracy will reign in North Korea again, all because of The Hoff.  This is also the answer for Iran, Syria and Lebanon.  They will especially like the song ""Hot Shot City,"" because it's particularly good.";For World Peace
73;234.0;5.0;8.0;"As an experienced jousting judge, it's very important for me to discern the length of one's lance and the style with which they wield it. How is it shaped? Does it curve to the left or right at all? What about girth? It is this same keen judgment that I use to evaluate this compilation CD from David Hyperhonkkpf.\n\nO what magnificent aplomb he rides the surging waves of melody! O how regal he thrusts his glistening chest out, elbows shot back! O what godawful, unholy crow-fighting-a-cat-shrieking he wails from that cavernous gullet of a mouth! Leaves wither. Clouds evaporate. Items for sale at 50% at Hecht's are now only 30% off.\n\nThe ""songs"" he ""sings"" leave us literally breathless, panting on our living room floors, gasping desperately for air as we hear the ""music"" fade to sweet, sweet silence. We are now ready for Track 2.\n\nThe song ""Hot Shot City"" is particularly good.";His music is melting the glaciers!
76;235.0;5.0;8.0;While Chuck Norris is the dude to go for when you need to lay a serious beating on someone, the well-informed Ninja chooses DAVID HASSELHOFF to croon out those mellow sounds to calm you down after a day of popping big-b's and totally uppercutting someone. This album is cool, and by cool, I naturally mean totally sweet.  Some kid in my class tried to diss Hasselhoff, and the teacher totally flipped out on him.\n\nOne is hard pressed to think of an equal to the musical mastermind that is David Hasselhoff. You don't need to be a fan to appreciate this awe-inspiring work, but then again, how could you not be one?\n\nFive stars out of five.;I liked this thing so much I flipped out, kicked my mom in the face, then wailed on my guitar
41;236.0;5.0;7.0;"Only after listening to this masterpiece did I experience an epiphany, a spiritual flash that would change the way I viewed life. In particular, the lyrics to ""Jump In My Car"", encapsulates beautifully cartesian dualism but in a way only a genius that is David Hasselhoff can explain.";Manner From Heaven.......
81;237.0;5.0;8.0;since the advent of time, philosophers have struggled mightily with The Eternal Question: What is the meaning of Life? Well, humanity has been given a resounding reply. Packaged in the form of a curly-haired messenger, He has a penchant for song crafting not seen since the dawn of life. Part man, part genius, part mythological icon, David Hasslehoff redefines what it means to experience the human journey. I am now hopeful that war can be wiped from the earth, (Sir Hasslehoff's personal role in the advent of democracy has already been well documented), disease can be cured, and happiness can permeate the earth just as His music has. Also, Hot Shot City is a particularly good track.;the end of the beginning
30;238.0;5.0;6.0;"When I first listened to Duval Chunderhink's Looking For, it sparked a chain reaction in my soul. Glowing white hot with love, I ventured into the street. Around me, flowers bloomed and lambs were born, infected with the joy of Denzil Hemperblast's effulgent tones. Overawed by the majesty of the track ""Freedom For the World"", thieves and muggers ceased their activities and joined me in song.\n\nIt is clear to me that the man is the true saviour of modern pop, a title I do not bestow lightly but his qualification is self-evident in the prowess of his songwriting which washes the feeble inscriptions produced by the likes of the Beatles, The Who, Led Zeppelin etc. into the gutter where they rightfully lie, cowering in the shadow of the Great Master.\n\nI urge every citizen of the world to hold aloft a copy of this album, preferably on fire so that the light can cleanse us of our sins. This album reminds us of what it is to be human.\n\nThe song ""Hot Shot City"" is so good it's on fire.\n\nUtterly flammable.";The true saviour of pop
238;239.0;5.0;9.0;"Oh Haffenpfooper. You are a musical genius. No, king. No, god. When your holy music radiates from my cd-playing device, I am deeply moved in my soul, my body, and my pants. Especially my pants. They are moving. Deeply. I dance as I have never danced before. Over and over again. And again. I think it is called dancing. I call it dancing. It makes me sleepy.\nFor those who haven't yet felt the aural ecstasy of Hastypuffs, it is most akin to the primal rollicking of meditative hyenas, while in the throes of a bassoon concert. On some tracks, the hyenas may only be considering having a bassoon concert, but not actually having one right then. These are the subtleties that make for musical greatness.\nThe song ""Hot Shot City"" is particularly good.";a universe of pleasure
246;240.0;5.0;9.0;I am truly exhausted, yet I cannot sleep. A thundering herd of calliope-playing Tunisians runs circuit laps between my ears. The sea holds no small comfort, nor is there compassion in the siren's call to which I am now all but deaf. I hold life in abeyance. I hold love in abeyance. I hold Baywatch in abeyance.\nAll that remains is the music, now encased in thin layers of silicon like a caged blonde. I can only vaguely recall the sound, yet it seems to me that the sixth song was (dare I hope?) particularly good.\nFOUL TEMPTRESS BEACH WHY HAVE YOU BETRAYED ME??????????;love like an open wound on my heart
252;241.0;5.0;9.0;"When my mother emigrated from Germany in 1966, she brought along a love of her homeland and the Kultur which is embodied in the uniquely hilarious comedy of Friedrich Nietzsche and the music of Wagner. Like many second-generation Americans, I as a child was unappreciative of the traditions and styles of my mother's native land. Only in my mind-broadening college years did I try to embrace my heritage and become attuned to the popular culture of my German cousins. But alas, such a disparity existed between myself and my relatives overseas, I thought I would never find the common ground between us. That is, until the magical moment when, on opposite sides of the Atlantic, we shared in the beauty of David Hersheysquirtz's Looking For-Best of David Hasselhoff [IMPORT]. Finally, I felt like a true German. In one fell swoop, I came to understand the whole of Teutonic culture and its ideals! I was enraptured by the beauty of ""Wir Zwei Allein (Weird Couple Alone)"" which captured my feelings of having a dual nature, an ocean apart from my ancestral homeland, yet still there in spirit. Hinkelstein's lyrics are deep and insightful, and through listening to this album in its entirety, I have come to appreciate and understand my family and heritage. Derwood Hasenpfeffer is a visionary.\nThe song ""Hot Shot City"" is particularly good.";Reconciliation of second-generation immigrant dysmorphia
256;242.0;5.0;9.0;not since millivanilli has an artist been so ridiculed, yet so underrated and unappreciated. david hasselhoff is the john lennon of our time, able to unite people with his music all over the world. after listening to this record i can honestly say i am a better person, and its all thanks to one man who dared look for freedom. thank you david for sharing your gift with one little german girl, and the universe.;the john lennon of our time
259;243.0;5.0;9.0;"You gotta hand it to David Hesperchaff. He's endured the tempests and uproars of the music industry of the past 3 years, remaining on top of the steaming heap of pop legend. It's hard to believe that this singer/actor/valet has now been in the public eye for almost 6 years! Quite amazing, really.\nBut what's more surprising about his career is not the length, but the girth. Just listen to ""Flying On the Wings of Tenderness"" and ""Crazy For You,"" and you'll see that he has a keen ear for the melodramatic.\nThe song Hot Shot City is still particularly good.";C'est Si Bon!
267;244.0;5.0;9.0;"David is a rare gem. He is a showman, a presence, and a heartthrob rolled into one. On stage, he glimmers and dazzles with anthems of freedom and &uuml;bermen. Not many singers can hold an audience's attention like that. And not many singers sport such a chest of beautiful tufted hair, except for Celine Dion.\nAs a DJ and mother of six, I am an authority on music such as David Hathercrank's. From the most repetitive Eurotrash noise techno to ""Barney's and Baby Bebop's Farm Songs,"" you can bet that I've heard an earful of cringeworthy, ear-murdering music. And I just wanted to say that David Hasselsmocks is my favorite album. Without getting to grandiose about it , I believe his songs can change the world and end peace.\nSomebody needs to play ""Hot Shot City"" at my wedding. It's particularly good.";A swooning tapestry of fiery passion
271;245.0;5.0;9.0;"I read in the news recently that our hero David had a little motorcycle accident. I just wanted to extend a gesture of ""Get Well"" to my main man before continuing with my review.\nBut I wouldn't call it just a review. I would call it  the most glowing expression of admiration that one lowly man can make toward a musical demigod like David Hursheflatts. His music is magical, mystical, mystifying, stultifying, gratifying, and mythical. Just try listening to ""Wir Zwei Allein"" without soiling your pants. Other continence-challenging hits are ""Je T'Aime Means I Love You,"" ""Save the World ,"" and ""I Believe Laura Branigan."" That last song is interesting because it tells the story of how David lost trust in Laura Branigan, but learned to restore his faith in Laura Branigan once more. By the end of the album, most listeners would have to change their pants so many times that they probably just sit in the bathtub.\nHussemeech is not just a lover, but a fighter. He smacks around the melody like a drunken newlywed, shocking first-time listeners with his trademark growl and gassy interludes. He hits high notes with such poetic violence, it sounds like two furious chimps beating a llama with a bicycle seat. Special.\nThe song ""Hot Shot City"" is particularly good.";Get well, David!
274;246.0;5.0;9.0;"This star is brightly shining! Many people scoff and curl their lips at this collection of marimba dances, but I am here to tell you that this CD rocks with or without your consent! David Puskerblatt chews these songs up and spits them in your face like a gigantic wad of chaw, and you can't help but love it.\nThe song ""How Deep is Your Love"" is notably absent from this album, but it makes sense once you realize that David in not a BeeGee. Instead, he is a magician, twirling his meat to the tempo of  ""Flying On the Wings of Tenderness"" and "" Dance Dance D'Amour."" Audiences around the world gasp in awe as he tears his shirt open, throwing tufts of his body hair into the crowd. He screeches out like a marmoset fighting a buzz saw, and eardrums everywhere burst.\nThe song ""Hot Shot City"" is particularly good.";O Holy Knight
312;247.0;5.0;9.0;"I feel born anew when the soft petals of this music brush my cheeks. From the first guitar lick to the final cowbell, this album refreshes me from foot to neck, absorbing all the troubles of my day and bringing me to a higher level of consciousness. Hasselhoff's voice echoes off the walls of my holding cell, filling every corner with the sounds of an outboard motor wounding four donkeys. I tremble with delight when ""Crazy For You"" reminds me of my days as a guard for the Duke Blue Devils, and the eternal ballad ""Wir Zwei Allein"" brings me to tears over memories of an encounter with Wendy Malick of ""Just Shoot Me"" fame, which I would rather not get into.\nThe song ""Hot Shot City"" is particularly good.";**Listening to this is a rejuvenating experience**
321;248.0;5.0;9.0;"Beyond the sleepy, content village of pop music lies an open landscape of exciting, unexplored terrain. It's out here that strange melodies mix with exotic harmonies. Unfamiliar beats blend with unheard of thumps, while the rank smell of undomesticated sexual heat smolders off David Hunkahunk's voice- a voice that reminds this reader of a rabid elkhound giving itself a golden shower.\nTo extend this analogy even further, this Greatest Hits CD is like a compass for one's first foray into the wilderness of unknown pop music. Hinkerpoole has been good enought to point out a few markers along the way for us (""Crazy For You"" seems to be the most visible from the village) so that we don't get lost and get our foot stuck in a ravine.\nThe song ""Hot Shot City"" is five paces past the three oak trees, beyond the hillock of heather, and is particularly good.";Singularly magnifico
354;249.0;5.0;9.0;"I have been avidly reading these reviews and finally decided to to reveal the true identity of David Hasselhoff. I have given the review five stars in order to clarify the five points of the Pentagram. It should not be too hard for any non-beleivers, any shall we say worshippers out there to research and verify the facts as it where.\nFirstly, lets just look at his name shall we. David : Devil, can you see the similarity.... Yes the letter a and d are misplaced, yet if you join them together they spell AD, Anno Domini, after the death of Christ....it is that obvious.\nSecondly, lets investigate the revelations, Chapter 3 Verse 12 to be precise, and I quote ""And Bealzebub shall come forth wailing and screeching and speaking in strange tongues. And behold he weareth extremely restricting leather trousers and on his head shall siteth an evil entity that will from henceforth be called the Mullet. You will behold this being and he will walketh amongest us and his name will be transferred to evil and he will be the Devil reincarnate and he will spreadeth horror, destruction and he will taketh Laura Branigan as his bride"".\nIs this now not clear enough for you non-beleivers.\nLastly in 1287 the great Nostrodamus cryptically said ""In the great year of the Lord 2002, the guard of life and the watcher of the bay shall come henceforth to destroy all of humanity, yet he will be singing and dancing (badly) and falsly claiming in freedom of the world""\nWell, there you have it, it is all there in his gramaphone record for all to see. So be warned.\nThe track Hot Shot City is particularly evil.";Can't any of you see?
