;ranking;overall;vote;elapsedDays;reviewText;summary
0;10.0;5.0;6.0;0;Insanely awesome. One of my neighbors said he heard all kinds of crackling in the woods behind both of our houses at around 2 in the morning so I stayed up the Friday night and Saturday night after I received the flashlight fully charged flashlight playing soccer on my phone finally heard all the crackling Shore enough around 2:03 Friday night but could see only eyeballs in the woods off in the distance. but Saturday night I waited til the crackling in the woods. Pretty much near the end of my yard close to my deck where are sitting comfortably looking out when I turn the light on I found one huge mother of a raccoon and three babies. Called Animal Control the next day they came out and laid safe traps Collected the whole family. I've had plenty of flashlights for my jobs and for around my property but this thing is pretty ba. made my backyard into daylight;Turn my backyard into daylight just like the video
1;38.0;5.0;5.0;18;Best flashlight I ever had. Thank you.;Wow.
2;20.0;5.0;8.0;22;Very good and bright flash light in a strong metal housing.  Comes with one rechargeable Li-ion battery and charger plus one insertable adapter for 3 AAA battery use.  Using the supplied Li-ion battery gives a little brighter beam that lasts longer than using 3 AAA batteries.  The included battery case is very sturdy and durable making it a good companion when bringing the flashlight along in the car or any tool chest either in the garage, cabin or work place.  Another plus with this flashlight is the ease of refocusing the light beam by sliding the front part of the unit.  It is also a flashlight to have at someone's nightstand in case of power outage at night.;Very bright flashlight for any situation.
3;51.0;5.0;5.0;38;Brighter then expected. Great product;Great
4;47.0;5.0;7.0;62;This flashlight lights ups the whole room.  We has one taken from us and replaced it immediately.  we love it, it was especially usefulmduring the hurricane;Fantastic flashlight
5;74.0;5.0;5.0;145;The flashlight is superb ,exceedings my spectations  paulo costa rio de janeiro brazil;Five Stars
6;68.0;4.0;6.0;158;Bright as hell, smells funny though.  Like stale gun oil;smells funny though. Like stale gun
7;70.0;5.0;6.0;164;Ultra bright.  Fits in my pocket.  Now if I can just find where my kids took it... need to put a bell on that thing;Powerful tactical light and still compact
8;63.0;4.0;7.0;164;not as bright as I expected;Four Stars
9;80.0;5.0;5.0;174;Very happy, I am very impressed by the power of this small flashlight.;Small but powerful.
10;84.0;5.0;5.0;184;I love it!! I actually ordered one for my uncle because he liked mine. And he loves it too! Best flashlight ever!;Best flashlight!
11;85.0;5.0;5.0;185;Worked as expected;Five Stars
12;73.0;5.0;6.0;201;Estoy conforme;Five Stars
13;95.0;5.0;5.0;211;Best flashlight ever. The light it gives off is great. Highly recommend!;Highly recommend!
14;96.0;5.0;5.0;213;It really likes a torch never be extinguished, which is what everyone wants. And I'm satisfied that the service delivery. Recommend!;I'm satisfied
15;97.0;5.0;5.0;213;The flashlight is so good and the price is very reasonable. It is small enough to be carried in my jacket pocket. It has a brilliant light. I highly recommend!;I highly recommend!
16;98.0;5.0;5.0;214;For the money, this is a really good quality flashlight. Very well made, easy to use and the best thing is the light output. Highly recommended!;Highly recommended!
17;76.0;5.0;6.0;214;I wanted a small powerful torch to replace my old flashlight. And this flashlight has solved my issue. It very bright and have many functions. Thanks!;Thanks!
18;99.0;5.0;5.0;215;I'm really happy with this flashlight. It very handy and fits in your pocket. It is simple and has the advantage of a zoom adjustment. I definitely recommend using this product.;I'm really happy
19;100.0;5.0;5.0;224;I bought this flashlight because I have to go to work at night every day. The lowest setting is better than any standard flashlight I've owned. The zoom function is great for pin point lighting. Great buy.;Great buy
20;77.0;5.0;6.0;225;This flashlight is a very good deal. It works very well as what's in the ad. I like all the functions and the brightness of the light. Everything worked out of the box and still works. I am very pleased.;I am very pleased
21;102.0;5.0;5.0;228;I have bought 2 of them and now and now it still works very well. Highly recommend!;Highly recommend!
22;105.0;5.0;5.0;237;It gives me is what I want for a flashlight. Good product to use!;Good product to use!
23;107.0;5.0;5.0;238;What you do is just hold it and it will help you do the rest. It has a bright color and easy to see better in the dark.;Good product!
24;83.0;5.0;6.0;257;"Absolutely essential high powered flashlight the size of a candy bar. You can focus the beam or spread it out. If the characters in 80s horror flicks had this, they would all be high school sex comedies instead of ""dead teenager"" flicks";Absolutely essential high powered flashlight the size of a candy ...
25;82.0;5.0;6.0;257;This is amazing!!!! Love this, battery last long time.;Five Stars
26;111.0;4.0;5.0;262;I HAVE BOUGHT 2, ONE FOR MY HUSBAND AND ONE FOR MY SON WHO IS IN LAW ENFORCEMENT.  THE RECHARGEABLE BATTERY DIDN'T NEED CHARGING FOR ALMOST 1 YEAR.;I HAVE BOUGHT 2, ONE FOR MY HUSBAND AND ...
27;112.0;5.0;5.0;266;Works great. Exactly as described. Had to buy one for myself. Thank you;Five Stars
28;86.0;5.0;6.0;272;I love this flashlight, does everything i need it to do. I  recommend it to everyone.;Five Stars
29;87.0;5.0;6.0;279;Great toy for any man. Many functions for the light, SOS, strobe, and blinks. Works farther than 100 meters, and will blind you at the distance;Great toy for any man
30;91.0;5.0;6.0;288;Great flashlight!;Five Stars
31;124.0;5.0;5.0;300;Good value.  Like the strobe and SOS settings.;Good value. Like the strobe and SOS settings
32;125.0;5.0;5.0;302;What an excellent torch I was happy with the price i paid got it on offer but tbh with how bright it is and how many times its withstood drops from me i really compel you to buy it great item;Totally worth
33;127.0;5.0;5.0;304;hell ya;Five Stars
34;21.0;5.0;30.0;317;This is a great flashlight.  It works well and shines the light so far away.  great product;Shadowhawk 1800
35;22.0;5.0;30.0;322;Great flashlight. Beyond my expectations!!;Five Stars
36;27.0;5.0;28.0;323;Excellent!  I just had an occasion to use it in an old attic and it sure lit the place up.  Very satisfied;Excellent! I just had an occasion to use it ...
37;19.0;5.0;31.0;325;I bought this for my sister, who has vision issues & needs extra light when she's walking her dog after dark. This flashlight is amazing! It's so small & easy to carry--yet the beam is much, much brighter & wider than a regular flashlight. I'm buying another for myself!;This flashlight is amazing! It's so small & easy to carry--yet the ...
38;101.0;1.0;6.0;328;I thought I would like it but the light is dull.  I charged the battery it's still dull.  There are two options for battery power: traditional AA battery holder and the larger battery and charger.  I tried both and it is NOT worth the cost.  Dissatisfied.  $55 and I got the value of a $5 flashlight.;Disappointed
39;103.0;1.0;6.0;340;Total rip off.  The item was clearly used.  It came with no manual or paper work, or outer packaging. There were no protective seals on the battery.  The flashlight did not work.;Total rip off. The item was clearly used. ...
40;29.0;5.0;28.0;345;this is a great little unit;Five Stars
41;26.0;5.0;29.0;345;Great flashlight-all should have it.;Five Stars
42;23.0;5.0;31.0;347;Great light and I like the added SOS feature;Five Stars
43;32.0;5.0;26.0;355;works great, I lost the battery charger, do you sell those?;Five Stars
44;24.0;5.0;31.0;358;Very bright, well made!;Like it!
45;30.0;5.0;28.0;365;'A very useful, bright torch', says ELIZABETH the Second. Compact and bright.;Fit For A Queen
46;65.0;1.0;10.0;365;Update 4/19/17. This light has had very light use and today it just died.\n***********************************\nPhenomenal flashlight. It does indeed light up an incredible amount from a far distance. It came without ANY instructions. You may ask why a flashlight may need instructions? It came with a rechargeable battery and a charger. When you plug the charger in it displays a green light, when you insert the battery it displays a red light. Contrary to mist chargers I have a red light means the battery is not fully charged, a green light indicates a full charge. This appears to work in the exact opposite manner. The flashlight also does not give any icon for which way the battery should be inserted into the sleeve of the flashlight. The additional battery insert that allows the use of 3 AAA batteries does not show which way to insert batteries into it, nor does it indicate which way the battery holder should be inserted into the sleeve of the flashlight. Instructions would help a user know how to address these issues and questions.;Great But Needs Instruction Manual
47;136.0;1.0;5.0;367;I dropped it 3ft. onto my stairs and it broke. Not sure that really makes it good. Considering it was said to be able to withstand a 300ish foot drop.;3ft. drop = lost $50
48;110.0;1.0;6.0;369;Inadequately packaged. Lithium-Ion battery had no protective covers on the ends. Right out of the case, battery was dead. No instructions on how to use. No safety instructions for battery. Charged the battery for 4 hours - still does not work. Will buy a set of AAA batteries tomorrow, just to see if the flashlight even works. I wasted $55+ on this. My big mistake? Not reading the reviews first, which is rare for me. This is a bad product, from a bad company. I will not purchase anything from them ever again.;Do not buy from Shadowhawk-ripoff
49;137.0;1.0;5.0;370;Cheap junk!!!  DO NOT BUY THIS PRODUCT!!!!  I get so sick of Amazon not vetting products and allowing this stuff to be sold.;DO NOT BUY!!!
50;44.0;1.0;19.0;378;What a piece of crap .Absolute Junk. It's nowhere near 800..More like 200 ...Dollar Store junk. The beam isn't even round. It's square with lines going through it.  Look at the light pattern this junk makes !;What a piece of crap. Absolute Junk
51;138.0;5.0;5.0;379;Who would have thought a flashlight could bring my husband so much joy!;New husband toy
52;139.0;5.0;5.0;382;WOW!!!!  What a great little flashlight for the price. I charged the battery completely and has been shinning ever since. About three weeks. Taking this with me on my camping trip. I want to drain the battery completely and recharge for the trip. It has been on now for the last two days straight and still has not drained completely yet. Extremely bright light. It operates just as they said it would.;What a great little flashlight for the price
53;140.0;5.0;5.0;382;I bought the UltraFire Rechargeable batteries with this flashlight. The illumination is brilliant even out 50 to 100 feet. Do Not point this at anyone's eyes!  It seems to go through the battery pretty quickly compared to Duracell so it is good they sell you two rechargeable batteries so you have a backup.;The illumination is brilliant even out 50 to 100 feet
54;90.0;3.0;7.0;388;not worth the price;Three Stars
55;113.0;1.0;6.0;391;This flashlight has potential. I like the style, and it is, indeed, bright. But it took weeks longer to arrive from the company than I was told it would. The charger is a cheap piece of junk, the case a joke, and after a few recharges the battery would not take a charge at all. Don't waste your time or money on this. Go with a Maglite would be my advice.;I like the style
56;92.0;5.0;7.0;392;Nice;Five Stars
57;54.0;1.0;15.0;392;Horrible,  the second day of use it would change intensity and sequence by barely moving it. Bought it for work where I need a good light that would be brighter than the overhead florescent lights. Thought I was getting a deal, but got ripped off. Don't buy this.;Horrible, the second day of use it would change ...
58;141.0;1.0;5.0;393;Just received my great flashlight. No manual, no charger or lithium ion battery. Just a 3 battery holder and sleeve. Paid over $65.\nTried holding power button for a long time to switch modes but it will not switch.\nDo NOT buy.\nMy maglight works better and is more durable.\nI guess 'Made in USA' just means junk in this economy.;Horrible product. Just a scam.
59;67.0;1.0;10.0;396;"There are about 10 brand names for these flashlights which may have a slight visual difference on the exterior that is purely cosmetic, and there isnalso the generic one without a brand name.  These are all produced by the same manufacturer in China and they will allow tou to customize th3 vidual looks if you purchase over a few thousand items.  I was offered the items with a bag and my own brand name for $2.78 including shipping or they will allow drop shipping as well.  The ""official site"" they use where thry claim the price is 75% off contains pictures that sre not even theirs, the one that illuminates the whole building or mountain is the photo of the flashlight built by an individual and that has 90,000 lumens for which he has a patent for.  The casing is cheap and don't expect metal, and I would never sell anything like this to anyone except for my enemies if I ever make any.  I never intended on mass selling these either but I wanyed to find out what the wholesale price was, so I found a contact through alibaba which is where I got the price.  With enough complaints, the FBI should eventually get on their case for scam.  Of you want to try something like this, I would suggest not to pay anything more than 5 or maybe 10 bucks, and if you really want a good flashlight, you may want to stick to known brands.  I usually will go to a sporting goods store or to Walmart and try them myself, and then will find them on Amazon and buy them.";and I would never sell anything like this to anyone except for my enemies if I ...
60;114.0;1.0;6.0;398;TOTAL SCAM!!!!!;One Star
61;142.0;1.0;5.0;398;Doesn't work. Shaking violently sometimes makes it flash for a millisecond. Received as a gift. Utter garbage.;Utter garbage.
62;115.0;1.0;6.0;400;I bought 3 of these flash lights on line with a big discount. When I bought them, they tried to sell me some very expensive rechargeable batteries. I didn't buy them. The flashlight comes with a rechargeable battery. So, I charged the batteries and the flashlight was very bright. Problem is the battery life is only 3 to 5 minutes making it completely useless.  If it seems to good to be true...;Do not buy this flashlight.
63;78.0;5.0;8.0;402;"FWIW... First, I BELIEVE all the 1-star Amazon reviews BUT... My uncle bought what appears to be this SAME Shadow Hawk 800 via late night infomercial. He bought 3.  ONE did not work only bc Litium battery was bad. (Contacted Company & they ""said"" they are sending replacement).\nThe ""other TWO"" are awesome 800 Lumen (mega bright) heavy metal tactical flashlights.  Each come with optional 3-AAA battery PACK (2nd battery option) to use in lieu of the Lithium battery.  Even the flashlight with bad Lithium battery WORKED with the alternate 3-AAA battery option.\nEveryone who's seen it is like ""Damn!"".  Makes me wonder if this ""seller"" HERE is selling original product?  5-stars ""thus far"" but will update if there is a failure.  Obviously ""something is up"" since there are too many 1-Star reviews.  Don't know what.  That's my 2-cents.  I got it as a gift, so my perspective may be a little off.  But for me, it's a sturdy, heavy, 800-lumen, high grade, bad ass flashlight (NOT a $6 flashlight) MAYBE this seller is swapping out the real Shadowhawk & substituting a piece of crap. Just a guess because something here does not make sense.  (I'd STILL be wary of 3am infomercial products, even though my uncle received a very high quality product).  Good luck.";My uncle bought SAME(?) flashlight via Infomercial- Awesome
64;57.0;1.0;14.0;403;Rip off.  I should always read reviews.  This is a joke;Rip off. I should always read reviews.
65;116.0;1.0;6.0;404;If I go outside at night it takes me 10 minutes to get the light to get away from the strobe and get to a solid light junk;If I go outside at night it takes me 10 ...
66;117.0;1.0;6.0;405;"Shadowhawk is a ripoff! They have the gall to sell this for more than double the price of the EXACT same item from different suppliers. I called them recently to find out where it was made. I inspected every square millimeter of the light, all the packaging and documentation and there was absolutely NO markings of origin. They kept trying to tell me it's made in USA. WRONG! All American made products are properly marked ""Made in USA"". Please do yourselves a favor and look two lines down from this one and you'll find the exact item for more than half.";Ripoff
67;118.0;2.0;6.0;406;the flashlight wasn't what it says it is like any other battery;Two Stars
68;120.0;1.0;6.0;407;This does not perform like they say.;One Star
69;55.0;1.0;15.0;407;This has to be the worst flashlight I have ever owned. The ads looked convincing so I fell for it and bought two of them. One completely stopped working and the other flickers on a full charge. The photos showing how bright this is are obviously fake. It is clear to me this is not a military flashlight, its a piece of junk. This also is not 800 Lumens otherwise it would be much brighter. It might reach 200 Lumens at max. I have another flashlight that is 350 Lumens and it out shines this one by a long shot. I would recommend every go with the Bushnell tactical line of flashlights. They are so much more worth your money than this paper weight.;Downright awful
70;119.0;5.0;6.0;407;best light I have ever owned.;Five Stars
71;93.0;1.0;7.0;408;No instuctions. Cannot figure out how to activate the 5 different modes.;One Star
72;94.0;1.0;7.0;411;The battery dies out very quickly, and for someone thats in law enforcement that isn't very safe.;One Star
73;58.0;1.0;14.0;412;Bought this flashlight thinking I was paying good $$$$ for a good quality flashlight. The flashlight was not as brite as I expected it to be. I purchased a led headlamp for $19.99 that was way brighter. Save your $$$$;Not worth the $$$$
74;46.0;1.0;19.0;420;The flashlight worked fine when I received it. I put it in the glove compartment of my car, and the first time I took it out to use it, the battery was dead, discolored, and would not take a charge. I can't find replacement battery's.;Would not recommend.
75;143.0;3.0;5.0;420;Great flashlight, just as described. I would recommend this to anyone needing a small rechargeable flashlight..;Great flashlight , super bright
76;49.0;1.0;18.0;420;For a military grade flash light i have been greatly disappointed. I dropped it once while camping and now it's broken.;... a military grade flash light i have been greatly disappointed. I dropped it once while camping and now ...
77;64.0;1.0;11.0;421;the rechargeable battery is a pice of garbage\nvery expensive product you can buy it for $20.00\nit's a rip off;the rechargeable battery is a pice of garbage very expensive product you can buy it for $20
78;42.0;1.0;23.0;421;These are pos. My ten dollar head band light is brighter and it's only 200 lumans plus batteries lasts longer than the 3aaa's used in this flashlight.. I got suckered injury buying five flashlights which was advertised as 15 dollars and get one free.. After I put my credit card info in, it charged me  $173.00 so i I called right away which no number was listed after you paid for it anywhere. I'm glad I still had the ad and used muy friends email account.. Customer service is  out of the country and you can't understand anything they're saying and they don't understand you.. I finally got someone that spoke better English and the refined me seventy dollars but I was stuck with the rest and five crappy flashlights plus I got no lithium ion batteries or charger that was promised in ad.\nJust adapters for 3 triple a's that last about 13 minutes on high which again is only about 100 lumins instead of the 800 to 1000 as promised..\n\nDo not buy.. Hugh rip off and misrepresentation of their product..\n\nLet's get a civil lawsuit going top get our money back and let them keep their crappy flashlights..;DON'T FALL FOR SCAM.. CHEAPAND NOT CLOSE TO WHAT'S ADVERTISED AND THEY WON'T TAKE BACK UNLESS YOU PAID EXTRA TWENTYDOLLARS
79;121.0;1.0;6.0;422;2 weeks in and it does not turn on\n\nit is not as bright as described or advertised;One Star
80;53.0;1.0;16.0;423;This is nothing but a cheap chinese dollar store flashlight being marketed as something else. If you want a good flashlight for a decent price check out anything from olight, fenix, convoy, and nitecore. DO NOT BUY THIS PIECE OF TRASH.;Scam, should be zero stars
81;122.0;5.0;6.0;423;Quite pricey, but I like the compactness, steel like material, especially the sos and strobe, adjustable light from wide angle to pinpoint (distance and brightness is better than my other more expensive similar flashlights).  I will buy another one for my wife and put in her purse or car for her safety at night.;Gadget buying nerd is satisfied
82;144.0;2.0;5.0;424;I recently received my ShadowHawk x800 in a black plastic box that said made in China..  The box has four plastic clips to lock it down, one doesn't close properly so immediately I knew the company doesn't practice good quality control.  The flashlight inside feels heavy and sturdy, and features all the modes it advertised : several zoom modes, strobe and SOS.  It didn't include an instruction manual and I couldn't find one on the web, so it took me a while to figure out I had to keep the on button pressed for a while to change modes.  In the ad literature as well as in the videos, this flashlight is said to be capable of blinding and disorienting potential aggressors when the light is shined directly in their eyes, particularly in strobe mode.  I tried this on myself first and then on a few of my friends and even though it is somewhat powerful it should, in no way, be considered a tool for self defense.  Other than this it is a decent flashlight but one that can easily be substituted with much less expensive alternative options.;Shadowhawk x800
83;79.0;1.0;8.0;425;The ad shows a person standing in a field at night with the flashlight illuminating the trees around them.  This thing wouldn't even light up my bedroom to find my slippers.  No paperwork or manual comes with it (not like you'd need one for a flashlight), nothing to tell you how to charge, how long to charge, proper battery use or storage - nothing.  I charged the battery for a full day.  No good.\nComes with a plastic case with a cord - not sure what that's for.  So completely disappointed.  My store-bought $20 flashlight works a lot better.;Dull
84;145.0;1.0;5.0;426;Junk and poor customer service....bought 5 of these...chargers and batteries do not function.  Contacted ShadowHawk .....concerning replacement of the chargers and batteries and received idiot instructions on how to use the charger.  What a joke....do yourself a  favor, do your homework and buy a product with positive feedback.  I love the footage of the plane rolling over the indestructible ShadowHawk flashlight,but dang it doesn't work as advertised. SAVE YOUR MONEY.....Good flashlights out there. Be a smart BUYER;Poor Product and Customer Service.....Save your money on this product.
85;123.0;1.0;6.0;429;I did not see a negative star.  Arrived on time.  After that sucks.  Charged battery placed correctly would not work. Used 3 AAA batteries would not work.  Looked for spare bulb.  Not one;After that sucks. Charged battery placed correctly would not work
86;34.0;1.0;28.0;429;complete garbage. I just received it today and the lens was already scratched up. chraged the battery for almost 2 hours and it's still not much brighter then a Keychain light (honestly). NOT AT ALL AS POWERFUL AS ADVERTISED, NOT EVEN CLOSE. clearly THE company realise on advertising over quality. SCAM SCAM SCAM not worth the money DO NOT BUY;DO NOT BUY
87;56.0;1.0;15.0;431;Been using the shadow hawk  for 2 months now,and the on and off button has already  broken. From day one I should  have sent it back. Not even  close to 800 lumens ,my buddy's sure fire is 600 and it puts off 3 times more light. The fact that  the button is broken  so quickly  tells me how poor it is made. Tactical my rear end.;Do not buy
88;126.0;1.0;6.0;436;No, it is cheap junk and my husbands five dollar Costco flashlight was far brighter.  I returned it and got my money back.;Don't waste your time
89;45.0;1.0;20.0;436;This is a total scam, and I, usually being very skeptical of this crap got taken. The product is sub-par and there is no way that thing is pumping out 800 lumens -- maybe 300 at best. The other nicety is they will set up with an EliteShip membership with a recurring $14.98 monthly charge. How nice. I feel so freaking stupid I can hardly breathe.;Total scam + monthly charges.
90;60.0;1.0;12.0;437;You want a tac light that lives up to the hype get the Maglite XL50 LED 3-Cell AAA Flashlight Tactical --it is soo bright with all 3 modes that it is not only bright, it will actually hurt your eyes . 2 brightness levels and a strobe.;You want a tac light that lives up to the ...
91;50.0;1.0;18.0;439;DO NOT DO BUSINESS WITH THESE CROOKS.  I CAN'T BELIEVE AMAZON CONTINUES TO ALLOW THEM TO SELL ON THEIR SITE!!!!  THEIR PRODUCT IS GARBAGE AND THEY WON'T REFUND MY MONEY FOR THE BROKEN ONES!!!  HEED THIS WARNING, YOU WILL BE SORRY!!!  PLUS, THE FLASHLIGHT IS NO BRIGHTER THAN A MAGLITE.  JUNK JUNK JUNK.;THEIR PRODUCT IS GARBAGE AND THEY WON'T REFUND MY MONEY FOR THE BROKEN ...
