;ranking;overall;vote;reviewText;summary
125;125.0;1.0;10.0;"I was eagerly awaiting this game and all the excellent reviews it received made me happy to finally have it in my hands. What can I say; I should have paid closer attention to the reader reviews, and not the biased reviews of game journalists that line their pockets with free gifts and ad revenue from Activision.\n\nWithout spoiling anything, I can safely tell you that the story of MW2 can be completed in less than 5 hours. I took my time and explored the game. I was extremely disappointed to find out that the game is so short, but it is being touted as a ""multiplayer"" game, so I quickly jumped on line.\n\nLet me say that my experience with the game was even worse from that point on. I had friends drop from matches, and everyone was experiencing a lot of lag. We could not host the matches ourselves, and there are no dedicated servers, so the game would automatically pick the ""best"" host, causing our ping's to shoot up into the high 150's for most matches, sometimes reaching all the way into the 300+.\n\nWhat came as an even greater surprise was the fact that the game caps out at 9 vs 9 matches. Apparently 9 vs 9 is a ""multiplayer"" experience. All my hopes of large scale battles went away. Why does a PC game only support 9 vs 9 matches? What happened to 64 vs 64, or at least 32 vs 32. Imagine killing the same 9 people over and over again during the course of the match. Where is the fun in that?\n\nSoon after we encountered another issue. We could not kick players that would cheat or idle. This made some of the matches become basically 3 vs 5, and completely ruin the fun. Also when the ""host"" of the game leaves (remember, the game picks the ""best"" host for you) there is a delay before it finds another host. During this delay everyone basically waits and twiddles their thumbs.\n\nEventually we tried to figure out how to chat amongst ourselves... And we could not do so! The game has no party chat. What ""multiplayer"" game in this day and age has no party chat? Communicating with your team members is essential, but this is absent from the game!\n\nI can go on and on about the huge lag spikes, higher price point, lack of console access, weird exploits that render your opponent immortal, but why bother? I believe I already made my point that you should NOT be buying this game on the PC.\n\nIf you want a great FPS, wait for Battlefield Bad Company 2, which not only has all the features Modern Warfare 2 is missing, but actually looks like it will have the support of the modding community, which Modern Warfare 2 does not.";A complete waste of money: the single player story is only 5 hours long and key multiplayer features are missing.
63;126.0;1.0;9.0;Well after reading other reviews and issues concerning this game. I do not think this is worth buying for the PC. Main reason for me is it does not support dedicated servers. Seems to me to be nothing more than a piss poor port of a console game. I will just wait for Bad Company 2 for the pc.;Rather wait for Bad Company 2
65;127.0;1.0;9.0;What everyone else is saying.  It is seriously worthless to me since I am an online player not focused on singleplayer.  DO NOT BUY IT IF YOU PLAY ONLINE.;Ditto
67;128.0;3.0;9.0;"OK, I know on all platforms they sold over 7 million copies, 12% was PC. It looks like they put forth 12% of effort to port this marvel from console. Come on! No advanced graphics options, is this PC or what? No lean? Can't kick hackers? Host migrating? No actual ping displayed? No mods? No dedicated servers? Most weapons sound like silenced variants. Almost no recoil.\n\nBut I bet we will get plenty of DLC.\n\nSome SP mission are fun, including UAVs, I'll give you that. Scripted to hell, but it is still fun. Graphics is very crisp. Problem is it's about 4-5 hours long. Good movie these days is about $10 for 2hr+ flick. So about $5/hr of entertainment. With CODMW2 you shell out $60 for 4hr, thus paying $15/hr.\n\nIt is a sad fact that game development of major A title costs upward of $40 million. Mainstream gaming has been heading console direction for a while. There are many reasons for that. This is very good example of the trend.\n\nEDIT: More thoughts on SP gameplay... (I didn't even bother to spend a lot of time in MP.) Since MW2 took after World at War, it is very irritating when game switches between characters all the time. Quickly you lose track of who is who. Plot is impossible to figure out. I wished MW1 continued... May be I'm getting old but in order to enjoy hectic combat you really need to be a 14 y/o high on red bull with strobe lights flashing and techno blasting at the same time. Half of the time your screen will be splattered in red with ""RELOADING"" blinking... No matter where you turn, there are always at least four new enemies pop up like jack in the box at your 12, 3, 6 and 9 o'clock and you never have time to reload. This game tries to be serious and Serious Sam at the same time. Jeebus Chroist, pick your poison and stick to it, Infinity Ward! I really enjoyed MW1, combat was tense where needed, not non-stop glow stick fest at the Annual Big Rave. And yes, you will miss no-lean in about 2 minutes into the game. And yes, AI can lean and use cover to fire...\n\nOn a positive note: Game runs very smoothly maxed out and what features that still remained in the game were pretty well polished. Voice acting, motion capture, models, explosions are superb. I'm running it on Windows 7 64bit, E8400, 4G of RAM, HD 4890 and 2 Intel X-25m in RAID-0. Not totally surprised since there is almost no draw distance (try Arma2 for a change ;-) Also I liked smartly designed level loading, while you watch pretty meaningless movie, game will be loading in the background.";PC gaming is dying
69;129.0;1.0;9.0;The fact that activision felt the need to treat pc gamers like a bunch of idiots is simply amazing. Their outright greed in pricing the game $10 higher than normal retail with no justifiable reason sets a dangerous precedent for the industry that I just can't condone. Some might call this a by-product of capitalism, after all it's their game and they can charge what they want, but then I won't support this precedent by purchasing the game. The lack of dedicated servers and mod support despite the overwhelming preference of pc gamers for support of these features is just spitting in the face of gamers. The fact that they only did this in order to force dlc on gamers instead of letting the community support the game by making their own custom maps and server settings is seriously troubling. Oh, and did I mention that the new servers already have hackers on them, only this they can't be banned by server admins, since, well, their aren't any server admins since we have no dedicated servers. This whole ordeal has seriously become a fiasco and a lesson in how not to treat a pc release. Sure the game will still sell millions, but ultimately, it won't have the longevity and support from the pc community it could have. Infinityward had the chance to make something special, but perhaps through no fault of their own, the pc version has been crippled beyond belief. There's a reason pc gamers shell out the money for a nice rig rather than going the console route, and with Call of Duty, all those reasons were simply flushed down the toilet.;not gonna stand for activision treating pc gamers like this
72;130.0;1.0;9.0;Scenario:\nCOD 1 = 64 multiplayer games\nCOD UO = 64 multiplayer games (with tanks!)\nCOD 2 = 64 multiplayer games\n*COD 3 was console only so i have no idea how many players were able to play in a single game being I never bought it.\nCOD 4 MW = 64 multiplayer games\nCOD 5 = 64 multiplayer games\n\nCOD MW2 = 18 multiplayer games :(\n\nConclusion: 64 > 18\n\nI've been an avid supporter of the COD series (except for COD 3) from the beginning, but I think I'll hold off on COD MW2 until things pan out for the PC gamers.\nSad, cus I have the money to buy it but I think I'll get Borderlands or Bad Company 2 (when it releases) and get COD MW2 next year some time. Infinity ward seems to be marketing towards the game console community these days.\n\nPS. I also have an Xbox 360 and refuse to buy FPS game for it, because they all ways feel like I'm running/turning/shooting in molasses.;Not for the PC gamers SADLY.....
74;131.0;1.0;9.0;There is a lack of dedicated servers, latency issues on the listen server-only IWNET(Infinity Ward NETwork), lack of console commands, lack of support for matches larger than 18 players, and inability to vote to kick and ban cheating players immediately, this is one of the most locked-down, inflexible, and gamer-unfriendly, game ever created. Also your not buying the game on the disk your buy a validation code on the back of the manual, you download the game though Steam, and you need an internet connection to download the actual game.\n\nAnd the campaign is short only six and half hours, I paid over sixty dollars for this!;Avoid!
77;132.0;1.0;9.0;Well, I just finished the campaign mode, and I REALLY enjoyed the single player of this game.  If you liked Modern Warfare 1 single player, you will enjoy MW2 single player.  The downside is that the single player is REALLY short.  I finished it in about 4-5 hours in regular difficulty.\n\nThat said, I really enjoyed MW1 multiplayer and was looking forward to MW2 multiplayer.  However, on the PC, this was a horrible experience.  Right off the bat, you will realize that this game was designed for console systems.  The game auto selects a 'server' and you typically end up in a game with 7-9 other people.  The game says it supports up to 18 player multiplayer, but the most I ever saw was 10 total.  Latency was an issue as I am used to being able to pick a server at 15-30 ms pings, and now the best I get is 100ms (which the game nicely tries to mask as connection bars).  A good test of connectivity was trying to sprint.  In MW1 if I had a bad connection to a server, my sprint would always drop out and make me 'walk' again.  On a good server, this was never an issue.  In MW2, this is always an issue.  It is very difficult to sprint for your full duration without being dropped out early due to latency on it's automatically chosen 'best' server.\n\nRegarding gameplay, for some reason, the game feels more like World at War to me than it does like Modern Warfare 1.  It just doesn't feel as crisp or controlled.  Of course, I've only had the game for 2 days now, so maybe I need to give it more time.  The no lean thing also takes away from the gameplay.  Again, this is attributed to the game being developed for consoles.\n\nAnyways, bottom line.  At $60, if you REALLY enjoyed the single player in MW1, go for this.  If you are a console gamer, I suppose this is a good console game too.  If you are a PC gamer, the price is kind of steep for what you get.  It would have been better off as a $24.99 expansion to the single player game as MW1 multiplayer is far superior.;Fun Single Player - no Multiplayer
91;133.0;1.0;9.0;The single player is awefull. It's a rinse and repeat throw 100 guys at you from all direction and shoot your way out of a box. The graphics are good but showing thier age.\nI was expecting the single player to be good but surprised at how really unimaginative and boring it is.\n\nThe multiplayer is unplayable. No dedicated servers, random servers you are forced to play on with tons of lag.;This game is bad on all levels.
105;134.0;1.0;9.0;All i can say about this game is that i wasted money... i practically just gave some scammer $60, then got slapped in the face...!!! This game\nwas aimed at making profit and nothing else! Such a shame as i own every call of duty game, i loved them all until i received this one...\nTo tell you the truth i was REALLY disappointed too, because after COD MW1, and knowing how much fun that was playing! I was expecting something\nrelatively the same, but no i got a piece of garbage that was just hidden a box... I should have read the other reviews before buying...\nit was my fault =(.\n\nDON'T DO THE SAME MISTAKE I DID! DON'T WAIST YOUR HARD EARNED MONEY ON THIS GARBAGE!;Worth as much as a ROCK!
107;135.0;1.0;9.0;No dedicated servers means high ping, Cheaters Not Kicked And 5 second DELAYS when random Host leaves...  WHAT the HELL!  yeah and all for 60$ what a deal... don't do it, look online for single player torrents until online is fixed. (if it ever will be);NNNoooooooo!!!!
112;136.0;5.0;9.0;I started playing this game today, and it is simply fantastic.  I jumped right into the multiplayer and although very different from what we are all used to playing it is done very well.  The games may be smaller, but are intense and fast paced.  IT is very easy to find a game and hop right in, and start killing or capturing flags or blowing stuff up.  I was not sure about the game when I first heard how it was going to be changed, but IW has done a great job and creating a pleasing experience.;MW2 review
116;137.0;1.0;9.0;"Since the firsts days of the Call of Duty franchise, the players played and loved these games, even to the point that some people even bothered to make modifications for these games. And now, after the amazing success of Call of Duty 4 & co, how Activion is thanking us, the (so called) PC crowd, those who bought their games in the past? By giving us a console port! No dedicated servers (you can't rent a server and manage it the way you want ex: kicking people), a limit of 18 players per game instead of 32 (just like the consoles, HOW convenient!) and they even decided to protect their wonderful servers with the inefficient VAC anti-cheats program made by Valve. Speaking of Valve, you must know that in order to play Modern Warfare 2 you must have Steam installed on your computer in order to play (what? You didn't know?). Of course, they're trying to convince us that replacing all that by what they're offering is a good deal... Matchmaking servers, which mean you no longer have to scroll through a ""painful"" list of servers (no more exercise for you fatties!), add a friend list (oh how creative) and the VAC anti-cheats (in cheaters language: open buffet, all-you-can-eat). In Left 4 Dead, they used the matchmaking concept and I absolutely hated it (you can deal with it since it's only 4 players per game, but 18?). Let's say that you're in a great game with funny players and bang you get disconnected for no reason, you'll never be able to join back that game because the matchmaking system will send you somewhere else... Wonderful isn't? I'm telling you, don't buy this game, don't encourage their lame practice business, vote like me, with your wallet.";A Day to be Remembered in Infamy.
120;138.0;1.0;9.0;If you are considering buying the PC version thanks to the long set precedent that the PC versions of shooters are ultimate FPS experience, you are in for a rude shock.\n\nLong standing FPS feature such as dedicated servers, the ability to kick and ban players from servers, the ability to make changes to certain game settings like your Field of View on the console are long gone.\n\nYou are left with a watered down experience that is a mere shadow of its predecessor in terms of accessiblity.\n\nInfinity Ward claimed that many of the changes they made were to make the game more secure and hack proof, yet the intarwebs are rife with videos of a hacked PC client already making the rounds.\n\nBy supporting this game, you are supporting the notion that it is OK to take out standard features that are a staple of the PC gaming community, and charge us the same amount for it.  Even the digital downloads of this game cost the exact same as a retail box copy, but you are only left with a disk and a sense of disappointment in yourself for having not spent your money elsewhere.\n\nIf you are dead set on buying a copy of Modern Warfare 2, I suggest you buy a used copy, where none of the proceeds actually make their way to Infinity Ward.;A Waste of Money for PC players
124;139.0;1.0;9.0;This game is a huge disappointment.  No dedicated servers, no mod tools and nothing like you've come to expect from the previous CoDs.  It's a shame, the CoD series was a shining example of how to do a great PC shooter and it's become nothing more than a poorly ported console game, and they charge $60 for a DRM laden, crippled version on top of that. Listen to the hundreds of reviews here and elsewhere: Do not buy, save your money.;Huge Disappointment!
132;140.0;1.0;9.0;No multi-play value for pc users who want to play with their clan mates. That alone earns this game a 1star out of 5.;Way to Go Infinity Ward...
143;141.0;1.0;9.0;CAUTION: this may contain slight SPOILERS\n\nUnlike most negative reviews here, I actually own and played this game.\n\nI'm a huge fan of the COD series. I own and enjoyed all of them, as well as Medal of Honor: Allied Assault (COD's spiritual predecessor). That said, this game is a huge disappointment. They took what made Modern Warfare great, and ruined the multiplayer. They added a part early on where the player participates in a civilian massacre at a Russian airport- having played through this part (which may be disturbing for many), I don't really think it adds much to the story and merely serves to drum up controversy and free press/hype for the game.\n\nThat said, the singleplayer is fun. If you liked the original [MW] single-player, you'll love this. The graphics are improved and runs smoothly on my PhenomII x4 w/ Radeon 4870 at 1920x1080 (didn't bother to run FRAPS, but it never hiccuped). The scripted in-game dialog and cinematics are flawless, and the story is captivating, with many throwbacks to MW (Capt Price and 'Soap' MacTavish are back!).\n\nIf single-player alone can justify the inflated price tag, then so be it.\n\nHowever, if you're like me, and spent the initial 10 hours beating MW single-player and happily wasted the next 50-100 hours in multiplayer, you'll be sorely disappointed:\n  1. No more dedicated servers.\n  2. Due to #1, no more custom mods.\n  3. No custom maps too. You'll have to buy these as DLC.\n  4. 18-player limit. Just like the console.\n  5. Game-matching interface geared towards quick matchmaking. Clan games will be a thing of the past here.\n  6. LAG!!! 100msec is unplayable. IW, if you can't allow dedicated servers, then fix yours!!!\n\nSo much for that 100-hour longevity of the original... I've already stopped playing this, and I went back to the original.\n\nSurely, the company did this in the consumers' best interest, did they? Coding up a dedicated server and increasing match sizes to be over 9-vs-9 isn't a daunting task. One could argue that this was done to curb piracy, but that argument becomes moot when there already are pirated MP servers, and the game requires online activation anyway.\n\nNo, the reason IW/Activision did this was to sell DLC mods and map packs to PC users. They wanted to turn the PC community into a cash cow that would buy all of the map packs and mods. No more free community mods. No more free maps. You'll have to give Activision more money instead.\n\nFor a company who owe their original success to PC gamers, Infinity Ward has sold out to the profit-centric mentality of Activision, and even went on the record to defend the soul-sucking and greedy comments made by the infamous Activision CEO, Bobby Kotick.\n\nMW2 will likely be my last IW game, on any platform.\n\nSummary: Fun singleplayer, intentionally-crippled multiplayer. If you want to reward companies who treat gamers like this, then by all means send them your money. I wish I hadn't bought this.\n\nWarning: Don't buy a USED copy of this game for the PC. Once activated with Steam, it becomes permanently linked to that account. Yes, even the retail version requires Steam. Not a complaint against Steam really, since I now embrace Steam as a necessary evil (its DRM is less-intrusive than StarForce rootkits or SecuROM install limits, and actually allows you to redownload previously-bought titles unlimited number of times on multiple PCs). But the biggest drawback is that titles on Steam cannot be transferred to another account or resold. So caveat emptor on buying the PC port used- you may end up with a worthless disc that will refuse to play.;Very Expensive Single-Player Game
148;142.0;1.0;9.0;Just look around at other reviews, they dumbed down the PC versions as far as they coul, then, called it an 'upgrade' to the game. Do not buy this, wait for Bad Compnay 2 which will destroy this game.;THis game is 100% port, and 100% disappointing.
152;143.0;1.0;9.0;The thing I got to say is that steam has to go and just go buy a ps3 or an xbox 360!;Steam has to go
166;144.0;3.0;9.0;im not gonna give the reasons like everyone else who didn't buy the game.  Single player is like the others, pretty cool.  Multiplayer works like IW said it would.  But, i don't like it.;Good single player, as expected, not so good multiplayer.
192;145.0;5.0;9.0;The single greatest game that I ever played.\nI have had zero problems that some have spoke of\nand as a matter of fact the majority of the negative reviews\nare from pc gamers that do not own the game and plan to\nnever own it they're only object is to sway others from buying it.\nVisit and read for your self. [...];Amazing
3;146.0;5.0;8.0;I'm going to keep this short, but despite what people seem to be saying about this game, its superb. everything is nice and polished, the graphics look great and run smoothly meaning that the company took the time to optimize the game thoroughly. Some seem to not like this game because of 2 reasons: no dedicated servers and 18 players max playing together at one time. About the dedicated servers, its really hit or miss, but in my experience, It has worked the way it was intended and done it well. The host has a tiny tiny advantage, but not enough for me to ever notice it. As far as there only being 18 people playing at one time, if you have ever played counter strike, you know that when it gets to be more than 20ish people, its so chaotic that its not fun because of the pace of the game. The same is true for MW2, the game is so fast paced that if there were more than 18 people, you would be getting an instant head shot as soon as you spawn and wouldn't be as fun. what ever your preference, MW2 is some great, fast paced action that is just as challenging as it is satisfying. I think a lot of people who left reviews for this game think that this game is a PC designed game, and it is not, it is a port in every meaning of the word. that being said, its still a great game. If you cant stand no dedicated servers and low server cap, get Bad company 2, also a fantastic game. In the end, it all depends on your preference.;The best that consoles have to offer.
8;147.0;1.0;8.0;The graphics are OK, but the 1-player campaign mode is disappointing and very limited. The worst part is, online/multiplayer mode, which was absolutely AMAZING in CoD:MW, and in itself worth the price of the game, is now crippled in this MW2 version -- NO support for dedicated PC servers, and a limit of 9 players per side... are you KIDDING me??? how lame is that?!! So online play is laggy and jerky, and your connection just mysteriously drops out of nowhere. It's really horrible, especially given the online gameplay experience in the previous version of CoD... Shame on you, Activision and Infinity Ward. I want my money back.;huge let-down
23;148.0;1.0;8.0;Lag, LaG, LAG !!!!!\n\nI thought MW2 stood for Modern Warfare 2... but after playing it for many hours, I realize that MW stands for LAG X 2!\nI stood before an enemy and unloaded an entire clip from my M4 at a range of ~ 20 feet...and he then shot me dead!\nIf this had happened only once I would say, OK, I will just re-up and get another game going...But next game I had a sniper walk in front of me and I unloaded my SAW on him... he was not phased in the least but calmly ran up the stairs!!!\nAfter yelling at the game and getting angry I decided that I should at least let some folks out there know:\n\n  DO NOT BUY THIS GAME!!!\n\nThe lag is beyond any I have ever seen. I am blaming it on STEAM because at least with COD4 MW1 I could find another server...With STEAM... you get steam. And you get lousy servers without recourse. Boy, is my face red!;Lag, LaG, LAG
24;149.0;1.0;8.0;So, where to start? My computer is custom made. I spend about $1900 on it. In short, it's pimped out. I purchased Modern Warfare 2 with every intention of wasting tons of time playing it. My plans were foiled when I discovered ERROR AFTER ERROR AFTER ERROR when trying to play this game! Literally 8 different errors that have required about 6 hours of my time, and now, like hundreds of other people on forums, I am stuck with the iw3mp.exe errors everytime I start the game. I can't play for more than 2 minutes without it crashing. This error has NOT been addressed by IW and there is no known fix.\n\nTHANKS FOR NOTHING!!!;So Many errors and no patches from IW yet
34;150.0;1.0;8.0;too many negative things to list, IW has completely dumped all over their PC community.  hopefully there will be some patches to fix the fundamentally WRONG things in this game.;an xbox game for your PC
68;151.0;1.0;8.0;Nothing but COD 4 with all the good stuff taken out.\n\nSave your money, COD 4 or COD 5:WOW for the PC is much better.  If you have both of these you don't need this version.;Save your money
71;152.0;1.0;8.0;No dedicated server, short single player.  A major step backwards from the previous version for PC.  If you must have this game, buy it on console.  All console gamers know is peer hosting, so they won't be able to tell how much this sucks.\n\nAND A $60 price tag!  What's up with that?!\n\nThanks Activision.;Had potential
