;ranking;overall;vote;reviewText;summary
75;206.0;1.0;6.0;This game had so much potential, and so far, has delivered on it poorly.\n\nI hate the lack of dedicated servers, and the obvious porting from the console, and the absence of leaning, and no more hardcore mode, and a number of other things. They took a lot of what made the first game good, and they threw it out.\n\nWhat really bothers me, is that the game doesn't even work right now. I spent 45 minutes installing it through Steam (which is a problem in itself). It took so long because the default installation process does not work until Steam activates the game (which will take place on 11/13/09 I think). I then played the game for about an hour, having a hard time deciding whether I was enjoying myself or not, given all the pros and cons. Luckily I have had a lot of time to think about this topic, because the game is still not working after over an hour of trouble shooting. It just stopped working, and so far has not come back. I have tried a number of proposed solutions, and so far nothing.\n\nBottom Line: It may be fun if it works, but in many ways it is a step backwards, if not an insult to PC gamers.;Buggy and Backwards
82;207.0;3.0;6.0;"Okay, I'm going to go ahead and say that I don't agree with the direction IW took with the multiplayer.  That stinks and I love the multiplayer in all of the previous Call of Duty games.  That being said, I don't think that just because of that the game deserves only 1 star.  The single player is very entertaining.  It's quite a bit more dramatic than the first modern warfare game but still fun.  The Spec Ops mode is a complete BLAST!  I think that the spec ops mode is what saved this game for me.  Get a friend and take off into the numerous challenges.\nNow before you start berating me because I don't see eye to eye with your opinion, I do think the multiplayer is a crappy deal.  Yes, it would be much better if they offered the dedicated servers and all that other stuff that was in the first modern warfare.  I logged tons of hours in the previous call of duty multiplayer games.  Change sucks but how many different call of duty multiplayers do you need?  On my count you can still play dedicated servers for:\nCall of Duty\nCall of Duty: United Offensive\nCall of Duty 2\nCall of Duty: Modern Warfare\nCall of Duty: World at War\n\nI love all of those games for both the single player AND the multiplayer.  But, for me, when it comes to the Call of Duty games I put a bigger emphasis on single player than I do multiplayer.\n\nI'm not looking to say that anyone is right or wrong in their OPINIONS but rather giving my honest and hopefully helpful opinion.\n\nPros:\nVery entertaining single player\nExtremely entertaining Spec Ops mode\nTons of steam achievements to try and obtain\nPretty good graphics (not the best I have ever seen)\nGreat way to hold me over until Left 4 Dead 2 is released!\n\nCons:\nNo Dedicated Multiplayer\nRelatively short single player\nFriendly AI could be a little more ""intelligent""\nHigh price for small replay value (multiplayer issues)\n\nIt is what it is people.  They had the goal to make this game geared more towards the console crowd.  That is hard to take being a PC gamer but how is this any different than any other game that is made specifically for consoles?  Grand Theft Auto can be purchased for the pc but do you think they aimed it towards the PC crowd?";It is what it is...
85;208.0;1.0;6.0;This game is utter nonsense. It's a complete downgrade from every aspect compared to COD4MW except for graphics. Oh hey we gave you better graphics and gimped every other aspect of the game, oh and we want you to pay $10 more then you paid for the last MW. Give me a break. You have to be a real tool to buy this game for 59.99. If you buy it for that price you are probably the same idiot who buys a mac because you think it can't get viruses and buys consoles thinking somehow playing an fps on a console is cool. FPS started on PC, and is only made properly for PC.\n\nMW2 lacks features which have been made standard on PC games since the mid 90's yet most of the console tweens, who grew up playing on the console their mommy bought for them because they didn't want them surfing the web, don't even realize it's a sham. Let the idiots grow up in ignorance. This game is for the sheep.\n\nCall of Duty 4: Modern Warfare\n\nNetworking: Client/Server\nAvg Ping: 25-40ms\nConsole Commands: Yes\nLean: Yes\nCustom Maps: Yes\nNumber of Players: up to 64\nCompetitive Mods: Yes\nMod Tools: Yes\nAbility to Record: Yes\nKick/Ban Hackers Immediately: Yes\nProfiles Saved Online: No\nManually Select Server to Join: Yes\nControl Bad Language: Yes\n0 ping Advantage for Host: No\nLan Play: Yes\nFree Demo: Yes\nPrice: $50\n\nCall of Duty Modern Warfare 2\n\nNetworking: Peer 2 Peer (downgrade)\nAvg Ping: 100ms+ (downgrade)\nConsole Commands: No (downgrade)\nLean: No (downgrade)\nCustom Maps: No (downgrade)\nNumber of Players: up to 18 (downgrade)\nCompetitive Mods: No (downgrade)\nMod Tools: No (downgrade)\nAbility to Record: No (downgrade)\nKick/Ban Hackers Immediately: No (downgrade)\nProfiles Saved Online: Yes\nManually Select Server to Join: No (downgrade)\nControl Bad Language: No (downgrade)\n0 ping Advantage for Host: Yes (downgrade)\nLan Play: Yes\nFree Demo: No (downgrade)\nPrice: $60 (downgrade);Game made for the clueless console noobs
94;209.0;1.0;6.0;Just look at the utter disappointment from the DIE HARD fans.  Activision really screwed us over.  Hey Activision is my money not green?;Activision and Infinity Ward just spit in all PC Gamers faces
96;210.0;1.0;6.0;i agree with every bad review on this game. I had picked up my version of the game tuesday morning and returned it wensday morning. it is a waste of money, it is a step in the wrong direction, and it is a cop out.  the game was to short and did not grip me into the story as the first one did.  Activision knew the game would sell millions of copys regardless of the games content. shame on the makers of this game.  DO NOT BUY;why
100;211.0;1.0;6.0;i can't believe they dumb down this game. i was so looking forward to playing and it turns out to be such a disappointment. please save your money. i wasted mine but i can always trade it in or rty to get my money back for such a lousy product. never should have been released with everything that is missing that would make it a great game. shame on infinity ward and activsion. we want our money back!!!!!;modern warfare 2
101;212.0;1.0;6.0;Bought the game, played it and quit.\n\nAll the positives (graphics and audio) were blown away by the negatives (mostly pc-exlusixe features and just boring gameplay as in MW1). Would not recommend!;Thought it would be fun...
108;213.0;1.0;6.0;Just wanted to thank InvisionWare for the 7 hours of single-player fun and for saving me $60.;"Thanks IW;"
147;214.0;1.0;6.0;"I think everyone pretty much said everything bad about this version but here's my take on it. I'm sick of games being single PC specific. You should have the choice to sell the game once you're done with it. You can sell any console game no problem, but ""don't even dare sell your PC games"" says the higher ups. This game is not worth $60 and shame on everyone involved in setting the price that high.";Buy the XBOX or PS3 Version
234;215.0;1.0;6.0;"I actually decided to go ahead and cough up 60 dollars for the game..Now For starters, thats a good chunk of change for a PC game. Before people start crying out (if you cant afford it don't buy it blah blah blah) 60 dollars can give me 2 full car tanks of gas, a couple of trips to the movie theater with the family or this over hyped, neutered and zealously promoted piece of garbage. Single player is just one bad john woo movie with over done explosions and 0 character development. No offense the level where you massacre innocent civilians is downright creepy, i understand they want us to get ""into"" the game but thats really pushing it to far for my tastes. This game failes to capture my attention with the horrible hollywood d movie dialog, predictable action sequences (no change from the first modern warfare) an allegedly improoved match making system..and No dedicated server support. And they want 60 dollars?! Let me guess if this game tanks they will blame pirating online, real life pirating on the high seas and maybe global warming. Stay away from this game, please spend your money elsewhere, I would very highly recommend Arma 2 (even with all its bugs and learning curve at least the game tries to be entertaining) Battlefield Bad Company and or any other FPS then this game. In the end all that you end up paying for over the console version is the ability to use a keyboard and mouse, just plain fantastic.";What a steaming pile of crap
247;216.0;1.0;6.0;"First, the System Requirements:\n\nOS: Microsoft Windows XP, Windows Vista and Windows 7\nProcessor: Intel Pentium 4 3.2 GHz or AMD Athlon 64 3200+ processor or better supported\nMemory: 1 GB RAM\nGraphics: 256 MB NVIDIA GeForce 6600GT or better or ATI Radeon 1600XT or better\nDirectX: Microsoft DirectX(R) 9.0c\nHard Drive: 12GB of free hard drive space\nSound: 100% DirectX 9.0c compatible sound card\nInternet: Broadband connection required for Multiplayer Connectivity. Internet Connection required for activation\n\nThe game ran very well on my computer, which is a&nbsp;<a data-hook=""product-link-linked"" class=""a-link-normal"" href=""/Intel-Core-2-Duo-Processor-3-GHz-1333MHz-6-MB-LGA775-CPU-BX80570E8400/dp/B00116SLYY/ref=cm_cr_arp_d_rvw_txt?ie=UTF8"">Intel Core 2 Duo Processor 3 GHz 1333MHz 6 MB LGA775 CPU BX80570E8400</a>&nbsp;with a&nbsp;<a data-hook=""product-link-linked"" class=""a-link-normal"" href=""/Diamond-ATI-Radeon-HD5850-PCIE-1024-MB-GDDR5-Video-Card-5850PE51G/dp/B002Q6RNTM/ref=cm_cr_arp_d_rvw_txt?ie=UTF8"">Diamond ATI Radeon HD5850 PCIE 1024 MB GDDR5 Video Card 5850PE51G</a>&nbsp;running Windows 7 with 4Gb of ram.  I recommend a minimum of 2 Gb of RAM.  I tried it on 1 GB and it was noticeably sluggish, albeit still playable.\n\nWhen will these companies learn that you cannot screw over your PC supporters with misguided attempts to curb software piracy?  Have they learned nothing from&nbsp;<a data-hook=""product-link-linked"" class=""a-link-normal"" href=""/Spore/dp/B000FKBCX4/ref=cm_cr_arp_d_rvw_txt?ie=UTF8"">Spore</a>?\nModern Warfare 2 is the sequel to&nbsp;<a data-hook=""product-link-linked"" class=""a-link-normal"" href=""/Call-of-Duty-4-Modern-Warfare/dp/B000TTFLS8/ref=cm_cr_arp_d_rvw_txt?ie=UTF8"">Call of Duty 4: Modern Warfare</a>.  I do not know why they dropped the Call of Duty"" from their name, but that is only a small mistake in a series of blunders made by publisher Infinity Ward.  I'll try to be objective about actual gameplay and start with the positives first:\n\nSingle Player:\nModern Warfare 2 (MW2) single player gameplay is absolutely amazing.  It is the most immersive single player experience I have had from an FPS since I first started playing them in 1993. Anyone who has played&nbsp;<a data-hook=""product-link-linked"" class=""a-link-normal"" href=""/Call-of-Duty-4-Modern-Warfare/dp/B000TTFLS8/ref=cm_cr_arp_d_rvw_txt?ie=UTF8"">Call of Duty 4: Modern Warfare</a>&nbsp;will understand what I mean by ""immersive,"" and you can learn to expect more of the same with MW2. This is the closest I've come to feeling like I was actually in the military and it is what every other FPS with a single player aspect should strive for.  The story takes place following the events in Modern Warfare, as you take on the characters of Sergeant Gary ""Roach"" Sanderson and James Ramirez.  Gameplay has some great environments, including Brazil, Rio De Janeiro, and some decent urban environments.  Until you get to the American missions, the urban gameplay environments closely resembles what you find in Modern Warfare, with the exception of an airport mission that calls for some quick thinking.  One of the real standouts however is a snowy mountain, that many people have seen from the trailer.  If you've seen the trailer, you will know that there it ends with a scene that calls for a ""leap of faith"" of sorts.  I played the first time through on veteran and tried to really pretend I was within the game, meaning I took every precaution a real soldier would take not to die.  This heightened the experience for me, nowhere as much as this mission where you have to make that jump.  Without spoiling anything, I can only say that my heart was literally racing during this mission.  I strongly suggest that everyone consider playing the first time on veteran mode, which forces you to be (a lot) more careful and take your time.  This is even more important given that single player mode is over just as quickly as it was in Modern Warfare.  You're looking at an average of maybe 8 hours of gameplay.  I am not a very good player and it took me 15 on veteran.  If you lower the difficulty rating, it will be easier, but the game will be over before you know it.  There are enough save points where I think most players will be able to handle veteran without too much frustration.\n\nDisclosure: I have not actually played multiplayer through Infinity Ward's service, but don't feel that I need to to be able to comment and provide the below opinion.\n\nMultiplayer:\nUgh.  Here is where the fun ends.  Bottomline: this game is a port from the console version.  I realize that Infinity Ward probably gets more sales from consoles than a PC version, and I also realize they lose sales on piracy, but this was NOT the way to handle this release.\n\nTHERE IS NO DEDICATED SERVER SUPPORT IN MODERN WARFARE 2!\n\nYes, you read that right. In an effort to combat software piracy, and more likely, due to general laziness, you can only play multiplayer on peer to peer through their Infinity Ward web site.  There is no console.  That means no player servers, no customization, and no mods.  IW said their reasoning for this is ""we would like you to play the game the way we designed and balanced it.""  So they only want you to play by THEIR rules. Why do they CARE if players want to change the rules and add custom weapons or maps?  How does it possibly affect them in any way?  I'll tell you how, it causes them to put more work into the PC version instead of just porting it.  The max amount of players per map is 9v9, so forget about having large clan matches. They also removed the lean ability from the PC version, claiming that it affects game balance. WHAT?!  Is this game supposed to be realistic or not?  So now I have to jump out from behind a building because leaning around it gives me too much of an advantage?  IW's response about whether the PC version is a port or not, was that it is not a port, because it has custom features like ""mouse support and graphic settings."" WOW, I can change the resolution and use a mouse!  I was planning on buying an Xbox controller and jamming it into my USB port, but I guess I won't have to with these custom mouse features!  IW has confirmed that average ping times of 100ms are acceptable (expect the peer host to have a significant advantage, regardless of what they say), and that there is no way to kick cheating players because IW's flawless system will ban all cheaters.\n\nBelow is a comparison chart of the PC features between MW and MW2 (I did not originally compile this list)\n\n........................................MW....................MW2\nNetworking architecture..........Client/Server.........Peer2Peer\nAverage ping.....................10-40ms...............100ms+\nConsole commands.................Yes...................No\nLean.............................Yes...................No\nCustom maps......................Yes...................No\nNumber of players................Up to 64..............Up to 18\nCompetitive mods.................Yes...................No\nMod tool.........................Yes...................No\nAbility to record................Yes...................No\nAbility to ban hackers...........Yes...................No\nProfiles saved online............No....................Yes (the ONLY advantage MW2 has over MW)\nISP/Clan hosted servers..........Yes...................No\nBad language filtering...........Yes...................No\n0 ping advantage for host........No....................Yes (better hope he's on your team)\nLAN play.........................Yes...................No\nFree demo........................Yes...................No\nFree downloadable content........Yes...................No - you have to pay for it\nRequires patch to play online....No....................Yes\n\nI understand companies need to protect their intellectual property, but getting rid of dedicated servers in a misguided attempt to curb software piracy is a huge mistake.  People WILL pirate the game. I am not aware of any game that has not been cracked by software pirates. The only people Infinity Ward is hurting with this release are legitimate PC owners, the same people who made the original Call of Duty so successful. Do not be fooled into thinking this is anything other than a direct port of the console versions. I do not want to deter people from playing this on Xbox and PS3 though, so my review pertains only to the PC version. As a consumer, you need to decide if the price of this game is worth an amazing 10 hour single player experience.";A game with amazing potential which is lost on this PC PORT
2;217.0;5.0;5.0;This game is amazing!!! At first non-dedicated servers was an issue but now my friends and I don't mind it.\n\nI play on a amd 3.44 ghz quadcore,\ngtx260 (216 core) gpu,\n8gb ddr2 1066 ram, and COD 6 looks amazing and plays perfectly!!!!!!;BEST PC FPS!!!!!!!
5;218.0;1.0;5.0;this is had a chance to be a great game,unfortunately there are no  dedicated servers,a lot of bugs,unbalanced weapons and worst of all the game is filled with hackers who use aimbots,wallhacks auto fire etc........save your money and buy something else.;hacker city
6;219.0;1.0;5.0;"If you play PC games because you love the PC game experience, FORGET IT!  This game is nothing more than the consolization of the CoD franchise.  PC's are NOT consoles and games should not be moronified (i.e. dumbed down to the console players mental level).\n\nThe multiplayer sucks ass and is completely unplayable unless you've had the opportunity to play the game from the early beta stage. They advertise their console-crack-smoking game-finder crap as the end-all be-all of anti-cheat.  HAH!  As a private, I'm constantly pushed to games dominated on one side by generals, while the other is all lower-ranked enlisted.  WOW! FAIR GAME!  Add to that the constant server-glitches, hackers, and cheats that supposedly ""Don't Exist"" on IWN - BAH!\n\nAdd to that the constant spawn-pwnage and sniping.  This game is no fun at all unless you are ALREADY a high ranking player (which you aren't if you are considering buying this game), or really, REALLY enjoy constantly getting spawn-raped.  I know that's what *I* asked Santa for!\n\nAs a long time CoD fan, as far as I was concerned, this franchise was close to dead after MW1, but I wanted to give it just one more chance. Foolish me.\n\nI wasted $50 on this game so you don't have to.";OMFG!!!  STAY AWAY!!! THIS GAME REEKS!
9;220.0;1.0;5.0;"I have two sons who really got into ""Call of Duty 4"" and have been looking forward to ""Modern Warfare 2"" for the last few months.  They only get to play on the weekends.\n\nChristmas morning comes and they were disappointed within just a few hours.  By the end of the day they were back to playing ""Halo,"" and ""IL-2 Sturmovik 1946"" WWII flying games.\n\nWith the software restrictions I was going to purchase a second ""Modern Warfare,"" so they could play each other, but with the lack of enthusiasm hitting so quickly... what's the point?  I'm sure they'll still play Modern from time to time, but I bet they'll go back to ""Call of Duty 4"" three to four times more as ""Modern Warfare.""  A disappointment in my wallet... and for my kids.  What a drag...";Not Worth $60
11;221.0;1.0;5.0;I bought this game for PC, when already owning the PS3 version, so I could play with some friends online. There are way too many hackers online in the PC version. I didn't mind the no dedicated servers, but this totally ruins online multiplayer. Valve Anit-Cheat does absolutely nothing. I also hate that this is the only PC game that came out at $60 and they clearly didn't put in dedicated server support so they could better sell DLC. STEAM OR INFINITE WARD PLEASE DO SOMETHING ABOUT THE HACKERS!;Too many hackers online
16;222.0;1.0;5.0;Let's start off with the nice $59.99 price tag. PC games are $49.99 tops. This game is $59.99. They knew it would suck, so they charge the fans of the series more. Hint hint.\n\nAs for gameplay, you'd better be off with COD4MW1 or CoD5WaW. Those are much better than this overpriced underpar substandard reiteration of CoD4MW1 they call a standalone game. An utter disgrace to the company. Will never in my life purchase a game in the CoD series, and will carefully scrutinize every single game released by Activision before buying. (Probably never)\n\nAnd I thought VALVe was being lame with L4D2 a year after L4D1. This game makes L4D2 look like a great buy.;"Dissapointment; worse in the series"
