Model ranking;ranking;ind;relevance;review
0;382;362;0.5802176662060541;husband love mattress topper much difficult get bed morning topper made aging mattress feel like new one comfortable wearing well order another one bed guest room
1;367;340;0.5024801604748123;bought topper grand children bed spare room hard mattress wanted make comfortable want buy new mattress cost much used much feels like sleeping cloud fully recommend topper quality price worth
2;344;309;0.49785334787262137;comfortable worth money slight smell disappeared shortly unwrapping mattress 3 1 5 mattress may however superior overly soft bed n nas bonus use memory foam mattress camping far superior air mattress
3;51;120;0.48634240000248186;well worth price 87 79 free shipping love 3 inch thickness product outstanding never slept well back support excellent using product 5 days find sleep pattern get interrupted night impressed product buyers say comfort factor 10 ordering another one finish review way price value ca beat checked similar pads walmart quality thickness price could compare product pad fits full size bed really well regular mattress protection pad fit mattress topper regular mattress without problem sleep important buy product
4;453;379;0.44340529630853287;bought cover uncomfortable dorm mattress made bed much comfortable much better buying whole new mattress
5;290;448;0.44051968541228703;bought top older pillow top mattress comfortable memory foam mattress comfortable college age granddaughter living us go school happy new mattress
6;379;359;0.42703919159148707;foam topper awesome turned sofa bed comfy bed springs back
7;21;458;0.42294028389916755;purchased mattress topper daughter christmas gift used free shipping option received expected daughter says sleeping topper like sleeping heaven data hook product link linked class a link normal href 3 3 cloud9 full double 3 inch 100 visco elastic memory foam mattress topper dp b0017zv7j0 ref cm cr arp d rvw txt ie utf8 3 3 cloud9 full double 3 inch 100 visco elastic memory foam mattress topper a
8;176;80;0.4171695165137699;rented apt staying town work 3 nites per week bed full mattress memory foam bed home mattress cold hard foam great price warmed bed gave foam exp home thanks
9;92;265;0.4062742237280064;topper excellent value get price turned overly firm mattress pillow top would highly recommend anybody needs little comfort bed loved much bought another kid bed
10;118;212;0.38738102671340385;bought mattress pad cover together fouton mattress make greats nights sleep
11;214;116;0.3823433888365903;best memory foam mattress cover market live college apartment roommates neighbors mattress pad anything comfortable 3 3 cloud9 initially bought 100 mattress pad thought good mattress pad slept roommates 3 3 cloud9 great deal
12;191;94;0.3420904794053683;bought dorm bed daughter loves great comfort great night sleep
13;114;208;0.3280101906601258;great addition mattress wonderful sleep easy store say great
14;192;95;0.324567589768553;definitely made bed comfortable
15;166;66;0.3098898934004561;added mattress good quote like
16;175;79;0.3071358145722703;perfect fits bed like charm incredibly soft sink bed bed hard got one look forward going bed back feels good mornings
17;68;40;0.2960013892364469;nice mattress pad
18;429;420;0.2932535142459255;advertised quite comfortable cut fit single bed problem extra make dog bed
19;171;73;0.26666097665928423;enjoying mattress comfortable complaints
20;57;26;0.26349841644306105;product great qualities accompanied couple nagging problems despite problems product would recommend anyone looking average mattress topper comfort adds average price 72 49 n nadvantages nto start product served main purpose adding additional comfort bed found rotating pad washing sheets increases comfort durability holding weight sleep important aspect larger person another great part product slide around stay place getting bed positives make product good purchase n ndisadvantages nhowever mentioned already nagging problems necessarily take away overall product expected first thickness pad require additional purchase mattress pad cover accommodate extra three inches thickness also pad make sleep hotter summer extent would get uncomfortable used sleeping temperature set around 65 even temperature raised still able sleep comfortably anyone enjoys cooler sleep fine product despite added heat summer n nrecommendation noverall product performed exactly expected give 4 stars comparison higher quality much expensive substitutes would recommend product anyone needs extra comfort mind little extra heat summer months
21;140;246;0.26315279719798434;comfortable love even woke morning back back pain could never old memory foam odor minimal dispersed quickly also gained proper size quickly impressed memory foam honestly recommend
22;170;71;0.2626315776697143;happy product would highly recommend pillow top gave bed extra softness looking
23;373;352;0.260892229481125;soft comfortable said would great price great value m sleeping much better
24;174;78;0.259392923949778;awesome made bed comfortable
25;165;65;0.2575804484046081;topper comfortable rejuvenated too firm mattress held quite well i suggest sturdy mattress cover pets sharp claws
26;212;114;0.2515285741782575;arrived described using futon mattress comfortable
27;78;46;0.24578204939437553;ordered year ago majorly improved sleep still quality product
28;352;320;0.2437615670194084;student budget topper great arrived exactly supposed could wait sleep seller also called let know topper delivery consistent great buy highly recommended plus even though let air use odor first took box great buy
29;390;370;0.2434627428435936;bought 2 great reviews great price super comfortable highly recommend
30;82;53;0.24123487756373008;get thing sale good nspending 60 70 bucks worth 378 worth mattress 18 years old soon put felt brand new nneutralize smell air freshener odoban eliminates problem right away nalso give pad hours lay flat mattress puff back up n nthe shipping also incredibly fast arrived week estimated delivery date ni highly recommend
31;64;37;0.2405247253029608;purchased uncomfortable mattress improved quality drastically recommend someone looking better nights sleep
32;172;77;0.23727347365161008;bought 9 year old jealous expensive foam topper one exactly one bed money
33;209;111;0.23644746427733104;made bed place zen
34;149;54;0.23488961893412924;good product comfortable expect dense picture
35;229;131;0.23230351439481042;needed bright white memory foam covered quilted mattress cover target
36;282;182;0.21477827430392193;good price good quality like using 2 weeks worth buying
37;66;39;0.21384973069207538;absolutely love mattress topper worth money
38;79;47;0.20961725582450014;memory foam topper turned guest bed new cozy topper made hard lumpy disappear
39;266;164;0.2077326406829182;guests reported topper extremely comfortable slept well
40;164;64;0.18655103574257442;took package let puff overnight slight smell almost like vanilla candle scent strange know better strong chemical smell putting daughter bed tomorrow far looks great great value since hunks foam pricey stores feels like hold well
41;225;127;0.16664041788051023;love love love cant sleep without
42;148;52;0.14525460784051256;made bed like new happy
43;133;29;0.13153805490049505;made mattress much comfy
44;184;85;0.12616443633732685;could ask better nights sleep
45;27;9;0.10041928905068677;soooo comfortable makes way hot middle night wake middle night sweating and or dying thrust mornings feel yucky get shower hate take cost burning hot sleep either super bummed
46;154;57;0.09698572899377439;year still great condition wish would gotten thicker one
