Model ranking;ranking;ind;relevance;review
0;48;147;0.43590637505786944;n t buy yet feeling ll receive one birthday may 12th heard really good stuff ca n t wait n t get birthday ll get one believe moron give one star review reviews stupid
1;118;67;0.4128484163948502;flashlight n t says like battery
2;98;16;0.372677996249965;money really good quality flashlight well made easy use best thing light output highly recommended
3;46;74;0.37174593822637453;flashlight worked fine received put glove compartment car first time took use battery dead discolored would take charge ca n t find replacement battery s
4;4;133;0.3559342484071871;n t buy trash hardly brighter give away free flashlights harbor freight receive n t even open refund total rip
5;78;63;0.30670825096956283;fwiw first believe 1 star amazon reviews uncle bought appears shadow hawk 800 via late night infomercial bought 3 one work bc litium battery bad contacted company said sending replacement nthe two awesome 800 lumen mega bright heavy metal tactical flashlights come optional 3 aaa battery pack 2nd battery option use lieu lithium battery even flashlight bad lithium battery worked alternate 3 aaa battery option neveryone s seen like damn makes wonder seller selling original product 5 stars thus far update failure obviously something since many 1 star reviews n t know s 2 cents got gift perspective may little s sturdy heavy 800 lumen high grade bad ass flashlight 6 flashlight maybe seller swapping real shadowhawk substituting piece crap guess something make sense d still wary 3am infomercial products even though uncle received high quality product good luck
6;102;21;0.2927700218845599;bought 2 still works well highly recommend
7;86;28;0.25000000000000006;love flashlight everything need recommend everyone
8;84;10;0.24174688920761409;love actually ordered one uncle liked mine loves best flashlight ever
