;ranking;overall;vote;reviewText;summary
139;172.0;4.0;7.0;"Okay, I will probably never watch this with the English dub, so I have nothing to add in the never-ending debate between the quality of the Disney vs. Fox dubs.  That said, I do have a few things to say concerning the Disney version (and watching it in Japanese with English subtitles).\n\nPros:\n1. I commend Disney for NOT adding extra dialog during the many quiet moments.  As someone said, Miyazaki films (and many Japanese animations in general) make good use of quiet moments, and they should not be ruined with dialog that's not supposed to be there.  (I hope the dub doesn't add dialog either.)  And I like that the sound effects (like laughing) aren't needlessly translated.\n\nCons:\n1. This first is the greatest ""Con.""  During the opening and closing songs, there's no English subtitles for the song lyrics.  Instead, there's only a translation of the credits.  Why???  We're missing two very nice songs that help introduce the movie and gives a nice summary of Totoro.  In comparison, who cares about the credits?  Does the special feature ""Opening and closing animation without credits"" include English subtitles for the song lyrics?  You'd hope so, but they don't!  Even when you turn the subtitles on, it doesn't display anything... even though there are no credits to translate.  Of my 3 complaints, this is the worst one, because it takes away from the intro and denoument.  Some of the ""magic"" is lost.\n2. The ""anamorphic widescreen"" is cropped on the sides and a little on the bottom.  I have a Chinese (or Japanese?) version that has a fuller picture.  Even though I haven't watched that version in over a year, when I watched the new Disney version for the first time, I could already tell it was missing some of the picture.  The image seemed claustrophobic.\n3. This one's more a matter of personal preference, but the subtitles cover up the beautiful animation.  In some scenes, the subtitles cover up the main characters, obscuring the ""action.""  Granted, this may be intended for those with widescreen TV's, but I prefer them in the bottom black bar.  I can move the subtitles lower using my DVD player, but I can't on my laptop.\n\nI really love this movie.  It's a great film with great imagery and characteres.  I'd give the film 5 stars, but the DVD I can only give a 3.  So the average is a 4.\nWhy can't Disney or someone put out a version that doesn't mess with the content?  (The problem with the Chinese/Japanese version is that extra dialog is added where there is no original Japanese dialog.)";For those looking for: Japanese with English Subtitles...
141;173.0;5.0;7.0;"As an exchange student to Japan, I saw Totoro in Japanese years ago and loved it.  When I had this chance to buy the DVD for my girls (ages 2 and 4), I didn't hesitate. It is one of those shows that children adore.  My husband and I enjoy sitting next to them and being a part of the magic.  (You can't say that about all children's movies...)  My girls aren't big movie watchers- the four-year old deems most Disney movies to be too scary to watch.  But Totoro is different.  They love watching Mei land on Totoro's chest, and the cat bus is fantastic.  They also march around the room during the part where the girls try to get the acorns to sprout.  Although we were concerned about it, it doesn't bother them one bit that Satsuki and Mei's mom is in the hospital for the entire movie. Another neat part about the show from a parent's point of view: older sister Satsuki takes care of little Mei and her Daddy during the movie- she makes lunches for the family and holds Mei at the bus stop.  After we watch the show, my older daughter always wants to ""be like Satsuki"" by helping out around the house and fussing over her little sister.  We've bought it several times as a present.";Pure Magic for Kids and Parents- Satsuki's a good sister!
145;174.0;3.0;7.0;"Like several other people, I grew up watching Fox's version of Totoro. I've also lived and went to high school in Osaka for a spell, and have watched the original version on several occasions.\n\nThis has been one of the most magical movies in my life since I was younger, and I'm thrilled that Disney decided to release several Miyazaki/Ghibli movies.\n\nSo far, Disney has done wonderfully in my opinion, with other voice-overs of these films and with preserving the overall feel that the movie was originally supposed to have.\n\nThey had quite a challenge, however, following the magnificent job that Fox had done years earlier.  A lot of ""diehard fans"" may or may not argue that Fox did a good job- I loved it because while some things may not have been directly translated (the opening theme), the overall feeling of the movie stayed the same and the voices fit wonderfully with the characters. Totoro is a kid's movie- it always has been and always will be, so I believe that it should be presented as such... it just happens to be a kid's movie that has a little magic in it for people of other ages, as well.\n\nThe voice acting in this version is well done, as is the translation job of course (this -is- Disney), but to people who are used to either hearing the original movie or the Fox version, a little something new might come as a shock to the ears.  It is still a perfectly wonderful version, but I have to wonder if the voice actors they chose were the best choices they could have made.  I don't say this often, as people like Kirsten Dunst who did an -awsome- job with Kiki are certainly suited for the job, but I wondered if Disney didn't just pick people for their star names, instead of how well they did in their roles.\n\nI'm not saying that anyone performed badly, but I think that there are several other people out there with more (or maybe none) experience in voice acting that would be able to handle the voice-over job in a way that would fit in more with the movie.\n\nThe girls, of course, sounded good acting wise, but left a bit to be desired.. too often did I feel like they were too disconnected from the movie and what exactly was going on, and just ended up reading the lines well and not trying to fit what they were saying into the big picture.\n\nIf you pick up this movie, I recommend also trying out Fox's version as well- it's worth it to watch.\n\nI appreciate Disney for translating these wonderful movies, and they do an excellent job- I just hope that they are a little more careful in choosing stars as voice actors- sometimes it pays to pick a cast with a little more experience or skill, but less fame.";A little bias may play into how one might view this movie.
147;175.0;1.0;7.0;I have to agree with just about every other reviewer of this DVD. My brothers and I grew up watching the original Totoro dub by Fox and we still love and enjoy it. However when we watched the new Disney dub none of us could sit through it, the voice cast was extremly uninspired and monotone--only the two parent voice overs Lea Solanga and Tim Daly did an admirable job. It is really unfortunate that Disney could not improve on the original.;New Dub Un-Listenable
151;176.0;3.0;7.0;"Disney continues its lack of respect for Studio Ghibli's wonderful material. As a company that only sees ""product,"" My Neighbor Totoro doesn't get the attention it deserves. (It deserves a theatrical re-release, actually, but I digress). Dakota Fanning and Elle Fanning do their jobs, but they are not better than the actors in the Fox version. Professor Kusakabe, the father, is given a lesser performance, as is the grandmother.\n\nI was also vaguely disturbed by the music, which sounds different to me in small ways compared to the Fox release. Jo Hisaishi's terrific score deserves loving care.\n\nThe positive here is that the visuals are better.  I was glad for the wider format, and the colors were more vibrant, closer to the amazing color of Spirited Away, the best colored animation in many years.\n\nI wish I could show this version with the Fox soundtrack.";A step backward in the performances
154;177.0;5.0;7.0;"I only recently discovered My Neighbor Totoro when I imported the Japanese DVD. Now, I am one of the people who at home prefers to watch dubbed anime. If I'm at the cinema I'd prefer subtitles, but when I'm at home and have other things fighting for my attention, watching the dubbed one doesn't seem like that bad an idea.\n\nThe Japanese DVD has the 1980s Streamline dub on it, which I thought was very good. So when I bought the American DVD (which has far better picture quality), I was expecting the worst of the new dub. After wincing at the newly dubbed song at the start, I actually said, ""Wow, this is ten times better"". And it stayed that way throughout the film.\n\nI honestly don't know what some people hate so much about this dub, I think it's great. Little details of the story seem to make more sense now than they did before. So go in with an open mind, I personally think Disney did a great job on this one.";What's wrong with the new dub?
89;178.0;3.0;6.0;This is one of our all-time favorite movies.  My kids grew up with the original VHS version.  The three stars were given because this is NOT the same version that we remembered and although we love the movie, we hate this version.  This version has different voices, some different music and even different spoken lines in some places. We were very disappointed with these changes.  After doing some research, we realized our mistake.  This DVD version is different because it was put out by Disney whereas the original was put out by Fox.  Apparently, there are two versions of this movie and we prefer the Fox version much better.  Even though the Disney version has the celebrity voices of Tim Daly and Dakota Fanning, it lacks the quirky joy of Hayao Miyazaki's original version.  If you are a fan of the original english VHS version, be sure to look for the Fox version!  Now we have to purchase the Fox version and find a way to sell the Disney version - Bummer.;Buyer Beware - NOT the same video as original!
160;179.0;5.0;7.0;"CAVEAT:\n\nAs a first-time watcher, I can't compare the 2 English dubs. The 2006 release with Dakota Fanning seemed perfectly natural to me. I have no complaints, which I know is unpopular these days. Now with that out of the way...\n\nREVIEW:\n\nThis is a wonderful, magical movie. My Neighbor Totoro (MNT) shows life in Japan in the 1950's from the perspective of 2 likable sisters, ages 10 and 4. Their Mother is in the hospital, and the whole family harbor silent fears that they'll lose her, so they show those fears in different ways. The portrayal of this family is believable, and multi-dimentional.\n\nThe magical element to this film is added when forest spirits (soot sprites, Totoro and his family) are discovered by the girls. What amazed me the most about this movie is it's portrayal of magic: How 'un-Disney"" it is. There's no Pixie Dust, no chimes playing on the soundtrack, only a display of wonder or awe in the faces of Satsuki (the older sister) and Mei (the younger one) when they see something that's fantastical.\n\nIn addidtion, the timing of the magic is: Few and Far Between. While that may seem like the scenes without magic would be boring, it only serves to heighten the girls' (and the audience's) wonder and excitment when magic does occur. It is similar in pace to Kiki's Delivery Service.\n\nI give this film my highest recommendation.\n\nNOTE:\n\nThis movie is rated G, but American audiences will be surprised to see the family bathing (yes, nude) together. It's a completely innocuous scene, done with an eye to authenticity in Japanese family life in the 1950's.";A wonderful, magical, movie
66;180.0;5.0;5.0;"My Neighbor Totoro (animation, adventure, family)\nDirected by Hayao Miyazaki\nStarring the voices of Dakota Fanning, Elle Fanning, Tim Daly and Pat Carroll\n\nDisney / Buena Vista | 1988 | 86 min | Rated G | Released Mar 02, 2010\n\nThe Film 5/5\n\nUnlike most of my previous reviews, My Neighbor Totoro hasn't yet been released on Blu-ray. Disney is working its way through the Studio Ghibli titles and has released most of them on DVD, but a Blu-ray release for this particular film is likely one or two years away. While I intend to own them all on the best possible format, I just had to buy Totoro on DVD until it sees a high definition release.\n\nThis is going to be a difficult review because my love for Studio Ghibli and its worlds is hard to put into words. I'll do my best.\n\nHayao Miyazaki's films aren't for everyone. They should be, but it just isn't the case. The reason is that we in North America have come to expect a certain style when it comes to animation.\n\nAnimated movies are typically fast-paced and filled with action. They have heroes, villains, chase scenes and conflict. What's more, they are noisy. It seems that without constant action, there's a fear that the audience might become bored. This is not a criticism, merely an observation. I'm quite happy watching such things as Kung Fu Panda, Megamind, Tangled or How to Train Your Dragon.\n\nMiyazaki's films don't follow the typical Hollywood style. Until very recently, everything was hand-drawn. Each frame is like a watercolor painting and has a certain beauty. Those who only watch modern CGI animation may not appreciate the classic two-dimensional style.\n\nAnother huge difference is the pacing. Instead of constant action, you'll see occasional shots of the countryside, a stream, an animal or clouds. It's a cultural difference and reflects a society in which people are more in tune with nature and the simple joy of being alive. Miyazaki's stories unfold gradually in their own time.\n\nLike most Studio Ghibli releases, Totoro doesn't contain any villains. We are shown situations that its characters encounter and have to figure out. It works because the characters are well-defined and we care about them. We want to see how they will proceed and whether they will succeed.\n\nThe story is set in the 1950s in a Japanese village and begins with Professor Kusakabe (Daly) arriving at his new house, along with daughters Satsuki and Mei (Dakota and Elle Fanning). Satsuki is about 10 years old and Mei around 4. The sisters are delighted with their new home. Mei mimics her sister's actions and sometimes repeats what she says. I have never seen a more realistic depiction of how children think and behave.\n\nThe children are full of life and explore their new house with excitement. It's rumored to be haunted, but they only encounter soot sprites which leave at the sound of laughter. The sprites are only visible to children. Another cultural difference is highlighted when the professor shares a bath with his daughters. His girls happily help with the chores before they run off to play. This is a world in which TV doesn't exist. The children spend their free time playing outside.\n\nProfessor Kusakabe puts the girls on his bicycle and takes them to a hospital where their mother is being treated. Miyazaki's own mother suffered from tuberculosis and, although it's never stated, this is probably what Mrs. Kusakabe was recovering from. It's not typical for animated films to deal with such themes as illness, but this is a realistic world and the situation fits. They learn that she's almost ready to return home and see their new house.\n\nSatsuki cooks for the family and her father works at home when he's not lecturing at the university. It's a benign world where children walk to school without any fear of abduction or similar dangers.\n\nMei isn't yet old enough for school and plays outside while her father works at his desk. She views the world with the charming fascination of a child, exploring her surroundings and watching tadpoles swim in the stream. Then she sees a pair of white ears in the long grass, belonging to a creature resembling a rabbit. The creature scurries away from her alternating between visible and invisible. She tracks it into a tunnel formed by overhanging trees. After entering a hole in the trunk of a vast tree she emerges in a clearing occupied by a giant sleeping creature.\n\nWe are more than 30 minutes into the film before she encounters the sleeping totoro. The film takes its time and doesn't feel the need to introduce the creature from the start. It looks like a cross between a cat, a teddy bear and an owl. She prods it inquisitively and it seems unconcerned by her presence. There's no sense of danger and she simply curls up on top of it and falls asleep. Her father and sister notice she is missing and set out to find her. When they arrive, she's sleeping on the ground in the forest with no sign of the totoro.\n\nWhen she tells her unlikely story, her father and sister believe her. They accept that she wouldn't lie. It's very refreshing to see that kind of trust between adult and child. Professor Kusakabe speculates that the totoro can only be seen when he wants to be seen and that Mei was very lucky to have the chance. These simple words make her happy.\n\nThe film defies our expectations at every turn. When her father has to go to the university, Mei starts to miss Satsuki, so the old woman looking after her takes her to the school. Satsuki explains to the teacher that their father will be home in a couple of hours and Mei is allowed to stay with the older children. She feels important and quietly sits at her desk drawing a picture of the totoro.\n\nI don't want to give away the whole story, but the totoro has an important part to play in the lives of the girls. The most worrying part of the film lasts about ten minutes, but it's a realistic situation and doesn't contain any villains. Their friend the totoro is a reassuring presence and knows how to solve the problem.\n\nThe girls are very sweet, but it isn't overdone. Little Mei is probably my favorite character in any animated film. She's thoroughly adorable. Miyazaki's drawings are quite simple, but he can convey emotion with just a few expressions. He varies the size of the children's mouths and eyes according to the mood of the scene.\n\nMy Neighbor Totoro is set in a world that no longer exists. The parents care deeply for their children and the two sisters love and depend on each other. Villagers pull together in times of crisis and care about their neighbors. Children respect older people and there's no sense of danger. It's a warm and happy place to visit and I wish the real world were more like Miyazaki's imaginary ones. This is what human beings are supposed to be like.\n\nMiyazaki has a wonderful imagination and it's even more prominent in fantasy worlds such as those encountered in Nausicaa of the Valley of the Wind, Castle in the Sky and the Oscar-winning Spirited Away. All of his stories have warmth and heart. If you see him interviewed, it's apparent that he loves what he does. His enthusiasm is infectious and he smiles when he talks about his worlds. He sees things that most of us take for granted and miss altogether.\n\nI consider My Neighbor Totoro to be the perfect family film. It may also be the happiest film I've ever seen and the relationship between the sisters is wonderful to watch. They aren't constantly bickering. If Mei gets tired, Satsuki carries her. Adults treat children seriously and genuinely want to know what's important to them. In today's world, with the pressures adults place on themselves, that isn't always the case.\n\nMiyazaki has crafted a film filled with wonder and a sense of discovery. It's like returning to your childhood and seeing the world from that perspective. The expressions of concentration, determination and pure wonder on Mei's face are depicted perfectly. The film is full of beauty. I don't just mean the animation - although it is beautiful - I'm also referring to the actions performed by the people and creatures in the film.\n\nThe feelings created by the story are considerably enhanced by Joe Hisaishi's haunting score. He's responsible for the music in all of Miyazaki's films and the two have established a good understanding. The melodies seem so simple, but it's hard to imagine the film without their presence.\n\nWhile I'm delighted that Disney is releasing the Studio Ghibli titles on Blu-ray, it can't happen fast enough. Some will argue that the English dub of the film ruins the experience. The good thing about the recent releases is that the original Japanese version is included as an option. If you want to experience the film in its native language, you can now do so, with or without subtitles.\n\nThere's also a short film set in the same world; Mei and the Kittenbus. It hasn't been released commercially, but is sometimes shown at the Studio Ghibli museum in Mitaka, Japan. You'll have to reserve a ticket in advance if you want to pay a visit. It's a long trip to see a 14-minute short film, but it's currently the only way to see it. My forlorn hope is to see the short included among the special features when the film is released on Blu-ray.\n\nI would recommend Miyazaki's films to everyone, although I realize that some people won't connect with them. The potential reward is worth the time investment. If you have children, there's even more reason to give one a try. Try to go in with an open mind. My Neighbor Totoro isn't about constant action or conflict, but it's an experience that shouldn't be missed. It's closer to a film like Bambi than Megamind or Despicable Me.\n\nJust because a film is about young children, it doesn't mean that the viewer has to be a young child in order to appreciate the story. Pixar has elevated North American films to new levels over the past two decades, but I can honestly say that Studio Ghibli, and Miyazaki in particular, has produced films with more heart. They are beautiful, magical and full of imagination. These stories matter to me and I can't wait to see the next one.";He's come to deliver what you've lost
177;181.0;5.0;7.0;"Leaving questions of fidelity to the original aside, there is simply no comparison to this film for the amount of delight and wonder it has brought into my 3-year-old son's life. We're lucky enough to live next to a 100-acre wood and our walks in it are enhanced by his hopes of seeing a ""Totoro"" under every tree. Miyazaki-san is unarguably the greatest genius working in children's animation today, and his visions are both sweet and richly detailed about the complicated relationships between humans and nature, light and dark, love and fear. Don't hesitate to enjoy this film in whatever format you can find. There are some loud noises, but otherwise it's totally suitable for small children. Kids over 4 or 5 might feel some concern for Satsuki's fears about her mother, but those are put into a warm and reassuring context. The Catbus is, without a doubt, the single most enchanting creation in animation.";Totoro = love
95;182.0;1.0;6.0;This version sucks, the character voices are dubbed by different people than the original, sounds terrible. you gotta get the other one, with the different cover picture.;DUBBED BY DAKOTA AND ELLE FANNING
235;183.0;5.0;8.0;This is my first review. I was first introduced to My Neighbor Totoro about 4 years ago by a friend. It was instantly a favorite of mine and my kids. Mayazakis' attention to detail (Notice the bottle under the house with the marble stopper in it for instance) as well as the way he conveys the feeling of a hot, summer day, a late afternoon thunderstorm or a sultry full moon night, is artfully and effectively accomplished. And there's no extraneous fillers or wasted moments. This movie remains not only of my daughters favorites but their dads' as well. I'm guessing that it's resurgence in popularity indicates a re-release perhaps? or perhaps a marketing ploy...(I'd heard somewhere that Disney bought the rights. Don't know  if that's true or not)... I've seen both the Japanese voiced version and the English version and I feel the English voices were well cast. Perhaps, when I finally do get a DVD player, there'll be a letterbox version of this movie available and will be able to see the whole darned thing;All animation should be this rich!
183;184.0;1.0;7.0;Since Disney has foolishly decided not to release\n\nthis DVD, I give it zero stars.;Zero Stars for this DVD
184;185.0;5.0;7.0;"This is one of my favorite ""anime"" movies because it is non-violent and has a positive message. The characters are adorable without being saccharine, and the film has just the right amount of suspense and action to keep you rooting for them. For those of you lucky enough to live near a children's museum hosting the traveling exhibit ""Jump to Japan,"" you'll enjoy watching the effortless movement of the iconic characters that you saw life-size.";Climb Aboard the Big Fuzzy Cat Bus
