;ranking;overall;vote;reviewText;summary
174;49.0;5.0;18.0;"Forget the old FOX VIDEO DVD release (cropped & dubbed) look for this new Disney DVD release in 1.85:1 (16:9 enhanced widescreen.\nOriginal Japanese audio & new English dub, storyboards, behind-the-scenes.\n\nThis is the original edit as dictated by Ghibli Studios, not a re-edit. It has the original Japanese language tracks. Some mistake the 1980's english version as the original, it is not.\n\nThe old version is actually the RE-EDIT created by 20th Century Fox for U.S. theatrical release. At the time Studio Ghibli was eager to get their films shown in the U.S. and did not retain creative control. They really regretted this and wish to believe these U.S. edits never existed (the U.S. edit of Nausicaa was the worst).\n\nNow that their films are popular in the U.S. they are exercising their creative control and forbid Disney from altering the films. Disney was in charge of re-dubbing the English translations with Studio Ghibli's approval of the translation. The pronunciation of the names is closer to the original Japanese pronunciation.\n\nIt is doubtful that you will ever hear the old 20th Century FOX translation again on DVD/Blu-ray. 20th Century FOX no longer holds the U.S. rights to Totoro.\n\nThe cover doesn't mention any edits because it is NOT edited, the old 20th Century FOX version is the edited version that should have been labeled as such.\n\nBLU-RAY update 5/30/13:\nIf you are going to upgrade to the new Blu-ray consider how big your TV is.  If your HD-TV is not over 40"" you will not see much of an upgrade.  Studio Ghibli dictated that Disney not tamper with the film to 'enhance' it for Blu-ray.  You will get the original image on the Blu-ray, but Disney's 2006 DVD was so good there will not be much of an improvement.";Blu-ray not much of an upgrade from the DVD. Disney's DVD is Letterboxed with original Japanese soundtrack
28;50.0;1.0;9.0;"The movie itself is a 5 star film. Gorgeous animation. Simple story. Great for kids and adults. But the Disney rerelease featuring the Fanning's destroys a lot of the charm of the original. I bought the updated version maybe six months ago and we just never watched it. When we finally put it on my daughter noticed the change immediately. She hated the new voices and even the slight changes in the script (Mei saying ""She's so mean"" instead of ""I'm not stupid"" etc.). It was distracting and just ""off"". The original dub track was so perfect it didn't even feel like a dub track. I'm sad that Disney (who I've been impressed with on other rereleases) has mangled a classic so horribly. There is no updated voice that I prefer in any way over the original.\n\nNow I'll have to head over to Half-Priced Books to try to find the old DVD copy that I sold back.";The movie is a masterpiece, this rerelease is not
41;51.0;1.0;10.0;I really wish I had read the comments before I bought this. Let me start off by saying this has been one of my all time favorite movies since I was a small child. I already have this movie on a really old VHS tape, so I wanted to buy the film on DVD. Well, turns out they re-did it for Disney. It's not the same! I just opened it to watch it, and the dialogue and characters are totally different. I'm sure it would be fine if I had never seen the other version, but I have, and it holds some sentimental value to me, so I was highly disappointed.;READ BEFORE YOU PURCHASE
148;52.0;2.0;17.0;"My daughter and I have been watching My Neighbor Totoro for years. We loved it, and even though we've seen it about a million times I have yet to feel like I have watched it too much. I love just about everything Studio Ghibli has put out. I am very happy that I have the old Fox version. It will continue to be the version watched in my home since it has the dignity that I believe the original My Neighbor Totoro has. Put more bluntly, you'll get the Fox version from my cold dead hands.\n\nThis Disney dub is very disappointing.\n\nThe first thing that I've noticed is how much of the reverence for nature has been stripped out. It's lost most of the magical beauty that was in it. The Fox version may not be as visually stunning, but the translation is so much better, as is the voice acting. This dub took me back to the bad old days of dubs when the lip movement did not even come close to the voice over. It's also been very Americanized. One example would be when Mei finds the bottomless bucket and calls it ""stupid"", as if it were now useless. In the Fox version she simply says ""It has no bottom!"" in wonder. Children can find so many different uses for things most adults can not. It's part of the wonder of childhood, and that wonder is normally very well expressed in Studio Ghibli films. In hearing the translation differences between the Fox version and the Disney version I wonder how badly mangled other Disney dubbed versions of Ghibli movies are.\n\nMy daughter pointed out each and every time when something was different. In our family we have used the illustration of when Satsuki calls Mei ""stupid"" for why we never should call people stupid. In the Disney version, that lesson is totally gone. The Disney version also dumbs down the English vocabulary. In the Fox version the word ""pollywogs"" is used rather than ""tadpoles"" in the water. It's an old term for tadpoles and I was just plain ecstatic about the ""big words"". I love in Kiki's Delivery Service that the word ""dirigible"" was used rather than ""blimp"". Neither of these words are too hard for children to learn or say. My daughter was two when we first viewed each of those films and saying both words and knew what they meant! If you asked her if she wanted to see a tadpole she'd look at you blankly, but ask her if she wanted to see a pollywog she would light up!\n\nThe ""special features"" on the Disney DVD don't make up the cost of this film. The features amount to one whole DVD with the original story boards set to the *new* dubbing, a ""behind the scenes"" of the recording of the Disney dubbing, and an un-restored trailer for the movie. Oh, there are ads too. I do so love to buy ads.";Pretty is as pretty does
63;53.0;1.0;12.0;First off I want to say I do not hate Totoro, I hate what disney has done wit it. Now if you are looking for a wonderful story about a loving family who are separated by unfortunate circumstances and then reunited in the end, then this is not the DVD for you. Yes it is still the same basic story line, and yes it is still the same basic animation. However disney has ruined it with their new voice actors and remastering. If you truly love the work of Miyazaki then find yourself the original VHS version of this film and buy that. Dakota Fanning and her little sister need to stay away from anime and the classic works of a great artist and writer. As for that disney needs to stay away from anime, they already destroy every day animation leave a beautiful work of art alone, I mean have you seen the recent releases from disney? My six month old nephew can draw better than that and come up with a more compelling story line. Totoro is a wonderful story about a family separated by their mothers sickness and the wonder of childhood, it is a beautiful, timeless story. I grew up with the works of Miyazaki, I came to love anime because of Totoro, Spirited Away, Kiki's Delivery Service and Miyazakis other works. My little sister bought this from costco and when she brought it home we were expecting it to be the story we had come to love so much when we were children. But that's not what we received, this is an atrocity an absolute atrocity that disney is aloud to do this. If you truly love anime and love Miyazaki and his works then please do not buy this, make sure you check the actors check the case get as much information as you can before you buy. You do not want to have your heart broken like me and my little sister did. we are desperately searching for the original we have on VHS and I urge anyone who has the original to hold onto it and cherish it like it deserves to be cherished.;Please read before you buy
23;54.0;1.0;8.0;This movie was a waste of money!  I have been watching this movie for 15 years and this one movie I bought off here the voices and names in the movie r different it is in no way original!;This movie was a waste of money
73;55.0;5.0;13.0;I notice a lot of the reviews are calling this version of the movie fake, a horrible remake, or some other strange nonsense. This is the actual 1988 film by Miyazaki, and features both the original japanese audio as well as the english dub with Dakota and Elle Fanning as the two sisters. I've never heard the prior English dub so I will not comment on it, but if you don't like the english dub, then switch over to the Japanese with the subtitles. It's pretty simple.\n\nI think the movie is amazing in its own right and has more than enough charm and character to make up for a simple plot.;Note on negative reviews
199;56.0;1.0;18.0;"My original review is below (at the bottom); unfortunately, all versions of a product are related (as far as Amazon is concerned), so a new review I wrote for the 2-disk version was rejected.\n\nInstead let me modify my existing review:\n\nMany of the reviews now associated with the upcoming release of Totoro are actually talking about the old--bad--Fox release.  Don't let this fool you.\n\nThe 2-disk WIDESCREEN edition is a Disney--not a Fox--release, so chances are (and previous releases in this series are a good indicator) this will have both dubbed and Japanese language tracks.\n\nDisney has done wonderful job with other Miyazaki films, and I have no doubt this will be the same.\n\nThis will be the definitive Totoro release, and WELL worth purchasing.\n\n* * * * *\n\nOld Review (single disk, Fox)\n\nWhy does everyone keep knocking Disney for the poor quality of this DVD when Fox (not Disney) has the U.S. rights to the Totoro?  You should be *grateful* to Disney for bringing so many wonderful Studio Ghibli films to the U.S. -- and they've done an absolutely wonderful job with Kiki and Spirited Away, etc. (and will, I imagine, continue to do so with future releases of this sort).\n\nTotoro is a terrific movie, but a terrible DVD.  If you don't like that, write to the people at Fox.  And stop beating up on Disney.\n\nI'd love to see a special edition of Totoro with Japanese language track, letterbox, etc., but it's not going to happen if fans keep grumbling at Disney -- who has nothing to do with this current version.";Blame Fox, Not Disney
25;57.0;1.0;8.0;Though the seller was awesome, this version of Totoro is clearly not the version I used to have.  The original English version had much more feeling to it.  This redo with the Fanning's is not pleasurable to watch at all.  It lacks the heart that the original had.;Though the seller was awesome, this version of Totoro is clearly not the ...
40;58.0;1.0;9.0;"I bought this movie, super excited to share it with my son. Growing up, I LOVED this movie, and I couldn't wait to see it again. I put it in my PS3 and got excited to sing the intro song...when I realized it was different. I assumed it was just a newer change and didn't let it bother me too much...until the dialogue for the movie began. ""Hello there! Looks like we're going to be neighbors!"" translates into something like ""Hi, we are the whatever family. We are moving in next door. You have beautiful property. You should come over for dinner sometime so we can get to know each other. It was nice getting to meet you. Farewell."" This is not verbatim and might be slightly over-exaggerated, but still, it is RIDICULOUS! Why did Disney take a wonderful classic and ruin it with their garbage translations, new music, and sound effects?!?! They even changed the sound of Totoro's yawn? WHY??!?!?!?!?!!! I was so upset I traded this in and purchased the original copy. Don't buy this, unless you enjoy watching garbage. Shame on you Disney!";This is NOT Totoro!
169;59.0;1.0;16.0;I am the biggest fan of both Disney and Hayao Miyazaki so I really am struggling with writing this bad review but hey you people have to know before you buy. This version of Totoro really stinks!!!! Almost to the point of ruining the entire film for me. I couldn't suffer through it when the movie premiered on TCM. Let me explain there was a previoulsy released edition that was put out by Fox which is the best. The english dubbing on the Disney version is horrific. The characters are so off from the original release. Please if you are considering adding this dvd to your collection go with the original fox edition. You are missing out on so much of the movie if you only see this Lame version put out by Disney. I'm sorry to be harsh but Disney really let us down with this english dubbed version of Totoro.....;Why did they have to mess w/ a good thing? Buyer Beware!
27;60.0;1.0;8.0;"Disney ruined this all time classic by recasting for the voices of all charcters. Originally released by Buena Vista now known as the Troma edition, which had and unknown cast of voices which added depth and feeling to the characters that Dakota Fanning and Lea Salonga just can't replicate. They also ruined Kiki's Delivery Service to the point of making me feel sick and sad. Everyone who grew up with the VHS only wanted it to be on DVD without one thing changed. There was really no need for a Disney to recast Tottoro with soon to be unknown celebrities. This is just another case of ""if it ain't broke don't fix it!""";If it ain't broke don't fix it
42;61.0;1.0;9.0;I should have read the reviews below before buying it. Not the original English dub. Would not recommend it unless you want the Disney version;Not what I expected
30;62.0;1.0;8.0;THIS IS THE DISNEY VERSION AND THEY LEAD ME TO BELIEVE IT WAS THE OLDER VERSION WITHOUT DAKOTA FANNING'S VOICE. THE PICTURE WAS DIFFERENT AND EVERYTHING. SO FRUSTRATED;THIS IS THE DISNEY VERSION AND THEY LEAD ME TO ...
12;63.0;1.0;6.0;I LOVE this movie. The original audio version that is. What they did with the voices now, its HORRIBLE! Anyone who has seen the original version of this movie (what I grew up with) will know what I'm talking about. This version is painful to listen to-- and the way they pronounce a good number of the names, it's atrocious. The new actors have no idea how to pronounce several of the Japanese names. I couldn't even watch the whole movie because of how bad a job they did.\n\nI bought this blu-ray/dvd combo with high expectations, but all I got was disappointment. I do NOT recommend this movie to anyone who was a fan of the original audio version. For me, this was a waste of money.;Love the movie, hate the new voices... Not worth buying if you're an older fan
13;64.0;1.0;6.0;My daughters loved the original release of this, with the darling, sweet little voices. Then I bought them the DVD and they absolutely hated that the voices had been changed to American actors with 'regular' voices. I thought it would be awesome to get them an original version for Christmas. Found a listing and scoured the description to make sure there was NO mention of Dakota Fanning since she is part of the reworked audio.  No mention of her, or any other Western actors, so I assumed (yeah I know...) it was the original version. Used, so I thought that was a positive that it could be older version also. Bought it. SO excited!!! The disc arrived quickly! I popped it into the player..... Nooooooooooo! The voices are the reworked ones What a let-down, and waste of money. I don't blame the seller. There was no indication of the change anywhere on the outside. Not even it the fine print. It's going to Goodwill this afternoon. Make sure you know what you are getting if you buy a copy of this film!!!;My daughters loved the original release of this
188;65.0;2.0;16.0;My short review is not about the film itself (which is absolutely brilliant and highly recommended), but about this DVD:\n\nPlease be aware that:\n1) The DVD has been transferred from video and not from the original film, and thus lacks the possible DVD-quality (when played one picture at the time the video-source becomes perfectly clear, rendering fuzzy and double pictures)\n2) The dubbing is ENGLISH and there is NO option for to play the original Japanese, nor are there any subtitles (not even for the hard of hearing).\n3) There are NO extras whatsoever.\n\nThis should not discourage parents to buy this DVD as an excellent film for their (English speaking) children, but animation film lovers who buy this DVD will be utterly dissapointed that they cannot enjoy this film in its original glory (at least I was).;2 stars for the DVD of a 5-star film
218;66.0;2.0;17.0;When I saw the US premiere of Spirited Away I was thrilled to hear the Gibli studio representative tell us that all of Miyazaki's movies would be released in the US within the next two years.\nDisney studios (since they apparently feel the need to control all feature length animation in the US) was to handle the distribution.  Apparently, like the fable goes, once they had it they didn't want it anymore and sold it to Fox to do with what they would.\nWhat they have done, and this won't be news if you've read some of the other reviews here, is to release a very inexpensive product, but you get what you pay for.\nSpecifically, pan and scan instead of widescreen and English dub only.\nIf you are looking for a nice movie for children, and you are not familiar with Miyazaki's work, this version should be OK.\nTo most adults my advice is to get yourself to your nearest search engine and find yourself a widescreen version with a Japanese soundtrack and English subtitles.;good movie, bad DVD
22;67.0;1.0;7.0;Disney version is not the original dub and even the original song was incorrect. This was the first movie I ever saw as a child. I definately wish they would have kept the original dub. Not the same. I bought it, my mistake, saw the first 2 minutes of the opening. Not going to be watching it again. I still have the VCR version and a VCR will use that to watch the ORIGINAL version.;Disney version is not the original dub and even the ...
79;68.0;1.0;12.0;I happen to really enjoy My Neighbor Totoro, so when I bought this DVD I assumed it would be the original and just be released by Disney...wrong! This movie has been Americanized so bad that you can barely get into it, even though it has the same storyline the voices doesnt match anything going on within the movie. If you can find the original, I say go for that one and leave this one behind...Thank You Disney!;Disney Messes With EVERYTHING!
35;69.0;2.0;8.0;This made me so sad. My children and I are huge fans. I bought this to share with our newest edition our 2 yr old son. My 17 year old daughter noticed right away the errors in the cover art. It should have been a warning. This has a voice over remake. Ooooo soooooo much is lost in translation with the new actors. My eyes actually got watery because it felt like something sacred was butchered. Its dulled down. So heartbreaking. If you are able to obtain a copy if the original English version before Disney took over a redid the voices please do. It's the true Totoro in my opinion. This. Is like someone painting a smile on the original Mona Lisa.;omg no!!!
166;70.0;2.0;14.0;"First things first... I see a definate division in the reviews for this new set.  It gets high marks from people who haven't seen the Fox dub.  It is lambasted by those who have.  So if you haven't seen the Fox version, you will probably be fine with the Disney dub.  Unfortunately I have the Fox version and think that it is a masterpiece. I only wish there was a widescreen version of that dub.\n\nNow, down to business: Why create a two disc version of a DVD when the movie and extras can fit on one disc? Di$ney a cra$$ corporation looking to make some buck$? No! Never. Say it ain't so!\n\nI give this 2 stars simply because it is Miyazaki, and his films in the Western world should be preserved on DVD, even with poor dubbing and pitiful extras.  The one good thing about it is that it's widescreen and in the extras; the storyboards. But the really laughable feature is a behind the scenes of American actors who can't dub to the animation which is awful to say the least.\n\nThough it is not widescreen, I suggest that if you are looking for a nice DVD version with a DELIGHTFUL English dub, hunt down the out of print FOX DVD. A good English dub of Japanese anime is absolutely RARE and this is one of the few shining examples of a perfect dub.\n\nAs for interpritations of ""Susuwatari"" within the story, I can't bear the idea of the girls yelling ""soot gremlins"".  ""Dust bunnies"" is waaaay cuter and fits much better within the confines of the story.  THAT is one of the elements that makes the Fox dub so enduring, they understood what CUTE was in relation to a very cute and sweet movie.";Ham handed Disney dub and sparse extras
173;71.0;5.0;14.0;This is a wonderful film that everyone will embrace. The characters, especially Totoro himself, are beautifully drawn and charming. The story is endearing and joyful. This is my second favorite animated film. (All dogs go to Heaven is my first). If only more children would watch these kind of films instead of raunchy trash like Scooby-Doo One, The Cat in the Hat, and Rugrats Go Wild. Unlike Totoro, these kind of movies completely resort to potty humor and have no gentle tone or magic. While films like those be long forgotten, Totoro will go on into the hearts and minds of all film-lovers forever. It is a masterpiece...pure and simple.;A delightful, touching, timeless classic
8;72.0;1.0;5.0;I have seen the ORIGINAL My Neighbor Totoro from 1993 and LOVED it, if I could give it more than 5 stars I would.\nThe voice actors with Lisa Michelson and Cheryl Chase as Satsuki and May were superb!\nBut sadly I have to give this newer version 1 star for its horrible choice of voice actors.\nI am very disappointed in the choice of cast for this movie because their voice just don't FIT the film. Especially the voices of the girls, the Fanning Sisters just were not the best choice. It ruins the experience of a film I have known and loved and makes it less enjoyable.\nAgain I am only giving this CURRENT version a 1 star.;The original 1993 version is 10 times better!!!
80;73.0;1.0;11.0;"I loved the Fox version of this film; it was absolutely amazing. I always watched it as a kid, and I still do. When I bought the Disney version, I didn't know there was a difference. As I watched it, I noticed something was wrong; the voice actors were completely different. Disney completely ruined the movie by doing this. The sisters sound exactly the same (the idiots chose twins to revoice-over the movie) and the father sounds plain. In fact, most of the voices sound as though they threw together a bunch of random people with no experience, handed them scripts, and told them to voice their parts without any practice. The Disney version was very poorly done; I highly recommend the Fox version of this movie for the full experience.";Original version is amazing, but Disney is crap.
115;74.0;5.0;13.0;"First of all, I am a purist when it comes to Japanese films. I have three versions of ""My Neighbor Totoro."" The original in Japanese, without subtitles, the Fox version, and the Disney version. I would recommend viewers to just get the film, it's well worth the watch. I bought the first DVD in Japanese some years back when my daughters were very young. Both of them have been enrolled in a Japanese Immersion Program at their language school since they were 5-years-old. They speak, read and write Japanese.\n\nI bought the second for my wife and I, [Fox version] and thought it was great. Also, I bought the Disney version when my young nieces and nephews visited their cousins; since they cannot understand Japanese, they are able to listen to this version. I too am a purist; and believe that the inflections of Japanese; or any language in a foreign film should be the primary language listened to with subtitles. However, I also think that one can capture young children's attention--who would otherwise stray, if they were reading subtitles. I know this from experience as a father of two young Japanese-speaking American children.\n\nTherefore, while the spotlight reviewer skewers this DVD, I would recommend the film to those who are not sure if they would like to purchase the film. All one has to do is check my film listings, and you will see that I love Japanese cinema, and have since I was a child in the early to mid 1960s. I went to many Japanese films as a kid [Zatoichi] and saw Mizoguchi's, Kurosawa's and Ozu's films, to name just a few film directors that I grew up watching. The film is worth the purchase: Disney or not. There are plenty of reviews of this film describing this magical cinematic treat, and you and your children will definitely enjoy the film. This film is highly recommended. [Stars: 5+]";A Great Cinematic Treat For Children And Adults!
