Model ranking;ranking;ind;relevance;review
7;197;113;0.6109447895171303;read many many reviews album m blown away opinions drama band actual product taken side drama surrounding queensryche blinded given preconceived notion album n nthis good album queensryche honestly best since degarmo left hear frontier guest guitarists certainly held great guitar work solid tracks cold dare slave hands god running backwards life without everything fallen weaker track give recordings miss mark weight world typical haunting geoff tate ballad comes almost every record recorded solid re recordings album never put fact miss energy instrumental tones made are n ni touch tracks n cold great kick track killer guitar riff solid vocals feel vocals bit low mix slight precision issue ending song guitar drums perfectly together cool tune n dare couple really cool guitar riffs catchy hook mixed solid vocal performance n in hands god good song tate puts real passion emotion vocal tone one also guitar solo end blends well done much qr albums interlaced vocal lines song highlight n running backwards another strong track n everything reminds bit early evanescence programmed drum loop really cool addition qr album song crunchy well n life without great slow track drums top notch add much color song good tune n fallen really cool hook melodic lines guitar work exceptional n nwith people obviously allowing drama band influence unfair say things seen like tate flat one questionable note rerecording silent lucidity obviously hear rushed job bad mix etc statements simply fair untrue giving album 4 stars endings couple tracks polished could sub par re recordings older tracks however best group queensryche songs many many years ca blame geoff tate trying keep name band spent majority entire adult life creating art unfortunate circumstances come upon us m glad situation inspired tate create heavy album also gave motivation passion lyric content best done long time finally looking forward version band album come june guess re lucky two albums coming favorite band time
8;179;127;0.5379481371725907;let start saying think geoff recorded queensryche album maybe queensryche featuring geoff tate guess court decide awarded name probably still listen liked judas priest ripper owens motley crue john corabi still believe best record ever poison without c c deville van halen gary cherone many band changes definitely looking forward todd latorre fronted queensryche album way let get point frequency unknown continues direction geoff taking qr last several albums liking everything always liked parts like release mix could use work good material wo go song song breakdown like like dare something grates re records shaky deadline always seems want re records albums try listening album point view new listener pretty good took star mix geoff sound like twenty years ago singers overall like album also looking forward june next album queensryche believe deserve name 3 original members geoff remain solo start new band opinions give music unbiased try might like recommended
9;243;35;0.4800219054047553;good solo album geoff tate gave two stars released queensryche think geoff enough talent continue career solo artist real queensryche album todd la torre geoff quit idea continue queensryche real fans thank brazilian fan
10;250;58;0.4445165072248016;well bad 2 bands confusing infighting going thats show business n nthis album pretty good overall remixed imo vocals seem real weak n music solid rock hard oddly tate released solo cd called kings thieves listen sounds alot like queensryche n ngeoff tate singer songwriter producer insania wine vintner founding member queensryche n nwithout going legal stuff going hoping fiasco comes good ending nqueensryche made epic music love them n nbuy record decide hate tate well buy
11;222;56;0.42370025343620554;easy bash record made transition time band read lot negative reviews frequency unknown say impressed writing music album music maintains queensryche sound tracks like cold dare slave typical early mid 2000 queensryche sounds hands god could track promise land bands music sounded like music mid 1980 several years loved tunes also appreciated progression queensryche sound yes recording quality could better frequency unknown hope queensryche label stays goeff tate many future albums come idea band named queensryche without tate unmistakable vocals ridiculous count m interested hearing sound a like attempting replicate original think enough journey
12;234;32;0.40815102057490216;name queensyrche horrible fu title rate 1 waited original members put album see really respected sound queensyche long suffering fans obvious fans geoff problem band years slamming heavy metal considering geoff took cynical approach attempted return form bunch b list hired guns unfortunately failed glimmers hope ca seem put fully developed song together like geoff tate solo artist like album continue like music solo artist ca see winning rights queensryche name album especially compared quality product remaining members queensryche put like classic queensryche really skip get self titled album real queensryche
13;136;66;0.37824411960880694;frequency unknown musical attributes pretty easily defined even couple casual spins decent cuts cold weight world hands god four awful unnecessary re records whole lot guest musicians otherwise whole lot insincere tough guy posturing breaking benjamin b sides oh neither original mixes remixes really cut me n nand way time dig little deeper f u exists fundamental problems beneath music serve impetus creation plus sometimes man stand tell like never better time real qr fans like so n nthe problem frequency unknown necessarily fact sounds like garbage rather impossible award anything greater 1 star album calculatedly constructed less 2 months geoff tate sole benefit bid win court later year add insult injury marketed brand fired last year situation would laughable even best circumstances seeing supposedly intelligent self aware individuals defending course action however give much confidence capacity critical thinking n nin case smell bs miles away unfortunately tate seems thoroughly enjoyed systematically destroying every ounce respect growing keen output gray slater since early 2000 q2k onwards really outdone sheer awfulness years gone one man make qr yet hundreds people showing venues seem think somehow fools ask following question lot antics last ten years would condoned kind business makes think get away awful behavior questionable management decisions physically assaulting band members backstabbing film adaptation rights omc despite majority shareholder corporation helped create vote money yet choose spend someone like say supposedly enlightened consumer n nif f u best sounding intricately fashioned record tate involved since promised land would minded buying despite however best sing post grunge songs slater pulled backyard shed rope dozens high profile guests create illusion everything alright ca expect give money good conscience already done great job destroying voice smoking drinking etc since good ol days really need hand billfold destroys career well
14;211;17;0.3220235035957222;geoff tate solo album eh bad queensryche album bland mediocre forced judging production rushed re die hard geoff tate fan may like album queensryche re looking
15;213;34;0.2922948268191486;usually like give cd couple listens make mind album honestly bad please listen tracks making purchase really worth money even re released tracks suffer horribly compared originals tate even commented re released tracks saying put cd way make money really geoff know compare two queensryches original guys minus geoff really put great line up together new cd puts one shame
16;232;30;0.16712257013963608;amazing record combined record sales individual players records would 200 million records sold give us utter trash mean thing never get played sit shelf staring like last 4 qr efforts tate done best trash insanely great band name n ngame
