;ranking;overall;vote;reviewText;summary
17;25.0;5.0;22.0;"I love this kettle, functionally and esthetically.  Ours worked for many years then gradually began to become finicky about how it was positioned.  For a while the answer was just to rotate it on its base until it came back on, but gradually the sweet spots faded into nothing.  In between there was increasing flickering and annoyance.  Several times along the way I tried spraying contact cleaner and spinning it around a lot to clean it, with absolutely no effect.\n\nI read a lot of these reviews and saw that many experienced this, surprisingly few tried to fix it and seemingly everybody who tried succeeded.  It couldn't be that hard!  Inspired by their success, I dug in myself and easily fixed it.  You can, too!  I'm hoping to help you if you have the same problem by giving you far more detail than any of the accounts I read:\n\nTools needed:  Almost anything will do.  I succeeded with the first three items I grabbed, fingernail clippers, stapler and letter opener.  All three, it turns out, were more than capable of imposing their will on a thin piece of metal or rubber.\n\nThey say a picture is worth a thousand words.  I found that reality is worth a thousand pictures.  If you can see it clearly you can solve it easily.  Here's how/what to see:\n\nOn the bottom of the kettle there are three metal parts near the center:\n\n1.  The center pin, what I was effectively cleaning.  It probably has no purpose other than positioning.  No wonder cleaning didn't help!\n\n2-3.  Two flimsy contacts.  This is surely where the problem lies.  Note that they are not symmetrical.  One, closer to the pin, pushes inward toward something in the base, while the other pushes outward.  They are held in place by some hard plastic framing.\n\nThe bottom of the base is more inscrutable.  It looks like a hard piece of plastic with a hole in the center, surrounded by a soft, loose rubber ring, surrounded by a hard ring that spreads out at the bottom into a much bigger circle and seems to be structural.  The trick is to use two thin tools (movable squeezing thingy on fingernail clippers and point of letter opener are nice choices) to push directly down on opposite sides of the inner rubber ring.  It turns out to be spring-loaded and willing to retract by about 3/4 inch.  If you push it all the way down (perhaps running into a snag halfway which disappears when it is level), it will reveal two concentric, circular metal sleeves facing each other across an airspace normally filled by the rubber ring.\n\nAs soon as you see this, pretty much everything becomes self-evident.  The pin and various round protrusions and holes all line up to give it that smooth rotation that we all love.  The plastic framing pushes the rubber ring in.  One of the contacts pushes against one of the rings, and the other against the other.  The problem is that they aren't pushing like they used to.\n\nThe answer is to use gentle but insistent force to make them push a little more, the inner one inward and the outer one outward.  There are probably countless ways to accomplish this.  One person said to turn the kettle upside down and push straight down on a contact, bending it more.  This is where the stapler came in handy.  I was very doubtful that it was doing much in the sideways direction, though, so I generally poked and prodded, finally forcing each contact all the way through to the opposite side of the plastic frame, then pushing it back (letter opener).  While I was at it, I sanded the contacts a little for good measure, in case they had rusted.\n\nI remember thinking that if I weren't too lazy to go downstairs and get a pair of needle-nosed pliers I could have done a much better job, but I plugged it back in, and it worked flawlessly, illustrating that mediocrity is sometimes good enough.  I'm guessing that the metal is strong enough to withstand this kind of operation many times.  I'm hoping it will work until I'm old and forgetful, and that one day when it becomes intermittent again I will look at reviews on Amazon, see this one, fix it again and either say hi to my earlier self or maybe not realize that it was me.  In case that happens, a suggestion to future me:  You might also want to use contact cleaner (in the right place this time), and/or sand the inner rings; I don't know.\n\nHere's the motivational pitch:  It will take you very little time.  It's already broken, so you have nothing to lose.  Especially if you're not normally a fix-it person, it may impress your spouse.  And there's something surprisingly satisfying about rescuing a beloved old mechanical friend from premature consignment to the appliance graveyard.\n\nI hope enough people mark this as useful to float it to the top of the list so others see it and can benefit as I did.";How to fix when it starts to short out and requires increasingly careful positioning on the base
5;26.0;1.0;9.0;Plastic around kettle disintegrated and stopped working exactly a year after we bought it.\nVery poor quality;Cheap plastic components ruin a good kettle
45;27.0;1.0;28.0;I bought this kettle originally because the top opened up wide enough to clean, the kettle detached from the base, and I prefer metal over plastic. And it has a cute blue light when it's on. So far so good.\n\nWe had to send back two of them because when we got them they didn't work.\n\nWe've now had it for a year or two. It's become a bit of a game to figure out exactly how to rotate/position the kettle on the base so it stays on/heating. It's been getting worse - a few months ago I thought I was just getting forgetful and not turning it on after filling it. Then I saw the light go out just after turning it on, the motion of the water sloshing around (I guess) breaking the connection. Now it's very difficult to find a position that works, and the slightest touch turns it back off again.\n\nIt's also a bit slower to heat water than my last kettle (which is no longer available) but not as slow as the kettle we have at work.\n\nMy guess is that the induction connection in the base is just poorly designed. Anyways, guess we'll be buying a new (different) kettle.\n\nOh yeah, it does get pretty hot.;Nice look, bad quality
63;28.0;1.0;30.0;I bought it, and it started failing apart after a few months of moderate use. First, its light began to blink sporadically. Then the light quit working. Then the auto-shutdown system quit working - it would boil the water indefinitely, until I turn it off. Finally, it shortened my kitchen. At this point, I considered it simply dangerous, and sent it to the garbage can.;Failed after 6 months
85;29.0;2.0;29.0;I loved the look of this item and the sleek features that are included.  However, the burnt plastic smell is overwhelming and does not go away.  I bought this item and could not stand the taste of my tea so I brought it back thinking I got a bum one.  I exchanged it for an identical new one and was hopeful that perhaps it was just a fluke.  Unfortunately, I experienced the same problem again and after many washings and still the lingering taste and smell of burnt plastic, I am going to return this one too and try a new brand all together.;Great look, horrible smell
13;30.0;1.0;14.0;"My too long review begins!\n\nI didn't use this electric kettle. I got to the point wherein I opened the top flap on the box and read 'This product contains chemicals known to the State of California to cause cancer, birth defects, or other reproductive harm."" No thanks, Breville. No thanks.\n\n[In terms of the 'chemical smell' people experience, I don't think this has to do with the plastic parts of the kettle.\n\nIt seems to be the water, and not the kettle, in every case I examined. To explain, I'll say that tap water generally has chemicals in it (disinfectants, etc; |water.epa.gov/drink/contaminants|). What does this have to do with the smell people experience? These kettles heat water fast. They bring it to a boil faster than traditional kettles, which is the point. The byproduct of boiling at such blazing speed is that all of the chemicals in the water are converted to gas equally as fast. This may be where people are having an unaccustomed reaction. With traditional kettles, or even boiling water in a microwave, the time it takes for the chemicals in tap water to convert to gas also allows for the byproduct smell to dissipate. An easy test for this would be to use purified water in the process a couple times and see if the smell is present sans chemicals. However, I'll also point out that tea is best served with fresh water (tap, stream, whatever) and not bottled water. When water doesn't have oxygen in it (as in bottled water), tea suffers. Thought I'd throw that out there before other people mentioned it. At any rate, just thought I'd share my thoughts. I think the 'chemical smell' thing I see on every electric kettle on amazon (regardless of what they're made of; glass, metal, plastic, etc) is actually just the chemicals in the water being converted to gas in a way most people haven't previously experienced. On this particular product, the smell is probably worse because of the soft-top steam sealing design. In essence, Breville is trapping it inside. /rant]\n\nSo why did I return it, if the smell people complain about in reviews is the water they're using, and not the smell of plastic burning from boiling water, inside the kettle? Because of plastic pseudo estrogens, and other nasty chemical elements used in the production of plastics. BPA is the most infamous, but not necessarily the most harmful or widely used. The issue is, though, that you won't 'smell' BPA, or any other pseudo estrogen. Not that leech from this product into your water for tea, or in the plastic cup of lemonade you leave out in the sun while mowing the lawn. You won't taste the pseudo estrogens and other harmful chemicals, either. Just because you can't smell or taste a poison doesn't mean it doesn't exist. Ask anyone who dealt with asbestos or had radon gas exposure.\n\nI did call Breville, and asked if BPA were present in the product, and they said no. They claimed the warning about cancer causing chemicals was because they didn't opt-in for testing and certification, and no other reason; essentially that they had to legally put the warning there because they didn't test.\n\nWhat I cannot understand, is why on a very high end and high priced product plastics would have to be used at all. There doesn't seem to be any context wherein plastics are actually needed.\n\nSo what am I going to do? I've already got a&nbsp;<a data-hook=""product-link-linked"" class=""a-link-normal"" href=""/Uniware-Pyrex-Heat-resistant-Glass-Kettle-Tea-Pot-800ml-NEW/dp/B004MH2Q8G/ref=cm_cr_arp_d_rvw_txt?ie=UTF8"">Uniware Pyrex Heat resistant Glass Kettle Tea Pot 800ml NEW!</a>in my shopping cart, waiting for the refund to go through on this. It won't boil the water (as)fast, and thus it won't be convenient. But at least there's no plastic involved, and thus no paranoia.\n\nI've reached a point in my life wherein I am no longer willing to take shortcuts at the expense of my health. Being willfully ignorant has a cost I'm unwilling to pay. It's a personal choice.";I'm done with electric kettles altogether. Here's why and what I'm doing instead.
11;31.0;2.0;11.0;I ordered this kettlen last December 2014 with a one year warantee.\n\nEverything about this product is ok EXCEPT the plastic handle/casing part. This is all one piece which provides the handle and encircles the on/off button at the bottom of the unit. This on/off button is a simple press at the bottom half to turn on. After less than 4 months use this plastic casing surrounding the on/off button cracked at the bottom, then fell off, leaving the on/off button with no casing support. Without support, it was just a matter of a few pushes to see the entire switch push inward and downward into the lining of the kettle, making it impossible to operate.\nOK, must have been a fluke I thought. I contacted Breville and they sent me another kettle. I have only used this kettle about 3 months and guess what? The same thing happened--the plastic casing surrounding the on/off switch has cracked at the bottom and part of it has flaked off.\nI am going to tape the switch to the unit to avoid what happened on my first kettle. Wish me luck.\nI contacted Breville and I have till this December to decide whether I want to have yet another new kettle replacement. But I think there is a design flaw here and until Breville beefs up this plastic handle/casing part, I think I will pass and buy elsewhere because evidently my pushing technique is too strong? Please....\nI;I ordered this kettlen last December 2014 with a one ...
28;32.0;1.0;17.0;"I loved this kettle for the first year I owned it. Then one day it turned itself off and never came back on. It just stopped working. Then I called Breville customer service to get it replaced. Before you buy this product, you might want to call them just to give yourself an idea of how bad the customer service is. The average wait time I experienced was around 20-30 minutes per call. I was asked to send in proof of purchase (for something purchased a year ago!) along with a batch code. I sent that in via email, then never got a reply. I re-sent the info a week later, and never got a reply. Then I spent another 30 minutes on the call to follow up on the two emails they never answered. After that long call I was told they would not replace the kettle, but would offer me a ""substantial"" discount of 20% on a new kettle. In other words, I can buy from them at the same price I bought from Amazon, for a kettle that breaks after a year! Don't buy this kettle unless you plan to buy a new one every year. It works great...until it stops working.";Works great...until it stops working
62;33.0;1.0;24.0;There are two problems with this kettle.  Although it's only six months old, the button that locks and releases the top is starting to get temperamental.\n And more serious,  there are rust stains inside the kettle on the bottom.  Yes, they claim it's stainless steel and yes, there are nevertheless rust stains.\nI would not recommend this item.\nHester Diamond;Not a good item
81;34.0;3.0;26.0;I have a few Breville products and have been very happy with them. This kettle looks great and heats water quickly, but the smell and taste are horrible. I spent a week doing constant cycles of boiling vinegar, boiling and discarding plain water, then boiling and discarding water and baking soda. SEVERAL of these cycles a day. It's been a couple of weeks now, and there is still a faint odor/smell, and I'm hoping it will completely disappear soon, but for at least the first week, the water was undrinkable. You could strongly taste a chemically-plastic taste in tea, instant coffee, etc... horrid. I'd pass on this one. There are other kettles out there you won't have to struggle so much to use!;Strong Odor and Taste
43;35.0;5.0;20.0;"This will be a very short review, as I agree with all of the points made in the positive reviews.  I only have a couple of details to add:'\n\n1.  The cover opens easily with the push of a button and raises itself *slowly*, so it doesn't fling condensation about.  Very nice!\n\n2.  The boiling cycle is, of course, interrupted when you remove the kettle from its base, but unlike most modern electric kettles, this one does not turn itself off, so it will resume heating the water when it's placed back on the base.  This isn't a ""con"", but it's something to be aware of.";Great kettle, one caveat
22;36.0;3.0;14.0;"I was, overall, happy with this kettle. It's true, if you are leaving the water sitting in it for longer then an hour, the water will acquire metallic taste. As some others have mentioned this is not an issue if you are always refilling fresh water. It boils quickly albeit somewhat louder then i'd like. It's on the heavy side, which i didn't mind. The stainless steel body is very finger print-prone. I decided to just live with it, as this was the best kettle i could find with the  minimum amount of plastic parts submerged in the water.\n\nWhy only three stars then? Because this kettle just died on me after two years.\nIt appears that the base/kettle circuit started shorting. The problem seems to be not in the base itself, but in the part of the kettle that attaches to the base (otherwise i'd try replacing the base) . When you turn the kettle on the trusted blue light flashes quickly and then...nothing. For a couple of days i was able to work around it by rotating the kettle on it's base to find the ""sweet spot"", but this method eventually failed as well.\n\nFor the price (and given a single year warranty) it's a very short-lived kettle and hardly worth the value. I'm going with a different brand for the replacement.";Lasted two years
38;37.0;3.0;16.0;I purchased this thing on Jan. 30, '07.  And like the reviewer on Apr. 03, '11, mine just quit working.  It started about 4 mos. ago with intermittent off times.  The answer was to slightly rotate it on it's base.  Obviously, it wasn't making good contact with the prongs in the middle.  So, in looking at the bottom thinking I was just going to unscrew it for a quick fix, I see screw types I've never encountered before.  Those Chinese tricksters have used proprietary screws with triangle shaped depressed openings in the heads!  But I found a screwdriver tip that will work: a 3/32 flat blade will wedge into the opening and back them out.  Pretty straight forward after that.  I'll say that the contacts in the center post of the base are very thin and were probably fatigued.  After straightening and putting a stronger curve in them, VOILA!  Hot water.  I've been alone for 11 years now, so there's just me making one espresso in the morning.  So this thing was getting below moderate use, I'd say.  So, I think my grade of 3 stars fits because the center contact needs to be beefed up considerably.  Design flaw.  Oh, well.  I hope I brought some hope to someone out there who might want to try this fix.  It's not difficult and will save a bit of money.  Hopefully, it'll last another 6 years.;Back to boiling again....HUZZAH!
31;38.0;1.0;14.0;"We did what all Amazon customers do: We read the reviews on this kettle and decided to buy.  That is, we read the POSITIVE reviews and pooh-pooed the NEGATIVE reviews, figuring that 218 people were obviously more right than all those others (3 stars and below).  Oh boy were we wrong!!  Our kettle lasted just about 2 years, and then it would not begin to boil until the pot was rotated on the base to regain the lost electrical contact.  A couple of weeks went by and we continued to rotate the kettle on the base until....finally....the kettle died.  We wrote to Breville asking for a solution, and then to complain.  Breville's response?  ""We'll call you and sort it out.""  They NEVER called!!  I'm hoping that potential Breville customers pay attention these 1 and 2 star comments.  DO NOT BUY THIS PRODUCT!";"Your Kettle Will Die Too; Breville Couldn't Care Less!"
19;39.0;1.0;11.0;"There aren't any really good-looking electric kettles available on the market that I'm aware of. This seemed like the least bad one, and seemed okay if underwhelming. I've used another one before, and knew I disliked the placement of the water level behind the handle so that it's hard to see what the level is -- very stupid design. But it seemed better than other ones anyway. After ordering it and using it for a while, I've noticed that the spout is glued on rather than welded on. This is unbelievably crappy, as anyone with any sense knows perfectly well. Gluing metal to metal is infantile rubbish; clearly metal should be welded, and they're selling this thing for eighty bucks, not eight. Totally unacceptable, total garbage. Every time you pour boiling water from this thing, the poisonous toxins from the adhesive are melting into the water. Anyone with a brain will have to look elsewhere, regardless of the convenience factor. If nobody is going to manufacture a decent quality electric kettle, let's just use a real kettle instead. It's not that hard after all.";Very disappointing, toxic and unprofessional construction
89;40.0;4.0;20.0;"I research things a lot before I buy anymore, we wanted an electric kettle because when we use traditional kettle on the gas stove top, it just seems to waste a lot of energy heating the air which slips by.  We also are familiar with the European use of these as my wife is from Poland and we have used these kettles whenever we visit her family there, they boil water FAST.  All the heat energy created by the appliance goes into heating the water so there is very little waste.\n\nSo we've had this Breville kettle for a few weeks now and for the most part it has really done great. It boils water in 7 minutes that the stove top takes 12 minutes for the same amount (almost full).  I was concerned that living at 4800 feet in Montana that the temperature wouldn't be hot enough to trip the kettle when it boils. The trip mechanism must rely on some other variable when it senses boiling water, cause it trips off fine.\n\nWe use the kettle for tea and when we make pasta. For pasta we fill the kettle and put half as much water in the pasta pot, they both boil at the same time and we have boiling pasta water ready in half the time. Real geenyuses we is.\n\nSo why 4 stars??? The ""Smell"" thing, as reported in previous reviews here, we had a bit of a bad odor & taste thing going with this. I'm sure it will dissipate with time but the people who make this should be able to figure a way to prevent this from occurring in the first place.\n\nSo there's my 2 cents, I could drone on about the style, quality & such but enough people have done that. In fact it's why we bought this, it seems every other electric kettle out there has issues with it (and I looked at a huge majority of them). The Breville is the only electric kettle to be rated exceedingly well by so many people with only a few minor gripes.\n\nKeep shopping if you want, I don't think you'll find a better product than this.\n\nPeace.";Shopped a lot, bought this.
20;41.0;1.0;11.0;"I used a Breville kettle for at least five years, and needed to replace it.  I bought the same kettle, a newer version of the old one, and paid $79.99.  This used to be a high quality kettle, now the price is high quality, but the product has been down graded.  I bought the second one at end of 2013 and after using it once, we noticed that it had rust marks on the inside.  I contacted the company and after trying to send photos of the inside of the kettle, they eventually agreed to send a new one after I returned the old one.\nWe receive the new kettle, but I noticed that the same thing happened inside the new kettle after the first use.  This is a ""stainless steel"" kettle which is not meant to rust, but it just seems to be of inferior quality.";Disappointed
72;42.0;1.0;19.0;I got this home and the first thing I did as the directions indicated, was to boil the kettle.  I did it six times and the biol seemed quick.  The blue light is cool, but I was very disappointed to discover that the coil inside and the walls of the kettle developed rust.  I would pour the water out after each use and would let it air dry.  I only used it for three days before this happened!\n\nI also experienced the plasticy smell others here have commented on... I went to Target as others have recommended and purchased an Aroma kettle for  more than half the price of this kettle and have had no problems.  It may even be faster!?!?  Who knows, but no plastic smell and no rust!  There is also no coil to worry about... Get the Aroma!;Rusted after a few boils
7;43.0;1.0;6.0;After six months of daily use, the plastic below the button cracked and broke off and the button fell inside the body. Very poor design and should be pulled off the shelf until a safer design is made.  Clearly someone could be electrocuted from this defective product.;Dangerous and Faulty - Buyer Beware
25;44.0;1.0;11.0;this is my second Breville kettle.. both worked great for about 1.5 year. after that the contact between the base and the kettle broke..\nit seems that this is not a flaw but a design feature.. i don't think I will be buying Breville products anymore...;Contacts between the base and the kettle wore off in about 1.5 years
