;ranking;overall;vote;reviewText;summary
92;1.0;5.0;886.0;"After the cheapo plastic kettle died, I investigated multiple other high-end electric kettles, including Cuisinart, Chef' Choice, Krups, Braun by reading reviews on-line and comparing them @ the local bricks & mortar stores. The Breville is clearly the best designed one for the money.\n\nPros:\n- clean, beautiful design which is also easier to clean.\n- hefty, substantial base unit with place to wrap around the cord\n- boils quickly in 4 min. for full 1.5 L\n- more substantial kettle than more expensive models by Chef's Choice or Cuisinart. The Chef's Tools electric kettle @ the same price point looked flimsier. In fact, the floor model Chef's Choice kettle was no longer closing or opening its lid properly-- always a bad sign when a floor model falls apart.\n- modest yet easily audible ""ping"" sound when the water has come to a boil, and the kettle shuts off automatically.\n- the outlet is easy to pull due to the hollow center design\n\nCons:\n- heavy kettle.\n- occasionally, there's a metallic taste in reboiled water if the water was left inside the kettle for several hours. However, the water tastes fine if you boil a pot from freshly filled water.\n\nOverall, clearly the pros outweigh the cons. We're heavy users of the electric kettle, especially in the winter, boiling water for teas, soups at least 4-5x per day. We'll report back again in a yr after the warranty expires.\n\nUPDATE > 1 yr after post (4/6/08): The Breville Ikon is still going strong. The water seems to be taking a slightly longer time to boil. We still use it 3-4 times per day, and it works well.\n\nUPDATE 12/19/11: Kettle still going strong. We still use it 2-3x/day, and it still works great. Wow. Worth every cent.\n\nUPDATE 1/12/14: We love it and still use it up to 5-6x/day. We take it with us when we travel. We couldn't be happier with this kettle which is still going strong after 8 years of rigorous use. I would love a mini model of this to take for traveling.";Outstanding, long-lasting, high-end electric kettle for price.
2;2.0;5.0;553.0;"While there is typically little difference between any two electric kettles, this one is at least at the top of the spectrum.\n\n1. Being an extremely convenient home appliance ""discovered"" by the Europeans decades ago, and later in the USA, the electric kettle always left one concern: compared to its mundane predecessor it was typically made of plastic inside and out. Which could potentially mean various unhealthy substances emanating into the water from the plastic sides, especially at high boiling temperatures. This one is made of stainless steel and doesn't cause any such concerns.\n\n2. The kettle can be rotated on its cordless base, which makes it easier to put it back on the base than some other models.\n\n3. It has a transparent wall segment to measure water level. While this ""window"" is not located optimally (somewhat shadowed by the handle) and hasn't got a bright floating level marker, this design is sturdier than some others, and is less prone to leaks.\n\n4. Blue back-light that goes on and lights this ""window"" when the kettle is switched on, is a nice touch. It both attracts attention and simplifies reading the water level.\n\n5. It's easy to open the lid, and the opening is wide to add water with no problems or dripping. (In some models the handle partly covers the lid, making it hard to open and/or add water.)\n\n6. Like in most up-to-date models, the heating spiral is NOT located inside the boiling case, but rather underneath it, which makes the design more relaible, and it is also much easier to wash the kettle inside if need be.\n\n7. Time to boil is reasonable and not worse than average.";Good appliance, finally made of stainless steel
93;3.0;5.0;317.0;"Truly a top notch product.  I was tired of lukewarm water ""nuked"" in the microwave for tea or hot chocolate at the office so, after consulting other customer reviews for products under the ""electric kettle"" search, I took the plunge.  A bit expensive, but worth it.\n\nPros:\n\n1.  Stainless inside and out.  No plastic taste or chemical worries.\n\n2.  Very comfortable handle, nice curve to it, and totally insulated.\n\n3.  Cord minder on the base bottom; allows you to tailor the cord length to your needs.  Cord very sturdy.\n\n4.  Separate base contains the cord.  The kettle itself reminds me, from the standpoint of heft and size, of an ""old fashioned"" stove top percolator\n\n5.  The removable kettle itself; also, you can turn the kettle around to any point on the base; it doesn't have a notch or fixed position\n\n6.  Construction appears to be quite solid.  Push a button and the top opens up automatically (not just a cheap spring, either).  Glass center insert on top so you can see in; top is also domed to direct condensation back into the pot; haven't had any problem with water dripping onto the counter (or hand!) when opened.\n\n7.  Quick; heating just one mugful of water to boiling is easily faster than the microwave (same time in microwave will leave you with hot, but not boiling water).\n\n8.  Easy to clean; the opening is wide enough to get your hand in, and the top opens up to 90 degrees.  There is a rod that runs up the inside, part of the temperature sensing system, but there's room enough to get a soft cloth behind it, you'd just need to avoid too much force.  Cleaning, however, is not a big deal overall if you use it for its purpose - heating WATER only (don't heat your soup in this; it's not made for it).\n\n9.  Looking at other reviews, it seems that some people like to fill the kettle via spout rather than main opening - spout is nicely sized to easily allow this, if you want.\n\n10.  The water gauge is big, well marked and very nicely lighted, thus easy to read.\n\n11.  Automatic turn-off at boiling temp, and also has a function to avoid boiling dry (The boil turn-off feature kicks in about 30 seconds after you can see the water boiling; I haven't personally tried to boil it dry, so can't comment on that feature).  There's a nice, but soft, single ""ding"" that it makes when it turns off.  You might not hear it from another room, but it shouldn't damage itself by boiling dry, so even if you miss the ding, it's not a big deal.\n\n12.  Beauty is in the eye of the beholder, but to mine its lines are clean, simple and elegant.  Should fit with just about any decor.  Fingerprints on the outside stainless haven't been a big issue; wipes clean with damp cloth.\n\nComments (not ""Cons""):\n\n1.  Regarding another reviewer's comments about weight, it does have some ""heft,"" but on the other hand, it has a good capacity!  To heat one or two cups, it's handy enough.  Stainless steel will be heavier than plastic, so if weight is an issue for you, you may wish to consider this point.\n\n2.  I wish the otherwise nice switch wasn't directly at the bottom end of the handle, but this really isn't a big deal.\n\n3.  I've seen reviews indicating that stainless steel pots get hot on the outside. This one probably does, too (if you put your hand near it after boiling, you can sense the heat). Well, the handle is perfectly insulated, and this is NOT an insulated device.  I wouldn't put my hand on the outside of any ""regular"" metal pot or pan (steel or aluminum, like those found in any kitchen for daily cooking)that had a boiling liquid in it, so I wouldn't do that with this type of device, either!\n\n4.  Reviewers of other kettles have suggested that the device may leak if water is left overnight.  Have not had that problem with this, but then again, we empty it at the end of each day.\n\n5.  Have not had any problems with rust, as has been noted with competing products, but see comments in #4, above.\n\nBefore purchasing, I looked at the competition in stores, and a friend has ""another leading brand"" competetor; this seemed superior to the others in virtually every way (particularly build quality, the others I'd seen seemed rather ""cheap"" despite their price).  Definitely recommend; this is a winner in our office; several people have already bought their own!";"Excellent product; a ""hit"" at the office"
3;4.0;1.0;5.0;I went through two kettles in about 3 years. The first one was very good for about 2 years. The base had stainless steel all around and it was very stable. The newer redesigned model, which was still the same model, has a terrible unstable and wiggly plastic base, but eventually I got used to it. The first kettle stopped getting contact with the base and just stopped working for no apparent reason. The second one died within a year- the plastic around the power button broke by itself, I assume from heat, and the button got pushed in. So, it became unusable unless I wanted to get electrocuted, which I don't:) With all being said, it's not a good unit unless you change your kettles every 10 months or so. It boils fast and doesn't make annoying sounds- that's the only feature I liked. Also, it's not insulated, so keep your fingers on the handle. Better option- don't buy it.;Owned two- both broken- save your money
10;5.0;1.0;70.0;I got this kettle in the hope that throwing money at the problem would get me something really sound.  Instead, it failed on me with the switch disintegrating after about three months (see hole and crack in attached pic).  It nominally has a one year warranty, but a) they never answer the phone, and b) they never call you back when you opt for the we'll-call-you-back option from their customer support.  Altogether, I rate that as shameful for a product that's clearly pitched as a high-end model.\n\nAs far as the kettle itself is concerned, it works reasonably well, but isn't very well designed.  The switch is hard to get to, the water level gauge is mostly obscured by the handle, and it doesn't have a safety interlock that switches it off if the lid is open.  It is also not insulated, so a) could burn you if you touch anywhere other than the handle, and b) it loses its heat fast.  Such design flaws one could have forgiven thirty years ago, but Breville has been making automatic kettles for donkeys years.  There's no excuse for them in a high-end kettle in this day and age.\n\nIf I had got ten years of untroubled use of it, and considering its design flaws I'd have given it three stars.  As it is, given their customer support, I won't be drinking from this well again.;I won't buy from Breville again.
91;6.0;1.0;202.0;For an Englishman abroad (i.e. I need gallons of tea a day), this product looked like the bees knees - the best kettle out there. And it is without doubt a good-looking machine with lots of great features. But unfortunately it has one fatal flaw - the hot water that comes out of it smells of  plastic. I thought this would pass with a bit of use but no, the nasty boiled plastic smell remained. In the end I sent it back and bought a Braun instead. Shame, in every other respect this is an excellent machine.;Nearly...
84;7.0;3.0;193.0;First off, Amazon's part in this was excellent. The product arrived in good shape and ahead of schedule.  The kettle itself was well-designed and of excellent quality. There, however, is where the problem started. On opening it, there was a heavy, oily smell. This is not unusual for steel items, so I went about boiling a couple of kettles as recommended in the instructions. After the sixth time, the oily smell was still present, and was strong enough to contaminate the tea.  I even tried boiling a water-white vinegar solution and leaving it overnight according to the instruction - to no avail. Finally sent it back - a process which was painless and quite easy, by the way.;Quality smells
8;8.0;1.0;47.0;Bought it five months ago and already full with corrosion. How disappointing. According to the company policy this product is not entitled for return which makes it even more disappointing.;Bought it five months ago and already full with corrosion ...
57;9.0;1.0;108.0;I owned two Breville kettles.  They both failed the same way.  I know a lot of people are happy with the Breville kettles but most don't realized after a year or two of constant use, the electric contact between the base and the kettle will soon wear off.  That means, the on button will not light and the unit will not work.  I called Breville and found out that this new unit has the same electric contact mechanism.  If you plan to use this for more than one or two years, I would consider another brand.;Electric contact wears off
69;10.0;1.0;115.0;"Just over a year ago I purchased two Breville Kettles on the basis of good Amazon  reviews. ( We became accustomed to the convenience of electric kettles during a sabbatical year in England and after we returned home, we tried a number of (plastic) kettles, none of which lasted more than a year or so.  We were looking for something more durable and troublefree. )\n\nThe Breville Ikon kettles seemed to be just that during the first year of regular use.  However, our kettles (one in personal use and one  a gift to my son's household) have developed a disturbing pattern of turning themselves on.\n\nWe have been in the habit of leaving the kettle plugged in between uses.  Almost always with water in it. And it functioned reliably for a year.  But now the kettle will occasionally switch itself on and start to boil.  So far it has also turned itself off.....\n\nWhen I phoned the Breville customer service line to discuss this problem, I was informed that I if read the instructions I would see that the kettle should not be left plugged in when it is not in use.  ""Plug it in to use it and unplug it after each use.""\n\nWell, we can accommodate that limitation, but I do not find it convenient. Not to mention the naggling fret of what might happen with a kettle which has developed an attitude of ""  I'll boil when I want to"" .\n\nNice product, but NOT the durable, trouble free one we hoped to find.\n\nOne star because it so failed our durability hopes.";Breville Kettle problems,  after a year of use this kettle turns itself ON!
78;11.0;4.0;94.0;I recently bought this product, which has performed flawlessly so far.  But two things I've noticed are valuable pieces of information for those planning on buying an electric cordless kettle, I think:  First, the water gauge is behind the handle, which means you can't see the water level as you're filling the kettle, since you're holding it by the handle.  This problem is not unique to this kettle, but it is an annoyance.  I've learned about how much water it takes to fill my 16 oz. mug (a count of five), so I don't need to try to look at something that's underneath my hand as the water is running from the faucet. Maybe they're assuming you're going to be using bottled water and won't need to be holding the pot as you're filling it!  My other caution is the very large, dripless spout.  The dripless part is great, and it is truly dripless.  However, it's also very large, so that a TREMENDOUS amount of hot steam escapes as the pot heats up.  You really need to move the pot out completely away from any walls or cupboards or the steam will quickly ruin the finish.  But if you move the pot out toward the edge of the counter, the hot steam may burn you, you spouse, your child, or your cat who suddenly decides to jump up on the counter. You really need to stand by the pot as it is heating up if you have pets.  I have also noticed that our hard water is already leaving deposits on the bottom of the pot in just a few weeks, but that is my cleaning problem, not a problem with the pot.  Another reviewer pointed out that the beautiful brushed finish does not stay beautiful very long no matter what you do, and I have to second that, but it doesn't bother me that much.\n\nInterestingly, I bought another cordless kettle at Target about the same time, a cheap chrome one by Aroma, for my office.  That pot, though smaller, does just as good a job for 1/3 the price, and the finish has stayed nicer.  The smaller spout does not release as much steam.  But it doesn't LOOK nearly as cool. Ha.\n\nAnd here's a comment apropos of nothing:  why can't the makers of these kettles make one with a stainless steel LID?  If we don't want a plastic pot, why would we want a plastic lid?  It boggles the mind.  But try to find a decent pot with a stainless lid.;A very nice, but expensive kettle
99;12.0;4.0;92.0;"I bought the Breville SK500XL two months ago and use it several times a day; it is indeed a nice looking, high quality electric kettle, and I am satisfied with my purchase. Here are several additional points and issues, beyond what was given in Amazon's product description:\n\n1. The main complaint I have about this kettle is that the automatic shut-off mechanism, which detects that the water boils and shuts the power off, has a very slow response. I usually boil only one or two cups of water, and by my estimate the kettle shuts off about 30 seconds too late, after the water has boiled. This not only wastes electricity, but also sends considerable amount of steam up the air. The reason for the slow response may be the very wide spout, which lets the early steam out and keeps the sensor cool longer; when I covered the spout the kettle turned itself off much sooner.\n\nSo - If I happen to stand near the kettle when it starts boiling, then I turn it off myself (it's a little nuisance; the power switch is small and located at the bottom, under the handle).\n\n2. There is a secondary shut-off mechanism, which kicks in if you turn the kettle on with no water inside. I decided to test it - it works!!\n\n3. The kettle's top cover is clear, but you can not see through as it is always covered with condensation droplets.\n\n4. The power cord has an unusual and helpful plug - it has a finger hole in the middle, so you can pull that plug out without pulling on the cord like many people often do.\n\n5. The water level is illuminated in blue, which looks nice in the dark (if you like boiling water with your lights off :-)  However the level is located under the handle, which obscures the water level somewhat.\n\n6. When the water gets hot, so does the kettle's metal body.";A nice high quality kettle, but sluggish shut-off
33;13.0;3.0;55.0;I ordered the kettle as I thought it wouldn't have any plastic in the kettle - many mentioned that it doesn't have plastic. In fact, it DOES have plastic in the kettle holding the mesh. To avoid contact to the plastic, water level should be less than 50% of the whole kettle. Anyway, hot water will poured through the mesh making contacts to plastic. Also the water level indicator has two rubber holes upper and lower, and the level window looks like plastic too. Please take a look at the photos I noted for your information. I can say it has less plastic than others, but it is not accurate to say it doesn't have plastic.;It DOES have plastic in the kettle
87;14.0;1.0;72.0;This kettle stinks.  Even after many boilings, it fills the entire kitchen with a burnt rubbery smell, the unit stinks, and the water tastes bad.  We're returning it for that reason. Sadly, it fills easily, and it's not bad-looking on the counter, but the stench is a shock.  Yes, it's made of stainless steel, but so what?  The tea and coffee we made from it (and yes, we have coffee machines for the real thing, too) tastes dreadful.\n\nDo not be fooled by the good reviews and the attractive design.;It Stinks
71;15.0;1.0;67.0;yep, it looks great, has a really cool plug design, heats quickly, makes a nice 'ding' noise when it reaches the boiling point and reliably shuts off immediately after that- but the plastic smell and the taint it puts into the water make it useful only for boiling water that you use for....something other than drinks you can taste.;stinky!
90;16.0;3.0;62.0;Despite a couple of reviews above suggesting that this kettle imparts water with a bad odor, I took a chance.  Indeed, there's a foul, plastic odor which the Breville rep. I got on the phone referred to as manufacturing residue.  Apparently they know about this issue, and advised me to fill the kettle half full of 5% vinegar, top with water, and boil.  Well, after one cycle of this, 2 scrubbings with mild dish soap mixture and about 5 more boil-and-discard cycles, it is getting better.  Still, this should be a heads-up to anyone considering this product or deciding to buy it.  I don't think it's a permanent condition, but who really wants to drink manufacturing residue tea?;Looks, Works Great.  Smells Bad.
6;17.0;1.0;14.0;Review submitted next day after purchase:\n\nAs funny it may sound, but it is very hard to find quality kettle. Based on user reviews, and my personal experience with 3 different kettles, I can say that Glass kettles explode, Stainless kettles rust, plastic kettles have that poisonous  chemical substance in them. Well, this one is fine so far. It just boils water, and does not immediately rust as OXO junk, does not explode like Hamilton, and does not have 20 useless buttons and LCDs... I am having it for a week, and so far no problem, and I am very happy with my selection. The only cons - it is pricey for china-made product.\n\nUpdate 08/16/1016\n\nI have changed my rating to 1 star. The kettle has rusted inside after 3 weeks of usage. DO NOT BUY IT!!!;Rusty junk!
82;18.0;1.0;61.0;We returned the Breville electric and bought Krups Stainless steel electric kettle. The Breville had a strong odor.;we returned it do to a bad smell
77;19.0;1.0;59.0;Although the appearance of the kettle is beautiful, it can't be used.\nThere is bad burnt plastic smell from inside of the kettle and the water has strong unpleasant taste. I can guess it is unlikely to be healthy as well.\n\nAnother minor problem with this kettle is that it is much easier to burn your hands than with a plastic one.;Bad smell and taste
9;20.0;1.0;17.0;First I was very happy with the product. Nice kettle ,beautiful design, good performance\nThat last about 2 months,\nRecently I noticed crack on plastic part next to glass (see pictures). Kettle is use daily, never been dropped\nFor me look like material problem. Before this kettle I was using different brand ($20) no problem for 3 years.\nI hope the problem is with my unit only;First I was very happy with the product
95;21.0;5.0;54.0;"This kettle looks, feels, acts and is expensive.  So if you like ""high-end"" stuff, this is the kettle for you.  It has a great weight to it and everything feels well made (this coming from someone who hopes to be designing products for the rest of her life).  It's quiet and boils water quickly.  The ""ding"" when it's done is a little quiet so I often forget I've been boiling water, but I'm sure that if it were louder, I'd complain as such.  I was worried about regretting spending $70 on a kettle, but I'm glad I did.  I have no regrets, and it's worth $70 to pay for a great kettle that I use every day!";finally- a good looking kettle that works well!
4;22.0;1.0;5.0;I really wanted to like this kettle, because we have an 8 year old version that we really like, but this one is junk.  Here's why:\n\n1. The kettle does not sit flat on the base, but rocks back and forth.  This is because they changed the base from our old model. See these photos for difference.\n\n2. When I spoke with Breville about this, they said it was fine, but its not, because it rattles and is unstable. Even though it is still under warranty and was used once, they refused to take it back.;GARBAGE
97;23.0;5.0;52.0;I received this tea kettle as a replacement for a Nova teakettle (the former model) that I purchased in October 2005.\n\nPart of the quality of a product is how the company stands behind it, and Breville is excellent in this area.  My former kettle developed a short in the on/off switch.  I notified the company by email, and I received an email response in 3 hours asking some questions and for more detail.  In 3 more hours, I received an email with a fed-x label.  They indicated they wanted to see the product, and they would either repair or replace it.  Within a week, I had this new model as a replacement, since they no longer make the Nova.\n\nI then received a follow up phone call from Breville to make sure I got and liked the new product, which I do.  The warranty period for the new product starts again, so it has a full one year warranty.  I also asked about the switch, since I was concerned that this could be a problem, and they assured me that this is a problem they just don't have with the applicances.  The customer service rep indicated that in 10 years, he had seen about 6 of the type of problem I had.  It seems that a customer service rep that has worked for a company for 10 years also says something about the company.\n\nThe new kettle heats quickly and to a full boil.  It also has the sharp looks where you can use for entertaining.  I am happy with the product, and very happy with the company's service.;Excellent kettle, Excellent company
12;24.0;2.0;20.0;"Does the job, but 3 days into it I am starting to see rust on the lower ""stainless steel"" plate, also fingerprint marks everywhere. This is a no go I guess. Here are the pictures.";Does the job but it is not stainless steel (and you know what that means...)
