;ranking;overall;vote;reviewText;summary
186;311.0;5.0;7.0;I graduated from college almost 3 years ago. I majored in Drama, so naturally I had trouble finding a job. When I found one, you could imagine how happy I was was when I realized that I was going to be paid 45,000 a year to be a customer service representative at a mid-range telecommunications company almost immediately after graduation. I lived with my parents for the time being so I could save up enough money to buy my own house. After I had about $125,000 I felt that it was time to go ahead and start looking for houses. While I was searching, I came across this TV. I had to make a decision, Buy a moderately priced house that I can live in, build income by renting out extra rooms, and raise a family in one day down the road, or buy this TV. I have to say I made the right choice. I allow people to rent my TV for about $1,000 a week and it's shaping up to be more profitable than my piece of s*** job. When I watch this TV I feel as though I'm immersed in another world. The experience of watching this TV is so amazing, life has become dull compared to the vivid experience of watching this TV. I've since quit my job so I can tend to my TV full time. When I loan it out to to someone, I always find myself lost, directionless, and depressed. This TV is better than real life, I would recommend this to anybody. This TV WILL pay off in the end.;Amazingly clear picture
207;312.0;4.0;7.0;"I was debating whether to get the 85"" or this 105"" one, but I decided that the extra 20 inches was well worth the extra $80k.\n\nI'm so glad I got this one; the HDMI cable connectors are even gold plated! Wow. Such quality.\n\nI noticed some of you had the issue of getting it to fit in your house door, but I don't have that issue, mainly because I had to sell my house and kids to fund it, but luckily, it fits in my new caravan/trailer nicely...  well, I say ""new"", it's 4th or 5th hand or something, but it's nice.\n\nI gave it 4/5 stars purely because my wife hates it, she left me because of it. Maybe she doesn't like Samsung? Who knows? All I know is that she's ""looking for the kids"", not sure if that's some sort of euphemism for getting a new TV, maybe one that isn't Samsung. Who knows? Who cares, frankly!\n\nI like it, so I'm keeping it.";Tasty TV
211;313.0;1.0;7.0;it melted my face off;One Star
212;314.0;3.0;7.0;It looked good online, but not that impressive in real life. I am selling mine on Craigs list for $26 (hardly used.) I plan to use that money my new Audi downpayment. Now, that is what I call practical investing.;Not fully satisfied with purchase
79;315.0;1.0;6.0;I got this tv at a mere $120k on sale but when I mounted it on the wall my whole house flipped over on its now heavier side.  Great, now this whole thing ended up costing me double the original price.  Great picture though.;Great, now this whole thing ended up costing me ...
80;316.0;1.0;6.0;"Just bought me 49 UN75H6350's. Now I have a 525"" 7560p TV, and on top of that I saved about $500 bucks. Now all I need is a house to put it in.";Save your money, do this instead.
244;317.0;5.0;7.0;It's a miracle! I've been blind my whole life. I wanted to buy this TV as a last resort before I  Well, as soon as the TV was delivered, I felt a warmth inside of me. I walked up to the TV, after a bit of stumbling around I touched it, and now I can see! Eureka! Great buy. 5 stars.;Cures blindness!
88;318.0;5.0;6.0;I ordered 4 of these bad boys for my quadruplets. Each kid has his own set, it's really great. The best part is, I was able to put them on my welfare access card, no questions asked.\n\nThe only real problem was that the remote DIDN'T come with batteries, which incidentally aren't covered under my cash assistance program. Fascists.;great set for the kids rooms
93;319.0;1.0;6.0;Went in on this TV with the entire state of Wisconsin to watch the Packers in the NFL Championship game.  Biggest waste of $100 dollars EVA!\n\np.s. free shipping was nice considering it had to be air dropped.;Biggest waste of $100 dollars EVA
94;320.0;3.0;6.0;Honesty, I spent so much time scrubbing Toilets that I never get to watch it. Boss said though if i stick with it I'll get a 25 cent raise after the new year (2016). That bumps me up to $7.50/hr and cleaning the bathrooms at Burger King won't be so bad. That leaves 32 years to pay it off.  If only I had more time to watch this. Well, I don't have space for it either to be honest, so it's sitting in the garage at mom and dads. dad threatened to sell it to pay off his mortgage, but by the time he sells it, it will be obsolete. Maybe not the best investment, and I am feeling the loss of my kidney. Also having one arm amputated for science wasn't really worth it. I have to hold the toilet bowl up with my mouth and scrub with my one good arm.;Scrubbing toilets does pay off
95;321.0;5.0;6.0;"Slightly smaller in screen size than my homemade 110 incher. My cost for materials was south of $50, coupled with a $700 BenQ 3D 1080p HD projector. I know,...But Steve, ""Did YOURS come with a $4000 Amazon gift card?!?!""";Slightly smaller in screen size than my homemade 110 incher ...
100;322.0;1.0;6.0;I wall mounted it and the wall fell down on me.  Now i'm in a full body cast for 9 months and I can't scratch my junk;Itchy Junk
272;323.0;2.0;7.0;After a couple of weeks of deciding if this tv would be a good fit in my home I decided to bite the bullet and order me one. I was almost through my free month of Prime and with free shipping I figured it was a no brainer.  Upon receiving this massive box I had to take out the header in my door to make room for it to go through. I got it set up, I was excited to hook up my 3D blu ray player, I had thoughts that I would never have to spend outrageous amounts of money going to IMAX movies again. After it was all hooked up and going (around 1230am) I plopped in a classic Ron Jeremy flick. Scared the s*** right out of me I do not recommend viewing hid kind of movies in 3D on such a huge screen. I hope none of the neighbors seen what I saw, that would be very embarrassing. This is why I gave it the 2 stars. Now I have to call in a contractor to fix my header.;... weeks of deciding if this tv would be a good fit in my home I decided to bite the ...
105;324.0;5.0;6.0;After my wife saw this,  I now sleep in the garage with the dogs.  My dogs and I are in love with this TV!  Luckily she gives us food once and a while for snacks!;My dogs and I are in love with this TV
107;325.0;5.0;6.0;What I like is the innovation Samsung builds into their stuff. This is the first 3D TV to incorporate fisheye lenses into the 3D glasses so people with normal size houses can watch it without getting neck injuries caused from constant panning back and forth.;Fisheye 3D Glasses
112;326.0;5.0;6.0;The Russian Mafia came to collect on debt i owed to buy this TV & I played the tommy gun scene from Home Alone. Image & sound quality were superb but unfortunately, the movie caused them to shoot back plus throw a bottle of liquid w a flaming rag that exploded onto my roof. Thankfully, i was the one hit in the end and not the TV.;Worth the debt collector beatings!
280;327.0;5.0;7.0;The refurbished set costs $100,000 more than the new set. That's the better deal if you ask me.;That's the better deal if you ask me
285;328.0;1.0;7.0;1.21 gigawatts?!?!?!?!???!!!?!?  I'm going to have to sell my DeLorean time machine...\n\nhttps://www.youtube.com/watch?v=mjCRUvX2D0E;I just looked at the power requirements
293;329.0;1.0;7.0;"I feel so sorry for all you LOSERS who can only afford such a small TV.... for those of us with the cash we go REALLY big... I bought my Titan Screens Zeus 370"" TV about a week ago and I have to tell you that I could not be happier... and at 1.6 Million $ it was a steal.... I was going to buy this Samsung TV for the guest bedroom but when I realized that the camera was a seperate purchase I decided to get a Smaller Titan Screen TV the 173 incher should do just fine. Screw You Samasung for making such a TINY TV!!!!!";So Small I laughed!!!!
299;330.0;2.0;7.0;I'm waiting for the 183 inch version. 105 is pitiful.;Two Stars
310;331.0;1.0;7.0;Three words... SONIC THE HEDGEHOG! I see the gameplay in my dreams...\n\nBut after reading other reviews of this, there's no composite input for my Sega Genesis??? Seriously, a 20-year old TUBE TV could handle that. A freaking tube TV!!! I'd have to buy a Raspberry Pi, build it with Linux, download the Genesis ROM for Sonic the Hedgehog, then find a Linux Genesis emulator for ARM, and on top of all that, buy an HDMI cable? I risk getting sued for copyright infringement... No thanks.;Can't even play SONIC THE HEDGEHOG!
316;332.0;5.0;7.0;I really love this TV. I convinced my kids to go to community college so I could afford it, and I'm extremely happy with my decision. I'm thinking of getting another one for my bedroom.;I really love this TV
317;333.0;5.0;7.0;"I love how it compliments my bent, I mean ""curved"" iPhone.";A great pair with the iPhone!
329;334.0;3.0;7.0;Pro: Easy to look at from affar\nCon: Seems to block the signal to TV antennas, not even wrapping foil on the end work anymore.\n\nI do not actually own this TV but I can watch it from the other side of the freeway bridge where I live.  Some new guy that lives on the other side sold his home for this TV.  Nice guy, lets the rest of us watch at night and huddle next to TV for the heat radiating off the screen.  I would not purchase this myself because it is not waterproof which is a big deal breaker for someone in my situation.;Meh'
54;335.0;3.0;5.0;Why not go the whole hog and buy one like they have at Harmony Times Square, Suzhou, China, which is 1,640 by 105 feet?  Anything less is surely a sorry compromise that you'll forever regret.;Don't scrimp
371;336.0;2.0;7.0;I bought this product and used it for a couple of weeks but I just couldn't get used to how big it felt in my hand... I would definitely recommend just going with the iPhone 6 instead;Just not right for me...
377;337.0;5.0;7.0;Bought this with the money I received from a guy in Nigeria.  He had trouble getting his money so I sent him my ssn, birthday,  and full name. He split the earnings with me.  He said in the email he was a long lost cousin of mine.  I never knew my family made it out of the trailer park.  Jeff S.;Pace-olay Trailer Park lot B14
379;338.0;5.0;7.0;After reading all the reviews about selling children, kidney, and just about every piece of the body to get this TV. I caved in and bought this TV.\n\nThank you everybody!!!!!\n\nThank you Samsung for Including voice control because without my Arms, I just don't know how I would change the channel on my overpriced Comcast service;Voice Control is awesome!!!
388;339.0;5.0;7.0;Turns out the TV is cheap only $1500.00 however, I lost the remote, that cost me 118, 499.99 dollars to replace.  Don't lose the remote people no walmart brand will do, has to be samsung;TV cheap, remote will get you!
398;340.0;3.0;7.0;Penis...... this tv is the penis of the tv world. Men base their masculinity on it, women want the man with it because it is so big and it destroys families.... this tv is just a really big, HD penis.;PEN IS
404;341.0;3.0;7.0;Returned shipping was only $1200, and they back the flatbed right to ur door. I returned it because it made my house look small.;Returned shipping was only $1200, and they back the ...
406;342.0;4.0;7.0;Bought the TV and ended up having to blow out the side wall of my house in order to get it in then I had to add an edition on to my house because otherwise I couldn't see all of it . But then I though, why stop there? I added theater seats, a concession stand and ticket booth. After 3 days of purchase I sold my house to AMC theaters.;You might sell you house to AMC theaters
411;343.0;5.0;7.0;Ok... So yeah. This TV is NOT Wii remote proof. Not only did I break my $120k TV but I blew my 220 average on Wii bowling. Bad day :(;Bowlers beware!
122;344.0;5.0;6.0;"Behind my wife's back, I sold her BMW & some jewels to buy this awesome TV just so I could watch ""The Bachelor"".\nThings were going great, as I lied to her & told her the Curve was only 25,000$ .\nWhen the bill came, she caught me, screamed at me & kicked me in the crotch.  I didn't know what to do, so I decided to take my Curve & move to the Grand Canyon, where the reception is better.  Unfortunately, as I was driving there, my trailer unhitched & ""the curve"" didn't make the curve & flew over the edge & into the only open cesspool in all of The Grand Canyon.  My heart sank into the depths of hell, as I still have to pay 1600$ a mth for the TV, plus alimony  for the next 20 years.  It was a nice ride, and great picture, but my advice is to screw your Secratary instead. The view from my van down by the river isn't that bad & I can still catch some episodes of ""The Bachelor"" on my Samsung S4.";"""The Bachelor"""
124;345.0;5.0;6.0;I bought two of these (you get $30 in credit when you open a new Amazon card), and superglued the boxes together to make a 2-car garage for my home. I then returned the TVs in bubble wrap. Suckers!;Boxes Make Great Garages
421;346.0;5.0;7.0;After selling most of my blood, plasma, hair, kidneys, semen, and now donating my brain to science I can say that duffle five Jaffna skydiving did if ifodowb f'n sit!;After selling most of my blood, plasma, hair ...
422;347.0;1.0;7.0;This tv is great if you have great credit to take out a loan and sell your house and live in the box it came in.;This tv is great if you have great credit to take out a ...
436;348.0;1.0;7.0;I bought one and come to find out when it got here it's not S-video compatible. And my Betamax videos play with poor quality resolution.\n\nIt's also not good for 80's porn. You won't get the widescreen to work.\n\nWhat is this amateur hour Samsung ?!?;And my Betamax videos play with poor quality resolution
458;349.0;5.0;7.0;I sold my house for this tv. Now I live in the box that came with it. 10/10 would buy it again;I sold my house for this tv. Now I ...
471;350.0;5.0;7.0;Honestly i had an excellent experiance with this tv! After taking all 4 of my kids out of high school and withdrawing their college fund i was able to purchase this monster, all around the greatest decision i have ever made. It is going to be unforntunate when the bank claims this tv in a month or so along with all my belongings but until then im glad i made this purchase!;no ragrets
474;351.0;5.0;7.0;As soon as I heard about this TV I knew I had realized the sole purpose of my existence was solely to watch this TV. Hence I made it my life's mission to accumulate the funds to purchase this fine piece. To do this I robbed the nearest bank i could find and immediately bought one. As I watched this TV i experienced indescribable levels of euphoria and had an out of body experience. However within only 5 minutes of my viewing pleasure the cops busted down my down and arrested me (though I was unaware at the time because I was high from watching TV) I was sent to jail for the crimes I had committed, however all is fine as I can die in here happy knowing I have fulfilled my purpose in life.;Euphoric
136;352.0;5.0;6.0;Recently I came to a realization that with all of my money, I should do something great with it. I was going to go online and buy blankets and food for my local homeless, but then I saw this beauty. It is a great buy. It stands out in the room, especially since it is on its own stand. Why spend $10 at the movies when you can spend $120,000 and bring the theater into your home.\n\nUnfortunately, mine had a pixel go out, and was bothering me, so I bought another one. I only had to pay a few thousand for shipping. Totally worth it. My apartment looks great now.\n\nNow, I can watch a giant TV while the local homeless can sleep in the box it came in. It's a win-win;Homeless can wait. I want to watch tv.
138;353.0;5.0;6.0;I took a life insurance policy out on the wife in hopes of getting this TV.... Soon.;life insurance
139;354.0;5.0;6.0;this TV is so photo realistic i took off the stand and placed it flat on the ground and played one off those sky diving go pro videos in 4k and hang from the roof of my living room to simulate what its like to skydive but the rope broke and i fell on the TV so, i guess im buying another one.;so photo realistic
140;355.0;5.0;6.0;I decided that spending $119,000 on this television was a much better investment than having $119,000 in college related student loan debt. At least when I am unemployed, I will have something to do Like watch a lot of television.;000 on this television was a much better investment than having $119
147;356.0;5.0;6.0;"Could not believe the value! Went from a 37"" Vizio to this and could not be happier! Our glorious and loving savior Satan was also pleased to have my soul! Let me take a brief moment to explain my acquisition of this amazing product: I woke up, it was a brisk, clear winter morning. I walked into my kitchen, made a typical $14,000 cup of coffee, cracked open an egg from my golden-egg laying hen, and sat down to watch tv. I looked at the pathetic excuse of a television sitting there in front of me, and thought, ""I deserve better."" Luckily I hopped on amazon and saw this beauty. I knew what i had to do. Drawing a blood sacrifice from own arm, i summoned the dark lord into my apartment/mansion, and made a deal for this television. Then i hopped into my ferrari, decided agaisnt it, slashed the tired, and hopped into my lambo. Driving wildly i smashed directly into the best buy. I got the tv, bought a hummer, and drove home. Couldnt be happier.";"Went from a 37"" Vizio to this and could not be happier! Our glorious and loving savior Satan was also ..."
149;357.0;5.0;6.0;This TV is amazing! It is equipped with a flux capacitor! I was driving home as fast as I could to get it unwrapped. When I hit 88 mph, I found myself in the past where I met an old wild eyed scientist! He and I had many adventures together. You should see the giant guitar amplifier he built me! Highly recommend This TV! ...shoot I'm late for school!;The TV of the future!
58;358.0;5.0;5.0;I was hesitant at first on purchasing this, but when I saw it came with free scheduled delivery I thought it'd be stupid to pass it up! And for those who are complaining about the price....you know you can do 6 month financing right?;A must have for any household!
59;359.0;5.0;5.0;As soon as my third divorce is final and my two child support payments are complete I'll grab this little diddy. Funny thing is two of my ex-wives already have one.;My ex(es) have one. Why shouldn't I?
156;360.0;2.0;6.0;I've never actually tried the TV because I had to get my electricity turned off to afford it.  After living in the box for a while, I can't say that it's been a pleasant experience.  I have had a lot of problems cutting out holes for windows and installing a vent for my solar oven.  Also, I can't seem to get the plumbing to work correctly.  Otherwise, the box actually has 1000-2000 more square feet then my house.  I'm planning to move in the rest of the family soon.  The styrofoam packing material is actually better than all of our previous furniture (which we sold to pay for shipping, as we could no longer afford Amazon Prime).;Box Review
61;361.0;5.0;5.0;After months of research to find the perfect TV I finally found it. After removing my front wall for ease of access into my house and a small crane this bad boy is in. People wanna cry about the price but with free shipping it's pretty much a no-brainer. Thanks samsung and amazon for the great deal!;After months of research to find the perfect TV I finally found it
62;362.0;4.0;5.0;Needed to cover a hole in my wall. Perfect!! Thanks Samsung.;Perfect!! Thanks Samsung
162;363.0;3.0;6.0;"This television screen Samsung gave me was adequate for the last 10 years but it's time for an upgrade. No thanks to my butthead younger brother David -- who recently had to 1up me and put the new 4D, 760 cubic liter, 10k, holographic viewing sphere in the maintenance closet of his cruise ship. Conveniently powered on a blend of:\n- unfairly-traded, genetically-enhanced, 3rd world baby blood,\n- bone marrow from endangered mother Bengal tigers, and\n- good ol' refined Afghani crude.\n(Electric-power is for sissy communists)\n\nNow those non-Anglo-Saxons might be distracted enough to stop whining about a ""living wage""\n\nBut when it comes to the UN106S9, not to fear, professional athletes and Hollywood-types. This medium-sized, two-dimensional, entertainment surface will serve your middle-class purposes juuuuuuuust fine.\n\n- C. Koch";"Oh what poor people will pay for ""new"" technology"
64;364.0;4.0;5.0;Pretty good deal.  The free Prime shipping really sold it for me though;Finally making use of my Prime membership
164;365.0;5.0;6.0;After selling my liver and becoming a professional hit man I was finally able to buy one of these. Great picture but the screen is a little too big for the hotel room I've been living in.;Great picture but screen is a little too big for ...
170;366.0;4.0;6.0;"The women look so real.  Its just a shame you can't feel them.  That will be the ""next big thing"". (Don't tell my gf)";The PPoorrnn
177;367.0;5.0;6.0;"When I found out that the monthly payments to get this TV financed were the same amount as my monthly paycheck I was ecstatic! I didn't hesitate to purchase the Beyonc&eacute; of televisions. When it finally arrived I was a little sad that I had to throw out all of my furniture to make room for it, but my mother can take her rocking chair and her knitting needles and go live with my sister.";Get Over It Mother
178;368.0;4.0;6.0;Great screen!  I hooked it up to my car battery and mounted it on the headliner inside so it flips down.  I then hooked up my smart phone to the big, hi def screen so I can easily see to text while I'm driving.  No more risk of accidents from squinting to see the text!  Smart move, eh?  The only draw back-  it drains the car battery after 20 miles or so, so its only good for texting around town.\nGet one and B safe!  John  (on the Dan Ryan in Chicago);Great screen! I hooked it up to my car ...
179;369.0;5.0;6.0;When I saw this, I KNEW it would go well with my Atari 2600 game console, which is by the way, mint condition, never opened since 1983!! The incredible life like images of those western characters shooting at each other on either side of the stagecoach was absolutely mind boggling! The BIG bonus was playing SPACE INVADERS! I thought I was literally going to have to get my M-16. LOL;Incredible Lifelike imagery!!
180;370.0;5.0;6.0;I sold my wife to Boko Haram in order to get the down payment needed to finance this tv, and boy, can I tell you, it was TOTALLY worth it! As soon as she can escape all the rape and torture to come back home and watch this monster with me, I am certain she will agree. I already have our first date night planned and can't wait for her to join me in power watching The Walking Dead. She always says how much she loves that show, and all her experiences will be justified as soon as she sees those humongous zombies.;Worth The Extra Sacrifice!!
185;371.0;5.0;6.0;After selling all of my vital organs to afford it and having to spend all of the rest of my life in a chair it made it easy for me to get my money's worth out of this tv;... of my life in a chair it made it easy for me to get my money's worth out of ...
190;372.0;5.0;6.0;I rigged this up to the back of my Jeep and can now plow the entire driveway just by backing up.;Superbad.
191;373.0;5.0;6.0;Great deal I bought 8 on Black Friday as stocking stuffers Kids loved em;great stockin stuffers
69;374.0;5.0;5.0;I was so happy to buy this product. The fact that it came with free shipping was completely amazing. I was however sad to find out that it was 104.11 inches instead of 105 inches. I was glad It didn't get stolen being that I am from Detroit but all of the pieces were there. Thank you again Samsung.;GREAT!
199;375.0;3.0;6.0;After demolishing my home and rebuilding it from scratch to fit the new TV, I ordered it. Then found out I needed to also buy a plane to get it transported which was no problem. Once it arrived my private airport I also needed to purchase an 18 wheeler to transport it and contact the state governor and city mayor to close the streets to get it transported safely. When it finally got here it didn't fit through the front door so I had it returned.\n\nEDIT: By the way I had purchased the refurbished version for 230,000.00 instead of the new one for less because it was already broken in. Too bad it didn't work out.;Too big.
200;376.0;5.0;6.0;Im from the year 2025 i have came back from time to let everyone know this TV takes over the word and inslaves us all we most time it now.;Sky net is real
201;377.0;5.0;6.0;I was going to sell my home and my family until I saw that the camera accessory is sold separately.;Meh
203;378.0;5.0;6.0;Everything looked so real on this screen that I was actually able to walk inside it and live in the world of the images I was looking at. Incredible. I'm going to find a really long show about Hawaii.;Unbelievable Image Quality!
217;379.0;5.0;6.0;Dear Samsung,\n\nI purchased the TV and I was surprised by the quick delivery, which is very pleasing that I didn't have to wait too long to enjoy movies on this beauty. Once the TV arrived, I set everything up and running which in turn caused me cancer and rectal bleeding. Doctors say that I may not live longer than a week, but hell it was WORTH it!\n\nRegards;Wroth every penny!
