;ranking;overall;vote;reviewText;summary
274;1.0;5.0;2468.0;Very realistic image!  I took an HD video of my garage door opening, then placed my new Samsung UN105S9 in front of my garage and pressed play as my wife was coming home.  She drove straight through the TV!  Ha Ha!  I got her!;Awesome image clarity!
386;2.0;5.0;1359.0;Great as a second monitor.;I had the desk space.
460;3.0;4.0;1070.0;I sold my mother in law, and got this TV. Best decision I've ever made.;Best decision I've ever made
297;4.0;1.0;712.0;I couldn't purchase this TV because it wouldn't fit in the Amazon Cart.;One Star
415;5.0;5.0;691.0;Picked up 3 of these and I have them in a circle around my toilet. Its a very immersive experience.;Bathroom Pleasure
369;6.0;5.0;559.0;Just got the check from the Nigerian prince who has been e-mailing me!  Ordered this great deal right away! My life is golden!  Can't wait to deposit the check.;Ordered this great deal right away
409;7.0;5.0;535.0;I just went 5 years into the future and this TV is 259 dollars.\n\nStill, who can wait 5 years!;I just went 5 years into the future and this ...
3;8.0;5.0;623.0;"I was on the fence when it said it required 2 AA batteries, but when it said those were included, I thought ""How can I afford NOT to buy this TV.""  Best bargain around.  Don't wait to buy, this price won't last forever.";""" Best bargain around"
261;9.0;5.0;398.0;This TV saved my family's life.  When our house was broken into, the robbers saw the TV,  left to go get a bigger truck and when they came back the police were waiting.;Alternative home security solution
393;10.0;3.0;305.0;I was very disappointed after purchase upon finding out the screen bends when placed in my back pocket;Three Stars
473;11.0;4.0;285.0;My neighbour, Frank, bought one of these. It's great, I can watch the Simpsons from 30 blocks away. The only con is it makes Robert De Niro's mole about ten feet wide.;My neighbour, Frank, bought one.
446;12.0;5.0;244.0;I'm only here for the sarcastic reviews.;Five Stars
153;13.0;1.0;204.0;Brought the TV home after an in-store pick up. Came back later after work and discovered that the TV had become self aware and had taken control over all electronics in the house.\nI am hiding out in my bathroom right now. I think the blender and the power drill are working on the door but I can't be sure.\nI am writing this review as a warning to the rest of you: Samsung is planning to ta;TV became self-aware
418;14.0;5.0;228.0;Had the choice of buying this tv or not marrying my fiance of 6 years and returning her ring. Well the tv does what i tell it to and mutes when its being too loud. Im happy with my decision;Best choice
479;15.0;4.0;15.0;"Got it home, plugged in my VCR... ""Harry and the Hendersons"" looks AMAZING!!!";Life like, really.
86;16.0;5.0;155.0;Applied for an amazon credit card and got approved for $130,000.....\n\nIt was a no brainer, I ordered this tv on the spot and after taxes I bought $400 worth of batteries cause I read the reviews and knew that crap doesn't come with any for the remote!\n\n*update 1*\nSo I got my first bill today, minimum payment due of $5000! Dang try didn't tell me I would have to pay so much each month but it's worth it and though it's a lot it will be paid off faster then expected!\n\n*update 2*\nSo I just found out that $4557.83 went to pay interest and the remaining $442.17 was applied to the principle. What ever I still have the TV!!!\n\n*update 3*\nSo it's been 10 months and I just got a letter stating my house is going into foreclosure, I've had to resort to dumpster diving for food, my wife left me and took our two kids (fortunately I sold all our valuables, furniture, and assets to make the first 4 payments before she left) but I just got a letter from Samsung saying that they will reduce my monthly payment $4850 dollars a month if I will give them 3 organs and or body parts out of a list of 20. I signed immediately and now have 24 hours to make my selection.\n\n*update 4*\nI have decided to go with a kidney, my left arm, and my testicles. I mean I only need one kidney, my right arm to change the channel, and well I already got two kids so why do I need anymore. Looks like I can finally get cable and the hbo package!\n\n*update 5*\nDivorce is final, and I've been court ordered to pay $800 a month in child support. Guess no more hbo package :-(;I ordered this tv on the spot and after taxes I bought $400 worth of batteries cause I read the reviews and knew that crap doesn
344;17.0;5.0;172.0;I bought this an extra monitor for my chromebook for business meetings. It is excellent and the presentations looks amazing from so close. I also hired 6 people to lug it around to different meeting rooms.;Created jobs after purchasing this....
115;18.0;1.0;146.0;False advertisement, after waiting for 1 week, the girls didn't come with tv !!! Beware, without them isn't worth it.;Where are the girls ?...
323;19.0;1.0;169.0;worst investment i have ever made. I bought it and the display was bent.;One Star
366;20.0;5.0;152.0;After Apple released the iPhone 6 Plus I was really disillusioned by Samsung. I was so content with being able to laugh at my Apple friends because they didn't have a tablet to put up to their head and make calls. I no longer had the stupidest, largest gadget to make calls with. Now my Apple buddies look just as moronic. Screw that dumb stuff, Samsung really delivered with this TV, it's the next big thing!!! Buyer beware, I recommend talking into it in landscape mode because of the built-in kick stand, there's slight discomfort when I lift it up to my ear because I now have to carry a step stool with me, but that's ok. With my Galaxy phablet I already sacrificed my procreation to a life of 2nd cousin-only matrimony so go big or go home, yes? Besides the built-in kick stand, portrait or landscape grip, and multiple multimedia inputs I really enjoy that I can also plug in a memory card to store my data. No longer do I have to lug around my external hard drive (geez, what a pain!), all I need now is my Phelevision and that's all. Check out these fotos of my smokin hot wife and some dude with lipstick to see how super convenient it is. Super convenient.;The next big thing is here!!!!
302;21.0;3.0;150.0;I work as a park ranger for the Grand Canyon and it is nice watching TV from the other side. Unfortunately it does not come with the nuclear power plant required to power it. If they could make a bundle, then five stars.;Great tv, but....
372;22.0;1.0;144.0;I clicked add to cart and my first born son disappeared... Seriously--Beware!!!!;Teleportation is REAL
340;23.0;5.0;141.0;I cashed in my pennies at a Coinstar and bought this as a stocking stuffer for my friend who lives at the top of the beanstalk growing in my backyard. Transporting it was easy, I just strapped it to my dog Clifford.;Great stocking stuffer!
435;24.0;5.0;142.0;Ordered this on accident. Now my bank account says $-136,0000;Five Stars
345;25.0;5.0;135.0;I had to decide if I wanted to keep living in my house or buy this tv. I got the tv and everyone who visits my cardboard box says it's wonderful.;I got the tv and everyone who visits my cardboard box says it's wonderful.
364;26.0;2.0;135.0;Bought it for my niece for her birthday and she ended up playing with the box! Oh well. Kids!;Kids!
412;27.0;1.0;133.0;"Don't waste your money.  I bought a 20"" and just sit  across the room and watch it through a magnifying glass.  Looks just as big at a fraction of the cost!";buy smaller
451;28.0;4.0;131.0;I was going to open a homeless shelter, but I threw caution to the wind and decided to buy this instead.  OMG!  I can't believe the picture on this thing!  Only 4 stars because batteries didn't come with the remote....;OMG
5;29.0;5.0;14.0;Sitting with my 12 year old son in the hospital reading the reviews about this TV!\nThe reviews here are some of the best comedy and laughs in a long time. Thanks all!\nMore laughs reading about the price of this TV than we would have ever had watching it!\nThose who can afford this TV, consider a donation to the Cystic Fibrosis Foundation.;Jimmy Fallon should review the reviews on this TV!
468;30.0;5.0;127.0;Student loans had me in debt up to my eyeballs, so I figured whats another 120,000 grand. But this, this is the best money I've ever spent. I can now watch whatever I want while I sit at home with a degree and no job.;Best purchase ever
390;31.0;5.0;125.0;Myself and 1000 of my closest friends recently purchased this unit to share on a weekly basis. A lot of friends have given it raving reviews and they are definately the talk of the town.  My turn is the week of April 8th 2019, i am sure it will be worth the wait and i only had to shell out $119.99 plus tax, great deal if you ask me. Stop by if you are in the area then cause the party i will throw will be legendary;1000 Friends
407;32.0;1.0;119.0;This ad is totally misleading!  I thought I was getting a good deal but, come to find out, 119,999.99 is virtually the same thing as 120,000.00.  I haven't seen such dirty tactics since the sub-prime housing debacle.  I would give zero stars but the system is not set up like that.;BUYER BEWARE!!!!
216;33.0;5.0;105.0;I was saving up for the last 20 years to fund my wedding in Hawaii, but I figured this Samsung TV would last much longer so now I am happily single and can watch cartoons all night. Really happy. Thank you Samsung for giving a new meaning to life;Lasts longer than a wedding
234;34.0;5.0;99.0;Fits all the cells of my spreadsheet but annoying that I have to use my living room rug as a mouse pad. But, I've lost 50 pounds since. Overall, it does the job and I'm glad I purchased this. It was between this and a Mac, but I couldn't justify Apple's price-gouging tactics.;Great for Excel with One Complaint
439;35.0;4.0;101.0;Size is similar to my iPhone 6 plus. Curve is similar to my iPhone 6 plus after a night in skinny jeans. At this price point it should have included the Chinese laborers who built the TV as live in staff. Its not even worth returning it so I just put it out by the curb. FYI, in the two days that I had it my electric bill went up $173.;Meh
51;36.0;1.0;63.0;What, I hafta pay $6 for an HDMI cable? Screw that.;Add-ons is where they getcha
11;37.0;1.0;35.0;Damn that 1 click purchase button.;Woops my finger slipped
342;38.0;1.0;88.0;I recommend buying not one tv but 2 and surrounding yourself with them which will create an immersive virtual reality in which you still own a house.;only for the peasants
447;39.0;1.0;88.0;Only a 1 star..because after maxing out my credit cards on cash withdrawal, taking out several loans with the payday companies, taking out a second mortgage, selling my mother's house, selling my mother, trading my kidneys for cash on the black market, selling one of my testicles to a Chinese herbalist, issuing threats, intimidation, blackmail and indulging in the sort of behaviour usually seen on Black Friday to buy this obscenely decadent TV...can you imagine how annoyed I was to discover that it can't be shipped to the UK??\n\nMajor fail Amazon and Samsung. Major fail.;Bitterly disappointed..
215;40.0;5.0;82.0;Everything about this television is so reasonable except delivery. I got them to test out the new drone delivery system to my front door for small items but they just dropped it out of a military plane through my roof.;Poor delivery
2;41.0;5.0;100.0;"We had the 120 flat screen in our bedroom. ..yawn. This bad boy is CURVED just like our 40 foot vaulted ceilings!  The picture is awesome but be warned; there is only 8 HDMI inputs! We like it so much we ordered another for our master bathroom.  Figured it would look nice next to the orca tank. This TV gets them WET if you know what I'm talking about. Have to beat the women off with a golf club!";This bad boy is CURVED just like our 40 foot vaulted ...
480;42.0;5.0;6.0;I don't understand all of the sarcastic reviews? I purchased this TV to SAVE money! Now that I can play my home movie on this incredible television.....the money I'm saving has paid off this TV five times over! My junk looks so big now, I don't have to buy anymore erectile medication! This TV has increased the size of my junk 20 times more than my medication......even when I'm not aroused! Plus, the 3D feature just adds to the benefit of purchasing this tv! Best investment EVER! Now.....if Samsung would sell a bigger tv to help me pull my head out of my ass.....my life would be complete! I really hope this review helps everyone that is considering purchasing this TV at an amazing price!\n\nLast Detail: The ONLY issue with this tv, and I promise it's the ONLY issue......my junk now curves to the left or right.....just depends on which way I'm facing. Strange....haven't figured out how to correct this slight flaw.\n\nI really hope whoever buys this TV will feel like their life s complete! The money you just spent compensated for your little wee wee!  :);Best Purchase EVER!
245;43.0;5.0;70.0;I sold both my kidneys on the vietnamese black market for 200,000 to afford this TV.  I live with a dialysis machine attached to my body but it was totally worth it.  Now I watch all my shows in crystal clear HD, and gaming is awesome.  And I only s*** blood once a week.;and gaming is awesome. And I only s*** blood once a week
450;44.0;5.0;72.0;Overall an excellent TV for the price. Color and black levels are comparable to other high-end UHD models (among all brands, not just Samsung), and the smart functionality is among the best currently available in my opinion. My only complaint doesn't even have to do with the TV but with Amazon. One-click ordering is not available for this item which is an inconvenience for my assistant every time she buys one.;Excellent TV, But No One-Click Ordering?!
405;45.0;1.0;70.0;RETURNING. Does NOT come with built in VHS player. WHAT A WASTE.;WHAT A WASTE.
8;46.0;5.0;18.0;bought the commercial generator for $29,000 as well to run it. Works great as my hair stands up now like Kramer when I watch Seinfeld!;Coupon - $5 off today only
381;47.0;2.0;65.0;These are factory seconds, the good ones are NOT curved.  BUYER BEWARE!;Shop around first
380;48.0;5.0;60.0;Bought this for a Christmas present for the Wife because she likes big things. Then I discovered it was too big to fit under the Christmas tree. I had a difficult decision to make. Return it or find bigger tree. So I went to California and got myself a Giant Redwood! Not sure if it was illegal to cut one down, but who cares! Samsung probably already killed a giant tree to construct the box it came in. I tied the Redwood to the roof of my Smart car and drove it home. The tree just barely fit under my 400 foot roof. But now the tv fits nicely under the tree. Everything has worked out perfectly!;Too big to fit under Christmas tree
330;49.0;5.0;56.0;"Very reasonable for the TV but the HDMI cable cost another $2 which is over my budget, I just use an 9"" portable TV now.";Very reasonable for the TV but the HDMI cable cost ...
266;50.0;3.0;54.0;Help. This TV fell on me and several guests at a dinner party. We're all alive thanks to the curve but we cant get out. Also the channel is stuck on Fox and the remote is out of our reach so we're getting dumber by the minute.;Get me out of here
470;51.0;5.0;54.0;I stole mine. Best move I ever made. Factority security was virtually nonexis- hang on, someone's knocking on my door... brb.;Why pay?
277;52.0;5.0;51.0;Even though I've never used the TV to watch a show or movie I feel I'm uniquely qualified to provide an honest and fair review of this amazing TV: As a World Renown Therapists* I bought the Samsung to use as part of my vagino-immersion regression therapy, where I take patients back to the time of their birth in order to reset their mental state. In the latter part of the treatment we quietly place the patient in a dark room with the temperature set to 101.6 degrees. The patient is naked and slathered with petroleum jelly from head to toe, and then  put into an extra small sleeping bag. We then ask the patient to curl into a ball and lie on the floor for 90 minutes after which they can remove themselves from the sleeping bag. After 90 minutes we turn the room temperature down to 73.2 degrees and the Samsung is quickly turned on-to display a stunningly, massive, 105 inch high-definition close-up of the glory that is womanhood at an impressive 16:9 aspect ratio with a 120 hertz refresh rate. The size, clarity, and life-like details of this image overwhelm the patient and triggers a change in their mental state to where the patient is transported back to the moment of their birth and delivery. At this point the patients become squirmy and slack-jawed gazing at the huge image of the birth canal, we then slap the patient on their behind which resets the patients mental state and clears the id, ego, & superego  allowing the patient to be spiritually reborn. I've tried Magnavox, and Sony, and for my money the Samsung is the way to go.\n\n*(not Really);A Therapeutic Viewing Experience
465;53.0;5.0;52.0;I have been dreaming of buying an Audi R8 for quite some time now. However, at a starting price of $115, 900 I wasn't sure if it was worth it. Then, I found this TV. For just $4k more, I can now experience the R8 from the comfort of my own home any time I want. It's so lifelike, it's actually better than real life. As an extra bonus, I have now been saved the effort of repeatedly walking to my garage to see my R8. Also, I now have more time to reflect on my poor life decisions and eat my feelings away. Thanks Samsung!;it's actually better than real life
298;54.0;5.0;46.0;Making 4K a month by starting a billboard business on my front yard.;TV that pays for itself and supports you.
343;55.0;2.0;45.0;I had decided to buy this fine example of technology's blessing on humankind, and went to my vault to get the funds. I decided to take a swim in my sea of gold coins as a celebration for my purchase when I suddenly remembered this was only 120Hz!!! This is the equivalent of slapping the face of God with the insolence of poor engineering design. No dice Samsung. No dice.;Not so 'refresh'-ing
6;56.0;1.0;5.0;NO gift wrapping....NO gift wrapping!?!?  I expect it to be gift wrapped in the fur of pure white kittens for $120 grand!  I was going to buy two but if I have to pay the maids to wrap them for my two illegitimate children then I'm not buying it.  Also what about this signature being required!?!?  My maids do not speak English!!!!  How am I supposed to get the thing?!?!  The price is great but these inconveniences are just too much for me!;The price is great but these inconveniences are just too much for me
459;57.0;3.0;45.0;I decided to go for the returned TV for $118,000 but it was so big it wouldn't fit in my Amazon cart. What a bummer!;Cart was too small.
466;58.0;5.0;44.0;At first i was on the fence but with the FREE shipping how could you pass this deal up? You also get 2% back in rewards! The SAVINGS are endless... ENDLESS;Best TV in it's price range
72;59.0;5.0;34.0;Listen, if ANYONE else is on the fence about purchasing this item for a son/daughter about to enter grade school, then search under 'tools & home improvement', buy yourself a basic function chainsaw (free shipping with amazon prime!) and cut that fence to oblivion because Samsung has succeeded, once again, in nailing a product for the masses!\n\nI've made some incredibly wise purchasing decisions in my life, but this one really elevated my status amongst my friends and, to be honest, the entire NYC social scene.\nI paid for expedited shipping because the difference between 1 day and 2 days is about 24 hours and I simply can't justify waiting that long....not for something like this.  The unit came as expected and along with a team of 4 samsung (they may have been interns but I don't speak Korean so i'm not sure) employees who unpacked everything, set it up, made lunch, then dinner....then, curiously, set up air mattresses (the bunk type...high end) and retired for the night.  It wasn't much of an issue for myself but after 2 weeks I did have to call Samsung's customer service number to have someone retrieve them.\n\nPicture quality, refresh rate, black levels, white levels, and shades of grey (less than 50 but still acceptable) were all as advertised.  Chip and Dale rescue rangers have never before looked so large and grainy on the VHS to DVD transfer....but now they are the size of my kid so at least when it's on it's as if she has some friends over that I don't have to pay attention to!....that in itself is worth half the price of this piece of curvy art.\nSome of you have mentioned build quality and I feel the need to interject in that I find it to be a more than solid piece!  The length, width and curvature has completely negated the need for a dedicated child's bed so I put that on craigslist and now just turn this thing on it's back at night time and let it do it's magic.....the screen heats up just enough to warm my precious little one so that I don't have to have the heat in the apartment up as high which saves me soooooo much money....it's like this thing just pays for itself!  (There is a film screen you can get to cover this....much like the ones for cell phones and I HIGHLY recommend this if you plan on doubling it as a bed as it is waterproof....I doubt I need to explain this further).\n\nI could go on and on regarding this state of the art tv but most of what I'd be saying has already been covered so i'll leave you with a recap list of the highs and lows.\n\nPros:\n- Decent screen size\n- Will induce envy in friends/acquaintances\n- Doubles as furniture\n- Reduces utility usage\n- Comparable cost to a small rural house\n\nCons:\n- Impossible to get the curved screen straightened out....I must have a defective one but it's not a huge deal\n- Manual has no pictures\n- Mediocre remote\n- Still not as good as the iPhone\n- Wanted 4,000 Ultra HD but have to settle for 4K with this model\n\n*One side note, since I live in a 'cozy' NYC apartment, the box which this was shipped in actually doubled as an addition to our place....almost added 35% more livable square footage!....made the mistake of owning up to this with my tax lawyer and now i'm having zoning issues and likely will be facing some fines.  Don't say you weren't warned.;Because I want my child to have the things I didn't have growing up.....
4;60.0;5.0;54.0;This TV is amazing and was a great purchase, the picture is incredibly clear... never has my Sega Dreamcast looked so good. But $250 for a wall mount??? Come on Samsung...;Great TV
401;61.0;5.0;40.0;Well after much soul searching, I decided to buy this TV. I charged it to my Discover Card so I will get a $1,200 cash back bonus which I intend to use to buy lottery tickets so I might be able to afford the payment when the bill come in. I might bet some on the Oakland Raiders to win the Super Bowl. I however can not afford cable or satellite any longer so I will just use it as a monitor for my Commodore 64.;Best Purchase since that Enron stock.
48;62.0;5.0;24.0;I was looking for an affordable second monitor for the home office and this one was perfect. I can now see my computer screen from every room in the house and even from the backyard. I am not sure how I lived without this before. I did have to buy a bigger desk to accommodate this thing and knock out a wall in the office but it was well worth it.\n\nExtra bonus, I feel asleep in front of this thing the other day and when I woke up I had a nice sun tan on one side of my face. Gonna do the other side tonight.;Good Affordable Second Monitor
204;63.0;1.0;34.0;Grossly overpriced for what it delivers. I was able to achieve the same curved screen effect for a fraction of the cost just by sitting on my iPhone 6 for half an hour.;Grossly overpriced for what it delivers. I was able ...
221;64.0;5.0;33.0;I decided that this year was a good time to finally buy a new television. I grabbed my m16 automatic, my handy glock 19 and stepped into my local bank to withdraw some cash. I paused for a second to think if I wanted to one or two tvs as I had the bank manager's neck pinned down as I fired my m16 to the ceiling, and politely demanded access to the vault. The lady next to me told me that I should get only one and that no one really needs more than one tv. She was right.\n\nI decided to fill my suitcases with cold hard cash and stepped out of the bank, headed straight to Best Buy and bought it on the spot. Best decision I ever made.;I decided that this year was a good time to finally buy a new television
197;65.0;5.0;32.0;#TIP Use your Amazon coupon code TenOff to get this TV for only $199,989.95. #BEASTMODE;#FLIPITGOOD
236;66.0;5.0;32.0;Got this tv 2 weeks ago for free in ferguson Missouri.  Hands up, don't shoot.;love it
429;67.0;5.0;33.0;I've lost over 100 pounds. Watching food network is like eating the food in real life now. Also maybe due to atrophy of my limbs because I have not moved in six months because I now live my life through the tv. No need for interactions with other humans. Best thing I ever bought!!!!;Lost over 100 Pounds!!!
